image-src,image-alt,headline,paragraph,link,link-text,link2,link2-text
/media/carousel/vr_cdil.jpg,Participants in the CDIL summer symposium 2017,CDIL Digital Scholarship Fellowships,"Paid fellowship opportunities are available for faculty and students at the Center for Digital Inquiry & Learning! Apply by March 15th.",https://cdil.lib.uidaho.edu/,Fellowship info
/media/carousel/book-book-pages-close-up-1836048.jpg,open book,Think Open Fellowship applications are open!,"Applications for 2019 <a href='https://libguides.uidaho.edu/c.php?g=772392&p=6590405'>Think Open Fellowships</a> are now open. Apply by March 29th for this great opportunity to make an impact on education affordability!",https://libguides.uidaho.edu/c.php?g=772392&p=6590405,Apply now!,
/media/carousel/aerial-imagery-app.jpg,aerial imagery,Idaho Aerial Imagery Explorer,"A new interface to discover, explore, and download digital georeferenced aerial imagery for Idaho.",https://www.insideidaho.org/apps/imagery-explorer/,Explore,,
/media/carousel/ricky-kharawala-308072-unsplash.jpg,Ricky Kharawala photo,Library Workshops!,The library hosts workshops every week. Join us to learn about tools that impact your research or kick start your projects!,https://www.lib.uidaho.edu/services/workshops/,Schedule,,
/media/carousel/ross_notext2.jpg,Ross Miller,What Does Your Library Look Like?,"Ph.D. Student Ross Miller (Physics '22) is one of the Library's <a href='https://libguides.uidaho.edu/THINKOPEN'>ThinkOpen Fellows</a> using Open Educational Resources (OER) to help save students money.",https://www.lib.uidaho.edu/open/thinkopen_ross.html,Read Interview,,
/media/carousel/LH.III.1453-slide.jpg,Lionel Hampton and his band,Jazz Fest Exhibit: Here's to the Band,"An exhibit highlighting Lionel Hampton and his band will be on display January 14th through March 11th in honor of the <a href='https://www.uidaho.edu/class/jazzfest' target='_blank'>Lionel Hampton Jazz Festival</a>.",https://www.lib.uidaho.edu/special-collections/index.html#exhibits,Visit,,
