image-src,image-alt,headline,paragraph,link,link-text,link2,link2-text
/media/carousel/LibrarySpring.jpg,flowers in front of the library,Library Services Go Online,"As part of the statewide response to COVID-19, the library building will be closed until further notice. We continue to offer extensive online resources. Please check our COVID-19 Page for up-to-date information.",https://www.lib.uidaho.edu/covid19/access.html,Online Resources,
/media/carousel/swank.jpg,film covers,Featured Resource: Swank Streaming Video,The Library's subscription to Swank Digital Campus offers streaming of feature films and documentaries produced by major Hollywood and independent studios.,http://ida.lib.uidaho.edu:2048/login?url=https://digitalcampus.swankmp.net/unividaho295672/#/digitalCampus/browse,Explore,
/media/carousel/vpod-canarium3.jpg,Covers from Canarium Books,Vandal Poem of the Day,"In its five years, VPoD has published over 650 poems from more than 200 poets. This year the site features poems from Canarium Books and Flood Editions.",https://poetry.lib.uidaho.edu/,Read More Poems!,,
/media/carousel/safari.jpg,Safari ebooks,Featured Resource: Safari Books Online,"Access thousands of ebooks, videos, and courses in tech, business, communications, design, management, and more with O’Reilly’s Learning Platform for Higher Education.",http://ida.lib.uidaho.edu:2048/login?url=https://www.safaribooksonline.com/library/view/temporary-access/,Explore,,
/media/carousel/lisa_mylibrary5.jpg,Lisa Jones in the library,What Does Your Library Look Like?,"Explore our new <em>My Library</em> stories highlighting students and little-known library services.",https://www.lib.uidaho.edu/mylibrary/,My Library,
