image-src,image-alt,headline,paragraph,link,link-text,link2,link2-text
/media/carousel/I-Tower_Frost_2.jpg,"I-tower frost from UI Media Photoshelter",Ask A Librarian!,"The library can be a confusing place. If you ever need help figuring out how to best use our many resources, don't hesitate to ask!",https://www.lib.uidaho.edu/help/,Contact Us,
/media/carousel/swank.jpg,film covers,Featured Resource: Swank Streaming Video,The Library's subscription to Swank Digital Campus offers streaming of feature films and documentaries produced by major Hollywood and independent studios.,http://ida.lib.uidaho.edu:2048/login?url=https://digitalcampus.swankmp.net/unividaho295672/#/digitalCampus/browse,Explore,
/media/carousel/lisa_mylibrary5.jpg,Lisa Jones in the library,What Does Your Library Look Like?,"Explore our new <em>My Library</em> stories highlighting students and little-known library services.",https://www.lib.uidaho.edu/mylibrary/,My Library,
/media/carousel/safari.jpg,Safari ebooks,Featured Resource: Safari,"Access thousands of ebooks, videos, and courses in tech, business, communications, design, management, and more with Safari Books Online.",http://ida.lib.uidaho.edu:2048/login?url=https://www.safaribooksonline.com/library/view/temporary-access/,Explore,,
/media/carousel/vpod-canarium3.jpg,Covers from Canarium Books,Vandal Poem of the Day enters Fifth Year,"In its five years, VPoD has published over 650 poems from more than 200 poets. This year the site features poems from Canarium Books and Flood Editions.",https://poetry.lib.uidaho.edu/,Read More Poems!,,
