colltitle,path,shorttitle,cdmtitle,items,webitems,cdmid,status,featured,cb-data,cb_cdm_branch,branch_notes,repo_location,last_cb_update,about_page,website,categories,type,alpha,shortdesc,description,mediatype,location,lat,long,datestart,dateend,image,imagelink,imagetitle
Idaho Civilian Conservation Corps,cccidaho,CCC Collection,Idaho Civilian Conservation Corps,822,822,cccidaho,visible,y,,cccidaho,,,2020-08,yes,https://www.lib.uidaho.edu/digital/cccidaho/,Idaho; Fire; Forests; Wilderness;,Collection,Civilian,"A collection of maps, images, and documents pertinent to the history of the Civilian Conservation Corps in Idaho","A collection of maps, images, and documents pertinent to the history of the CCC in Idaho representing the research discoveries of Patricia Hart and Ivar Nelson, who spent over two years traveling across the state to find and scan materials related to the CCC.",images; documents; maps;,Idaho,47.012456,-116.265435,1933,1942,cccidaho,https://digital.lib.uidaho.edu/cdm/ref/collection/cccidaho/id/0,Camp Deep Creek
Idaho Football Covers Collection,footballcovers,Gameday Covers,Vandal Football Program Covers Collection,148,148,football,visible,,,football,,,2020-07,yes,https://www.lib.uidaho.edu/digital/footballcovers/,UI; Campus; Idaho; Sports;,Collection,Football,"50+ Years worth of Vandal Football Gameday Program Covers, 1908 - 1967",The Idaho Vandals Football Historical Game day Program Covers Collection consists of over 50 years worth of game day program covers (1908-1967) produced for football contests that took place all over the country.,images,"University of Idaho (MacLean Field, Neale Stadium); Moscow, ID; Arizona; California; Montana; West Point, NY; North Dakota; Oregon; Utah; Washington State University; University of Washington;",46.727012,-117.01645,1908,1967,footballcovers,https://digital.lib.uidaho.edu/cdm/ref/collection/football/id/60,UI vs. Farragut
Idaho Forest Wildlife and Range Experiment Station Collection,fwres,Forest Wildlife + Range,Idaho Forest Wildlife and Range Experiment Station,233,77,fwres,visible,,,fwres,,,2020-11,yes,https://www.lib.uidaho.edu/digital/fwres/,Forests; Idaho; Northwest; UI; Water; Rangeland; Wilderness; UIResearch,Collection,Forest,"UI-led research on topics ranging from Idaho&apos;s forests and hydrology to rangeland, fisheries, and wildlife, published from 1954 to the present","Over 200 documents and reports created by faculty in the UI Foestry Department of the College of Natural Resources, 1954 to the present",images,"Moscow, ID",46.72929,-117.012801,1954,2014,fwres,https://digital.lib.uidaho.edu/cdm/ref/collection/fwres/id/4,Focus on Renewable Natural Resources Fiscal 1981 Annual Report
The Idaho Forester Collection,forester,Forester Collection,The Idaho Forester Collection,77,233,forester,visible,,,forester,,,2020-06,yes,https://www.lib.uidaho.edu/digital/forester/,Forests; Idaho; Northwest; UI;,Collection,Forester,"The University of Idaho Forestry Department&apos;s Annual, 1917 - 1997","The Idaho Forester was published annually from 1917 - 1997 by the University of Idaho&apos;s forestry program. The journal combines research articles, UI program activities information, and analysis of the forest products industry, formerly the dominant industry in Northern Idaho. The collection was developed with the support of a Project Ceres Grant from the Center for Research Libraries and the United States Agricultural Information Network.",documents,"Moscow, ID",46.729399,-117.012629,1917,1997,forester,https://digital.lib.uidaho.edu/cdm/ref/collection/forester/id/1104,The Idaho Forester - 1935 (Vol. 17)
Idaho Forestry Research Collection,forestryresearch,Forestry Research,Idaho Forestry Research Collection,478,478,forestryresearch,visible,,,forestryresearch,,,2021-04,yes,https://www.lib.uidaho.edu/digital/forestryresearch/,Forests; Idaho; Northwest; UI; UIResearch,AltCollection,Forestry,Documents and images from miscellaneous collections pertaining to the history of forestry in Idaho,Documents and images from miscellaneous collections pertaining to the history of forestry in Idaho,documents; images,Idaho,46.926875,-116.501427,1911,1983,forestryresearch,https://digital.lib.uidaho.edu/cdm/singleitem/collection/forestryresearch/id/49/rec/40,DDT Application
Idaho Historical Aerial Photographs,uiiap,Historical Aerial Photos,Idaho Historical Aerial Photographs,2021,2021,uiiap,visible,,,aerial,,,2020-06,yes,https://www.lib.uidaho.edu/digital/aerial/,Idaho; Maps; Forests; Water,AltCollection,Idaho Historical Aerial,Historic air photos of Idaho from 1927 to the 1980s,The Idaho Historical Aerial Photographs are a collection of both oblique and vertical historic air photos ranging from 1927 to the 1980s.,images,Northern Idaho,47.431308,-116.92337,1927,1953,uiiap,https://digital.lib.uidaho.edu/cdm/ref/collection/uiiap/id/1366,"Harrison, Lake Coeur D'Alene"
Idaho Historical Maps,spec_hm,Idaho Maps,Idaho Historical Maps,9,9,spec_hm,visible,,,spec_hm,,,2020-11,yes,https://www.lib.uidaho.edu/digital/historicalmaps/,Idaho; Northwest; Maps; Mining,AltCollection,Idaho Historical Maps,"A small collection of large historic maps, 1887-1984","A small collection of large maps that depict the Coeur D'Alene mining region, covering areas of Montana and Idaho (Shoshone County). These maps come from the Bunker Hill Mining Company Records, 1887-1984, a manuscript collection held by the University of Idaho Library's Special Collections &amp; Archives department.",images,"Shoshone County, ID; Wallace, ID; Kellogg, ID; Burke, ID; Silver Valley, ID; Mullan, ID; Wardner, ID;",47.686824,-116.726818,1863,1951,spec_hm,https://digital.lib.uidaho.edu/cdm/ref/collection/spec_hm/id/7,Coeur D'Alene National Forest
Idaho Queered,,Idaho Queered,,46,46,,visible,,,,cb not standard,https://github.com/thecdil/queered_source,2021-05,yes,https://www.lib.uidaho.edu/queered/,Idaho; UIResearch; Oral History,CDIL,Idaho Queered,Proud Histories from the Gem State,"Idaho Queered is a collection of LGBTQ+ Oral Histories that were recorded during 2017-2018. Featuring interviews with queer Idahoans that detail their experiences with coming out, fighting discrimination, and navigating the particular challenges of their lives, the project aims to help preserve LGBTQ history through audio and video storytelling.",videos; transcripts,Idaho,46.729399,-117.012629,2017,2018,queered,,State of Idaho with participant's images representing counties
Idaho Snow Loads,idahosnow,Idaho Snow Loads,,,1,,visible,,no,,,https://github.com/uidaholib/idahosnow_source,,,https://www.lib.uidaho.edu/digital/idahosnow/,Idaho; Construction;,Application,Idaho Snow,An interactive snow load application based on geographic areas in Idaho.,"This resources relates to the report &apos;Ground and Roof Snow Loads for Idaho,&apos; which was released in 1986 by the Department of Civil Engineering at the University of Idaho. To read the report and it&apos;s appendices, click on the cover. To use the map, click on the map. This map has been made possible by several years of nonfunded work. We respectfully request that if you use this map or report for commercial purposes, you purchase a pdf/map (information at top right) or donate to the University of Idaho Library.",documents,Idaho,43.492285,-114.411621,1986,1987,idahosnow,https://www.lib.uidaho.edu/digital/idahosnow/elevation.html,Idaho Snow Load Map
Idaho Waters Digital Library,iwdl,Idaho Waters,Idaho Waters Digital Library,476,478,idahowater,visible,,,iwdl,cb not standard,,2020-10,yes,https://www.lib.uidaho.edu/digital/iwdl/,Idaho; Water; Wilderness; Mining; UIResearch;,Collection,Idaho Waters,"Scientific and technical reports, with an emphasis on Idaho Water Resources Research Institute reports and publications","The Idaho Waters Digital Library provides access to information resources relating to water issues in key Idaho river basins. The collection presently includes scientific and technical reports, with an emphasis on [Idaho Water Resources Research Institute](https://www.uidaho.edu/research/iwrri) reports and publications. Documents can be browsed by [Location](map.html 'Browse by Map'), [Date](timeline.html 'Browse by Time'), and [Subject Term](subjects.html 'Browse by Subject') by using the tabs above. The database can also be queried extensively using the [Table](table.html 'Browse/Search by Table') feature. This project would not have been possible without the grant support of the [United States Geological Survey](https://www.uidaho.edu/research/iwrri/aboutiwrri), the administrative support of the [Idaho Water Resources Research Institute](https://www.uidaho.edu/research/iwrri/aboutiwrri), the metadata &amp; digitization work of Warren Bromley-Vogel, and the conceptual efforts of Jodi Haire.",documents,"Idaho; Coeur D'Alene, ID; Lewiston, ID; Boise, ID;",43.608655,-116.193734,1963,1984,iwdl,https://digital.lib.uidaho.edu/cdm/ref/collection/idahowater/id/71,Research in water resources for Idaho
INSIDE Idaho,,Inside Idaho,,,,,visible,,no,,,https://github.com/uidaholib/inside_source,,,https://www.insideidaho.org/,UI; UIResearch; Maps; Environmental;,AltCollection,INSIDE Idaho,"Interactive database that provides access to geospatial data and information by, for, and about Idaho.","INSIDE Idaho is the official geospatial data clearinghouse for the State of Idaho. INSIDE Idaho serves as a comprehensive geospatial data digital library, providing access to, and a context within which to use, geospatial data and information by, for, and about Idaho.",images; data,Idaho,,,1998,,insideidaho,,
Institutional Repository,ir,UI Repository,Institutional Repository,106,106,IR,visible,,no,,,,,,https://digital.lib.uidaho.edu/digital/collection/IR/,UIResearch;,AltCollection,Institutional,Documents and images from miscellaneous collections pertaining to the history of forestry in Idaho,Research articles and other documents produced by individuals and entities from the University of Idaho.,documents,"University of Idaho; Moscow, ID;",46.727309,-117.012272,2000,2016,ir,na,na
Intermountain Forestry Cooperative,iftnc,Forestry Coop,Intermountain Forestry Cooperative,39,39,iftnc,visible,,,iftnc,,,2020-12,yes,https://www.lib.uidaho.edu/digital/iftnc/,Forests; Northwest; UIResearch;,AltCollection,Intermountain,"A collection of reports, studies, and documents published by the Intermountain Forestry Cooperative","A collection of reports, studies, and documents published by the Intermountain Forest Tree Nutrition Cooperative (IFTNC), a research cooperative composed of public and private forestry organizations that is located administratively in the College of Natural Resources at the University of Idaho.",documents,Inland Northwest,46.729312,-117.012924,1984,1991,iftnc,https://digital.lib.uidaho.edu/cdm/ref/collection/iftnc/id/3350,Trees in the mountains
International Jazz Collections (IJC),ijc,Jazz Collections,,0,0,ijc,visible,,no,,ijc,,,,https://www.ijc.uidaho.edu/,IJC; Jazz; UI;,IJCCollections,IJC,A Collection of Jazz Collections,"The International Jazz Collections (IJC) was formally established at the University of Idaho in 2000, featuring papers and photographs of the legendary Lionel Hampton. The IJC merged with the University of Idaho Library's Special Collections & Archives department in 2007. It is now the preeminent jazz archive in the Pacific Northwest.",collections,"University of Idaho (Library); Moscow, ID;",46.72732,-117.01588,1900,2002,ijc,https://www.ijc.uidaho.edu/,Collage International Jazz Collection Image
Joe Williams Collection,williams_joe,Joe Williams,Joe Williams Collection,147,147,ijcw,visible,,no,,ijc,,,,https://www.ijc.uidaho.edu/williams_joe/,IJC; Jazz;,IJCCollection,IJC-Williams,Scores from the Joe Williams Collection.,"Joe Williams was a vocalist who began singing professionally in the late 1930’s. He worked with the big bands of Coleman Hawkins, Lionel Hampton and Count Basie; it was with Basie that Williams had his first recording hits. Williams won many awards and professional recognition. In the 1980’s he had a recurring role (as “Grandpa Al�?) on TV’s The Cosby Show. He died in Las Vegas on March 29, 1999.",scores,"University of Idaho (Library); Moscow, ID;",46.72732,-117.01488,1930,1970,williams_joe,https://digital.lib.uidaho.edu/cdm/compoundobject/collection/ijcw/id/275,Score for They Can&apos;t Take That Away from Me
Kooskia Internment Camp Scrapbook,kooskia,Kooskia Internment Camp,Kooskia Internment Camp Scrapbook,387,194,spec_kic,visible,y,,spec_kic,,,2020-07,yes,https://www.lib.uidaho.edu/digital/Kooskia/,Idaho; War;,Collection,Kooskia,"Documenting the daily life of Japanese Americans interned by the US Government near Kooskia, ID durning World War II","The Kooskia Internment Camp Scrapbook documents the sights, tasks, scenes, and events of Japanese men detained during the camp&apos;s two years or operation (May 1943 - May 1945). The camp was located in a remote area of north central Idaho, 30 miles from the town of Kooskia; it was administered by the U.S. Immigration and Naturalization Service (INS) for the U.S. Department of Justice.",scrapbook; images,"Kooskia, ID",46.144012,-115.594819,1943,1945,kooskia,https://digital.lib.uidaho.edu/cdm/ref/collection/spec_kic/id/786,Kooskia Internment Camp Scrapbook Entrance Sign
Kyle Laughlin Photographs,laughlin,Laughlin Photos,Latah County Oral Histories Collection,828,828,spec_kl,visible,,,laughlin,,,2020-06,yes,https://www.lib.uidaho.edu/digital/Laughlin/,Idaho; Water; Agriculture; UI; Latah;,Collection,Laughlin,"Historical Photographs of Idaho and the United States, 1931 - 1979","The images of the Kyle Laughlin Photograph Collection, taken from 1931 to 1979, depict Idaho&apos;s natural scenery and historic sites, as well as personal moments from Kyle Laughlin&apos;s life. Laughlin was a Moscow, Idaho resident and businessman for 56 years; he owned several businesses, including a photo shop, an appliance store, and a television/cable company.",images,"Idaho; Washington; Montgomery, AL; Acoma Village, NM; Topeka, KS; St. Louis, MO; Denver, CO; Cheyenne, WY; Little Bighorn Battlefield, MT; Vaseux Lake, B.C.",46.706833,-116.92294,1935,1937,laughlin,https://digital.lib.uidaho.edu/cdm/ref/collection/spec_kl/id/955,"Fishing Contest, 1937"
Latah County Community Heritage Collection,lcheritage,Latah County Community Heritage Collection,Kyle Laughlin Photographs,610,610,lcheritage,visible,,,lcheritage,,,2020-08,yes,https://www.lib.uidaho.edu/digital/lcheritage/,"Idaho; Northwest; Forests; Wilderness; Fire; Latah; Moscow, ID; Potlatch, ID",Collection,Latah County Community,Materials from the NEH Funded Common Heritage Community Digitization Project in Latah County,The Latah County Common Heritage Collection was driven by funding from a National Endowment for the Humanities (NEH) Common Heritage Grant awarded to the University of Idaho Library in 2016. The materials in this collection were collected via community digitization days held in Moscow and Potlatch in 2016 and 2017.,documents; image,"University of Idaho (Library); Moscow, ID;",46.738036,-116.67842,1880,2016,lcheritage,https://digital.lib.uidaho.edu/cdm/ref/collection/lcheritage/id/7,Kelvin Daniels in front of fire
Latah County Oral Histories,lcoh,Latah County Oral Histories,Latah County Historical Society Photograph Collection,330,636,latah,visible,y,no,,,https://github.com/uidaholib/lcoh_viewer,,yes,https://www.lib.uidaho.edu/digital/lcoh/,"Idaho; Northwest; Forests; Wilderness; Fire; Latah; Moscow, ID; Potlatch, ID; Oral History",AltCollection,Latah County,Remembering Latah County and Idaho Life at the turn of the 20th century,"In the mid 1970s, the Latah County Historical Society collected over 300 oral histories from local Northern Idaho residents who grew up in Idaho during the early part of the 20th century. The Latah County Oral History Project produced one of the largest collections of oral histories in the Pacific Northwest. A copy of the transcripts and cassette recordings was donated to the University of Idaho Library in 1987. Those items were digitized and uploaded into our database in 2013.",documents; audio,"University of Idaho (Library); Moscow, ID;",46.736036,-116.67642,1970,1979,lcoh,https://www.lib.uidaho.edu/digital/lcoh/people/BRINK_Carol.html,Carol Ryrie Brink
Lee Morse Collection,morse_lee,Morse Collection,Lee Morse Collection,105,105,ijclm,visible,,no,,ijc,,,,https://www.ijc.uidaho.edu/morse_lee/,IJC; Jazz;,IJCCollection,IJC-Morse,Images and recordings from the Lee Morse Collection.,Lee Morse was an American singer and songwriter. The collection includes mainly photographs and sound recordings.,images;,"University of Idaho (Library); Moscow, ID;",46.72732,-117.01388,1924,1941,morse_lee,https://digital.lib.uidaho.edu/cdm/ref/collection/ijclm/id/22,Lee Morse playing guitar
Leonard Feather Blindfold Tests,blindfold,Leonard Feather Blindfold Tests,,23,23,,visible,,,,ijc,https://github.com/uidaholib/blindfold_draft,2020-09,yes,https://www.lib.uidaho.edu/digital/blindfold/,IJC; Jazz,IJCCollection,Blindfold,"Historic interviews with jazz musicians, recorded by jazz critic Leonard Feather",The Blindfold Tests are a series of interviews conducted by jazz critic Leonard Feather with prominent jazz musicians throughout the 20th century.,audio,,,,1951,1987,blindfold,https://digital.lib.uidaho.edu/digital/collection/lfc/id/173/rec/1,"Nat Adderley and Julian ""Cannonball"" Adderley"
Leonard Feather Jazz Collection,feather_leonard,Feather Jazz Collection,Leonard Feather Jazz Collection,5672,688,lfc,visible,,no,,ijc,,,,https://www.ijc.uidaho.edu/feather_leonard/,IJC; Jazz;,IJCCollection,IJC-Feather,"Papers, recordings, and photographs from the collection of Leonard Feather.","The Leonard Feather Collection includes a variety of materials that document and describe the Jazz scene during the middle of the twentieth century. Feather was born in London in 1914 and moved to New York City in 1939. He was a journalist, producer, composer and jazz critic. The collection contains- photos, notebooks, sketches, scores, correspondence, clippings, manuscripts, notes and financial papers.",images; documents; audio; illustrations; scores; video,"University of Idaho (Library); Moscow, ID;",46.72748,-117.01404,1900,1999,feather_leonard,https://digital.lib.uidaho.edu/cdm/ref/collection/lfc/id/214,Leonard Feather and Maragaret Sands at the Savoy Ballroom
Lewiston Orchards Life Newsletter,lewistonorch,Lewiston Newsletter,Lewiston Orchards Life,25,25,spec_lof,visible,,,lewistonorch,,,2020-05,yes,https://www.lib.uidaho.edu/digital/LewistonOrch/,Idaho; Agriculture;,Collection,Lewiston,"A newsletter documenting daily life in Lewiston Orchards, Idaho (1913-1914)","Lewiston Orchards Life was a newsletter published in Lewiston, Idaho during the early 1900s. The newsletter covers the residential and horticultural lives of those living in the Lewiston Orchards area, which is now a residential neighborhood.",documents,"Lewiston, ID",46.38071,-116.974847,1913,1914,lewistonorch,https://digital.lib.uidaho.edu/cdm/ref/collection/spec_lof/id/230,"Lewiston Orchards Life, 1914 April"
Lionel Hampton Jazz Festival Collection,jazzfest,Lionel Hampton Jazz Festival Collection,Lionel Hampton Jazz Festival Collection,176,176,jazzfest,visible,,,jazzfest,ijc,,2021-02,yes,https://www.lib.uidaho.edu/digital/jazzfest/,IJC; Jazz; UI;,IJCCollection,Lionel Hampton,"Memorabilia related to the University of Idaho's Jazz Festival, 1969-2020","A digital collection comprised of 30 years' worth of posters, programs, photographs, and oral histories related to the Lionel Hampton Jazz Festival at the University of Idaho.",documents; images; videos,"University of Idaho; Moscow, ID;",46.72732,-117.01388,1969,2020,jazzfest,,Lionel Hampton
Lionel Hampton Library Collection,hampton_collection,Hampton Collection,Lionel Hampton Library Collection,6660,3603,ijcs,visible,,no,,ijc,,,,https://www.ijc.uidaho.edu/hampton_collection/,IJC; Jazz;,IJCCollection,IJC-Hampton,"Scores, documents and images from the Lionel Hampton Collection","The materials in the Lionel Hampton collection span most of his musical career, 1926–2002, with the bulk of the collection dating 1940–1990. The digital collection includes photographs, arrangements, and images of awards and ephemera.",documents; images; scores,"University of Idaho (Library); Moscow, ID;",46.72748,-117.01412,1918,2002,hampton_collection,https://digital.lib.uidaho.edu/cdm/singleitem/collection/ijcs/id/10157,Lionel Hampton&apos;s Birthday Party
The Map Room,maps,Map Room,,,,,visible,,no,,,,,,https://www.lib.uidaho.edu/digital/maps/,Forests; Fire; Wilderness; Mining; UI; Idaho; Sports; Maps,Application,Map,An interactive Google map application that allows users to browse over 8000 images on a digital map,The Map Room is an interactive Google map application that allows users to browse over 8000 images on a digital map. Use the drop down menus and search box at the top of each map to further refine your browsing.,maps,United States,46.7274,-117.01388,1860,2014,maps,https://www.lib.uidaho.edu/digital/maps/,The Map Room Website
Mark Brooks Calnon Collection,calnon,Calnon Collection,Mark Calnon Collection,52,52,calnon,visible,y,,calnon,,,2020-11,yes,https://www.lib.uidaho.edu/digital/calnon/,Idaho; Labor; War;,Collection,Calnon,"Materials from the life of Mark B. Calnon, World War II Pilot and Prisoner of War","The Mark Brooks Calnon Collection consists of estate materials from 2nd. Lt. Mark Brooks Calnon, including memorabilia relating to his experiences in World War II as a pilot and prisoner of war. The collection includes photographs, documents, an oral history (audio/video/transcript), and a copy of Calnon&apos;s book, Some Lived, Some Died It Was Understood. The collection was put together by Journalism and Mass Media Professor Denise Bennett as part of a Seed Grant funded project.",documents; images; audio; video,"Boise, ID; Germany",43.61349,-116.227996,1941,2013,calnon,https://digital.lib.uidaho.edu/cdm/ref/collection/calnon/id/15,B17 Crew Portrait
McCall Public Library Collection,mccall,McCall Library Collection,McCall Public Library Collection,319,319,mccall,visible,,no,mccall,,,,,https://www.lib.uidaho.edu/digital/mccall/,Idaho; Water; Wilderness;,Collection,McCall,A collection of family history-related items form the McCall Public Library,A collection of family history-related items form the McCall Public Library,documents; images;,"McCall, ID",44.908901,-116.099141,1815,2014,mccall,https://mccall.lili.org/,McCall Library
MosCon Collection,moscon,MosCon Collection,,34,34,,visible,y,,,,https://github.com/uidaholib/moscon_source,,yes,https://www.lib.uidaho.edu/digital/moscon/,Science Fiction; Moscow,Collection,MosCon,A collection of MosCon artifacts celebrating the Palouse Empire Science Fiction Association's decades of fandom on the Palouse,"MosCon was a vibrant regional science fiction convention based in Moscow, Idaho, organized by the Palouse Empire Science Fiction Association (PESFA). This digital collection provides access to MosCon program booklets and related artifacts for the twenty-two annual conventions held from 1979 to 2001.",documents; images;,"Moscow, ID",46.732062,-116.998138,1978,2019,moscon,,
Moving Forward While Looking Back,hiroshima,Moving Forward While Looking Back,,83,83,,visible,,,,spec,https://github.com/uidaholib/collectionbuilder-sa-spec-exhibits/tree/hiroshima,,yes,https://www.lib.uidaho.edu/digital/hiroshima/,UI; Japan; War,Collection,Moving Forward,"Japanese Americans, Japan, Idaho and the University","This exhibit explores the impact that World War II had not only on those of Japanese ancestry in the United States, but also those in Japan who survived and rebuilt after the use of the atomic bomb and the role Idaho played through it all. It looks at the atrocities of war and the resilience and hope of those who live through it.",images;documents,"Hiroshima, Japan",34.37638234,132.4695732,1941,2011,hiroshima,,Hiroshima or Nagasaki after bombing
Nez Perce Collection,nezperce,Nez Perce Collection,Nez Perce Historical Photograph Collection,583,583,nezperce,noshow,,no,,,,,,https://www.lib.uidaho.edu/digital/nezperce/,Idaho; Native Americans; Northwest;,Collection,Nez,20th Century photographs of the Nez Perce/Niimíipuu Native Americans,The Nez Perce Historical Portrait Collection includes nearly 600 photographs of individuals and groups from the Nez Perce/Nimíipuu tribe. Most photographs were taken during the first half of the 20th century. Much of the collection is comprised of studio photographs that have been taken of both individuals and families.,images,"Nez Perce National Historical Park; Lapwai, ID; Spalding, ID;",46.449904,-116.817596,1900,1955,nezperce,https://digital.lib.uidaho.edu/cdm/ref/collection/nezperce/id/512,"Border Days Grangeville, Idaho"
Northwest Historical Postcards Collection,postcards,Postcards Collection,Northwest Historical Postcards Collection,811,811,nwpostcards,visible,y,,nwpostcards,,,2021-05,yes,https://www.lib.uidaho.edu/digital/postcards/,Idaho; Northwest; Forests; Water; Wilderness;,Collection,Postcards,Digitized Historical Postcards from Idaho and the Greater Northwest,This digital collection of over 800 postcards comes from the historical photograph collections of the University of Idaho Library&apos;s Special Collections &amp; Archives. The postcards range in date from the 1890s to the 1980s.,images,Washington; Oregon; Idaho; Montana; Wyoming; British Columbia; Alberta,46.716798,-119.597168,1890,1980,postcards,https://www.lib.uidaho.edu/digital/postcards/items/nwpostcards406.html,"Syinga Time, Lake Pend Oreille, North Idaho"
