colltitle,path,shorttitle,cdmtitle,items,webitems,cdmid,status,featured,cb-data,cb_cdm_branch,branch_notes,repo_location,last_cb_update,about_page,website,categories,type,alpha,shortdesc,description,mediatype,location,lat,long,datestart,dateend,image,imagelink,imagetitle
Ott Historical Photograph Collection,ott,Ott Collection,Ott Historical Photograph Collection,1826,1826,ott,visible,,,ott,,,2020-12,yes,https://www.lib.uidaho.edu/digital/ott/,Idaho; Latah; Moscow;,Collection,Ott,"Photographs from local Clifford M. Ott depicting northern Idaho as it was, 1890 - 1980","Clifford M. Ott donated this broad collection of historical photographs in 1992. Ott was an avid amateur photographer who amassed over 10,000 slides, prints, and negatives spanning the years from 1883 to 1990. The digital collection represents a selection from Ott&apos;s whole collection, which he compiled into eleven albums containing a total of over 1,800 images of Moscow and surrounding Latah County and used to educate local citizens.",images; newspaper,"Latah County, ID; Moscow, ID; Genesee, ID; Potlatch, ID; Princeton, ID; Harvard, ID; Lewiston, ID; Clarkston, WA; Troy, MT; Livingston, MT; Ralston, NE;",46.731518,-117.001358,1880,1989,ott,https://digital.lib.uidaho.edu/cdm/ref/collection/ott/id/90,"Fat Men&apos;s Race. Moscow, July 4, 1911."
Potlatch Historical Society Collection,phs,Potlatch Historical Society,Potlatch Historical Society,1781,1781,phs,visible,,,phs,,,2020-08,yes,https://www.lib.uidaho.edu/digital/phs/,"Idaho; Northwest; Forests; Wilderness; Fire; Latah; Potlatch, ID",AltCollection,Potlatch Historical,"Potlatch Historical Society Collection Depicting life in and around Potlatch, Idaho from 1880 to 1998","Potlatch Historical Society Collection Depicting life in and around Potlatch, Idaho from 1880 to 1998",documents; images;,Idaho,46.921048,-116.903855,1880,1998,phs,https://digital.lib.uidaho.edu/cdm/ref/collection/phs/id/7,Longest Logging Train
Potlatch Lumber Company Photograph Collection,plcphotos,Potlatch Lumber Co. Photos,Potlatch Lumber Company Photograph Collection,1570,1570,plcphotos,visible,,,plcphotos,,,2020-12,yes,https://www.lib.uidaho.edu/digital/plcphotos/,"Idaho; Northwest; Forests; Wilderness; Fire; Latah; Potlatch, ID",AltCollection,Potlatch Lumber,A collection of over 1500 photographs from the Potlatch Lumber Company,A collection of over 1500 photographs from the Potlatch Lumber Company,images,Idaho,46.921048,-116.903855,1896,1999,plcphotos,https://digital.lib.uidaho.edu/cdm/ref/collection/plcphotos/id/16,"White Pine King, 1911"
Priest Lake Historical Photograph Collection,priestlake,Priest Lake Collection,Priest Lake Historical Photograph Collection,380,380,priestlake,visible,,,priestlake,,,2020-06,yes,https://www.lib.uidaho.edu/digital/priestlake/,Idaho; Northwest; Water; Forests;,Collection,Priest,"Historical Photographs of Priest lake, Idaho and the surrounding area, 1880 - 1950","A digital collection comprised of 380 historical photographs of Priest Lake, Idaho and the surrounding area. The images span the years 1880 to 1950, documenting the area&apos;s waters, boats, buildings, landscape and people.",images,"Priest Lake, ID; Upper Priest Lake, ID; Priest River, ID; Coolin, ID; Idaho;",48.514088,-116.871872,1880,1950,priestlake,https://digital.lib.uidaho.edu/cdm/ref/collection/priestlake/id/370,Dewey Huot&apos;s Mama
Psychiana Digital Collection,psychiana,Psychiana,Psychiana Digital Collection,1323,1323,psychiana,visible,y,,psychiana,,,2020-08,yes,https://www.lib.uidaho.edu/digital/psychiana/,Idaho; Northwest; Latah; Religion;,AltCollection,Psychiana,"Materials from the Frank B. Robinson Papers documenting Psychiana, a religion popular in the 1930s and 40s","Materials from the Frank B. Robinson Papers documenting Psychiana, a religion popular in the 1930s and 40s",images; documents; audio,"Moscow, ID",46.733711,-117.001252,1930,1952,psychiana,https://digital.lib.uidaho.edu/cdm/ref/collection/psychiana/id/548,Photograph of Clerical and Bookkeeping Staff from the Branch Mailing Department.
Rangeland Center Collection,rangecoll,Rangeland Center Collection,Rangeland Center Collection,66,66,na,visible,,,rangecoll,,,2020-12,yes,https://www.lib.uidaho.edu/digital/rangecoll/,UI; UIResearch; Northwest; Rangeland;,Collection,Rangeland Center,A repository of information created by University of Idaho researchers related to topics in rangeland ecology and managemen,"The Rangeland Center collection is a repository of information created by University of Idaho researchers related to topics in rangeland ecology and management. Subject areas include ecology of rangelands, grazing management, invasive plants, fire ecology, and more.",documents,Idaho,43.207053,-115.065308,1969,2013,rangecoll,https://www.lib.uidaho.edu/digital/images/rangelandarchive.jpg,Rangeland
Ray Brown Collection,brown_ray,Ray Brown,Ray Brown Collection,17,17,ijc_brown,visible,,no,,ijc,,,,https://www.ijc.uidaho.edu/brown_ray/,IJC; Jazz;,IJCCollection,IJC-Brown,Images from the Ray Brown Collection.,"A small collection of the photographs and awards of Ray Brown, a renowned jazz double bassist and cellist.",images,"University of Idaho (Library); Moscow, ID;",46.7274,-117.01404,1953,2001,brown_ray,https://digital.lib.uidaho.edu/cdm/ref/collection/ijc_brown/id/14,Ray Brown
River Recreation Research Database,rrrd,River Recreation Research Database,River Recreation Research Database,289,289,rrrd,visible,,no,,,,,,https://digital.lib.uidaho.edu/digital/collection/rrrd,Water; UIResearch,Collection,River Recreation,,,,,,,,,rrrd,,
Robert E. Higgins Collection,higgins,Higgins Collection,Robert E. Higgins Collection,42,42,higgins,visible,,,higgins,,,2020-11,yes,https://www.lib.uidaho.edu/digital/higgins/,Idaho;,Collection,Higgins,"A collection of photographs by Robert E. Higgins, a professor of plant science at the University of Idaho from 1946 to 1999","A collection of photographs by Robert E. Higgins, a professor of plant science at the University of Idaho from 1946 to 1999. During his lifetime, Professor Higgins&apos; photographs were accepted in over 70 juried international salons, and he had one-artist exhibitions in Idaho, Washington, and California.",images,Idaho,46.72756,-117.01412,1946,1999,higgins,https://digital.lib.uidaho.edu/cdm/ref/collection/higgins/id/13,Pioneer
Selway-Bitterroot Wilderness History Project,sbwhp,Selway-Bitterroot Project,Selway-Bitterroot Wilderness Collection,312,312,sbw,visible,,no,,,,,,https://sbw.lib.uidaho.edu/,Idaho; Water; Forests; Wilderness; Oral History; Selway-Bitterroot Wilderness Region,DMCollection,Selway,"Oral histories, photographs, and other documents from an NEH funded exploration into the human aspects of the Selway-Bitterroot Wilderness","This collection represents the digital objects of the Selwaay-Bitterroot Wilderness History Project, which is an NEH funded exploration into the human aspects of the Selway-Bitterroot Wilderness.",documents; images; podcasts,"Lolo Pass, MT; Lolo Hot Springs, MT; Elk Summit, ID; Freeman Peak, ID; Moose Meadows, ID; Shissler Peak Lookout, ID; Shearer Guard Station, ID; Trapper Peak, ID; Paradise Campground, ID;",46.157491,-114.553871,1920,2011,sbwhp,https://digital.lib.uidaho.edu/cdm/ref/collection/sbw/id/110,John Day Ranch
Senator William Edgar Borah Scrapbooks,spec_web,Borah Scrapbooks,Senator William Edgar Borah Scrapbooks,17,17,spec_web,visible,,no,,,,,needed,https://digital.lib.uidaho.edu/digital/collection/spec_web,Idaho; Politics;,Collection,Senator William,"A collection of scrapbooks containing memorabilia regarding Senator William Edgar Borah. The scrapbooks consist of newspaper clippings, magazine articles, letters, photographs, and recordings Borah's speeches.","William Edgar Borah was a Republican Senator from Idaho. He first became a candidate for the U.S. Senate in 1903, but was defeated by Weldon Heyburn. He was elected in 1907 and served in that body until his death in 1940. In 1924 he became chairman of the Foreign Relations Committee. He also served on the Judiciary Committee. He was often mentioned as a presidential candidate, but not until 1936 did he actually enter any primaries; his defeat at the convention by Alf Landon was not unexpected. This collection consists of scrapbooks containing newspaper clippings, magazine articles, letters, photographs, and recordings of four of his speeches.",documents; images; newspaper;,Idaho,,,1904,,spec_web,,
Stanton Gilbert Fisher Collection,fisher,Fisher Collection,Stanton Gilbert Fisher Collection,50,50,fisher,visible,,,fisher,,,2020-09,yes,https://www.lib.uidaho.edu/digital/fisher/,Northwest; Native Americans; War;,AltCollection,Fisher,"Writings and memorabilia of Stanton Gilbert Fisher, pioneer and Nez Perce War scout, 1840-1915","Writings and memorabilia of Stanton Gilbert Fisher, pioneer and Nez Perce War scout, 1840-1915. Most of the documents are Nez Perce War collectibles, such as maps, photographs and accounts of the war and its participants. The rest of the papers are personal materials related to Fisher, including autobiographical materials as well as the correspondence and census records of several of his family members.",documents; images; newspaper,"Central Idaho; Beaverhead National Forest, MT; White Bird Battlefield, ID;",45.742401,-116.310539,1840,1915,fisher,https://digital.lib.uidaho.edu/cdm/ref/collection/fisher/id/290,Colonel J. W. Redington
Stonebraker Photograph Collection,stonebraker,Stonebraker Collection,Stonebraker Photograph Collection,541,540,stonebraker,visible,,,stonebraker,,,2020-06,yes,https://www.lib.uidaho.edu/digital/stonebraker/,Mining; wilderness; Idaho;,Collection,Stonebraker,"Ranching, Hunting, and Pack Train Operations in North Central Idaho, 1900-1931","A digital collection comprised of 540 historical photographs taken by William Allen Stonebraker at the turn of the century and into the 1920s and 1930s documenting the Salmon River, the Frank Church-River of No Return, the Chamberlain Basin, and the Thunder Mountain Gold Rush.",images,"Salmon River; Frank Church-River of No Return Wilderness (Idaho); Chamberlain Basin, ID;",44.948193,-115.135872,1900,1931,stonebraker,https://digital.lib.uidaho.edu/cdm/ref/collection/stonebraker/id/155,Men in Submerged Boat
Taylor Ranch Log Book Collection,taylorranch,Taylor Ranch Collection,Taylor Ranch Log Book Collection,9,9,taylor,visible,,,,,https://github.com/uidaholib/taylor_source,,yes,https://www.lib.uidaho.edu/digital/taylor/,Idaho; Forests; Wilderness,AltCollection,Taylor,"Log books detailing daily events at the Taylor Wilderness Research Station, 1997-2010","The nine log books in this collection detail daily events from 1997 to 2010 recounted by those living and working at the Taylor Wilderness Research Station. In addition to describing the routine research and maintenance task, the logs also provide wildlife sightings and firsthand accounts of harrowing events, such as the dramatic forest fire and evacuation of the year 2000.",documents,"Taylor Ranch, ID; Frank Church-River of No Return Wilderness (Idaho)",45.103422,-114.851106,1997,2010,taylorranch,https://digital.lib.uidaho.edu/cdm/ref/collection/taylor/id/5,Taylor Log Book
The Theodore Roosevelt Collection,troosevelt,Roosevelt Visit Exhibit,,48,48,,visible,,no,,,,,,https://www.lib.uidaho.edu/digital/troosevelt/,UI; Campus; Politics,Exhibit,Theodore,Photos from President&apos;s Roosevelt&apos;s historic visit to the University of Idaho campus in 1911,A collection of photographs from the University of Idaho Historical Photographs Collection commemorating the 100th anniversary of President&apos;s Roosevelt&apos;s historic visit to the University of Idaho campus in 1911.,images,"University of Idaho (Admin Lawn); Moscow, ID;",46.726209,-117.010521,1911,1911,troosevelt,https://digital.lib.uidaho.edu/cdm/ref/collection/spec_uihp/id/427,Roosevelt on platform in front of University of Idaho Administration Building leaning toward Idaho Governor James Hawley
Theses and Dissertation Collection,etds,ETDs,Theses and Dissertations Database (ETDs),1855,1855,etd,visible,,no,etd,cb not standard,,,,https://www.lib.uidaho.edu/digital/etd/,UI; UIResearch;,Application,Theses,Open Access Repository of University of Idaho Graduate ETD,"An open access repository of theses and dissertations from University of Idaho graduate students. The collection includes complete electronic theses and dissertations submitted since approximately 2014, as well as digitized copies of earlier documents going back to 1910.",documents,"University of Idaho (Library); Moscow, ID;",46.73524,-117.01396,1909,2011,etds,https://digital.lib.uidaho.edu/cdm/singleitem/collection/etd/id/435,"Distribution of Salt and Moisture in Butter as affected by storage, a 1917 Thesis written by Ricahrd D. Canan"
Transitions Journal,transitions,Transitions,Transitions Journal Digital Collection,80,80,transitions,visible,,,transitions,,,2020-11,yes,https://www.lib.uidaho.edu/digital/transitions/,Environmental;Water;Forests;Wilderness;Mining,Collection,Transitions,"Curated articles on environmental, conservation, and ecological issues in the Inland and Pacific Northwest Region, 1988 - 2000","The Transitions Journal Digital Collection is a digital repository for Transitions, a conservation-focused publication edited and published by John Osborn from 1988 to 2000.",documents,Pacific Northwest,47.657495,-117.416277,1988,2000,transitions,,Smokey bear on transitions journal cover
The Trees Grew Tall Photograph Collection,treesgrewtall,Trees Grew Tall,John Miller 'Trees Grew Tall',242,242,treesgrewtall,visible,,,treesgrewtall,,,2021-01,,https://www.lib.uidaho.edu/digital/treesgrewtall/,Idaho; Forests,Collection,Trees,"Photographs used in the making of the book The Trees Grew Tall, 1898 - 1943","A digital collection comprised of 242 photographs of life in Bovill, Idaho and surrounding areas from 1898 - 1943. These photographs were taken or collected by Bovill native and author John B. Miller.",images,"Bovill, Idaho",46.85842341,-116.3939099,1898,1943,treesgrewtall,,"River near Bovill, Idaho"
Turning of the Wheel Collection - Humanities Colloquium 2011-2012,turning,Turning of the Wheel Collection,Turning of the Wheel Collection - Humanities Colloquium 2011-2012,491,491,turning,visible,,no,,,,,,https://www.lib.uidaho.edu/digital/turning/,UI; Campus; UIResearch,AltCollection,Turning,"A Digital Collection of Events from the Humanities Colloquium Series, Turning of the Wheel, 2011-2012","A Digital Collection of Events from the Humanities Colloquium Series, Turning of the Wheel, University of Idaho | Moscow, Idaho | 2011-2012",documents; images; video;,"University of Idaho (Commons); Moscow, ID;",46.727391,-117.013046,2011,2012,turning,https://digital.lib.uidaho.edu/cdm/ref/collection/turning/id/58,Ad for the collection
UI Campus Photograph Collection,campus,Campus Collection,University of Idaho Campus Photographs Collection (PG1),3119,3119,pg1,visible,,no,,,,,,https://www.lib.uidaho.edu/digital/campus/,Campus; UI;,CampusCollection,Campus,3000 historical photographs of the UI Campus from 1889 to the present,The University of Idaho Campus Photograph Collection contains over 3000 historical photographs of the UI Campus from 1889 to the present.,images,"University of Idaho; Moscow, ID;",46.728014,-117.011009,1889,2014,campus,https://digital.lib.uidaho.edu/cdm/ref/collection/pg1/id/1288,"Administration Building, University of Idaho from southeast. [52-4]"
University of Idaho Historical Photos,uihistorical,UI Historical Photos,University of Idaho Historical Photograph Collection,487,487,spec_uihp,visible,,,spec_uihp,,,2020-07,yes,https://www.lib.uidaho.edu/digital/uihistorical/,UI; Campus;,CampusCollection,University of Idaho Historical,Photographs documenting campus life at the Univesity of Idaho from 1890 to 1980,"A variety of photographs from several photographic collections held by Special Collections &amp; Archives that depict scenes from the University of Idaho&apos;s past. Includes portraits of past professors and alumni, as well as photos of buildings and events.",images,"University of Idaho; Moscow, ID;",46.725714,-117.011277,1863,1975,uihistorical,https://digital.lib.uidaho.edu/cdm/ref/collection/spec_uihp/id/11,Administration Building 1900
University of Idaho Law Faculty Repository,lawir,UI Law Faculty Repository,University of Idaho Law Faculty Repository,,,lawir,noshow,,no,,,,,,https://digital.lib.uidaho.edu/digital/collection/lawir,UIResearch;,Collection,University of Idaho Law,"Research and scholarship produced by faculty members at the University of Idaho Law School, 2003 - 2013","Research and scholarship produced by faculty members at the University of Idaho Law School, 2003 - 2013",documents,"University of Idaho; Moscow, ID;",46.728347,-117.007264,2003,,lawir,,
University of Idaho Student Organizations Collection (PG2),pg2,UI Student Organizations Collection,University of Idaho Student Organizations Collection (PG2),2634,2634,pg2,visible,,,pg2,,,2020-07,yes,https://www.lib.uidaho.edu/digital/pg2/,UI; Campus;,CampusCollection,University of Idaho Student,"Historic images documenting activities of University of Idaho Student Organizations, 1898-1992","The University of Idaho Student Organizations Collection is a collection of digitized historical images focused on student organizations and events at the University of Idaho’s main campus in Moscow, ID. This digital collection is mostly taken from the library’s Special Collections & Archive’s UI Student Organizations Collection, which is referred to as Photograph Group 2 (PG2). The collection comprises thousands of images spanning from 1893 to the early 1990s.",documents; images,"University of Idaho; Moscow, ID;",46.728347,-117.007264,1898,,pg2,,
University of Idaho: Then and Now,campushistory,University of Idaho: Then and Now,,27,27,,visible,,no,,,https://github.com/uidaholib/campus-photos,,,https://www.lib.uidaho.edu/digital/campushistory/,Idaho; UI; Campus;,CampusCollection,UI: Then and Now,A curated exhibit of historic buildings over time on the University of Idaho campus,A curated exhibit of historic buildings over time on the University of Idaho campus,images,"University of Idaho; Moscow, ID",46.728077,-117.020026,1899,2019,campushistory,,"Administration Building, University of Idaho (1892-1906)"
Vandal Poem of the Day,,Vandal Poem of the Day,,,,,visible,,no,,,,,,https://poetry.lib.uidaho.edu/,Poetry; UIResearch;,CDIL,,A public poetry project that brings relevant contemporary poetry to the University of Idaho and the broader Idaho community.,,poetry,"University of Idaho; Moscow, ID;",46.728347,-117.007264,2015,,vpod,,
Vandal Video Collection,vandalvideo,Vandal Videos,Vandal Video Collection,167,167,vandalvideo,visible,,,vandalvideo,,,2020-09,yes,https://www.lib.uidaho.edu/digital/vandalvideo/,Campus; UI; Sports;,Collection,Vandal,"Historic videos of University of Idaho Basketball and Football Games, 1925 - 1997",The Vandal Video Collection is a collection of 160+ digitized 16mm Film reels that were scouting videos for both football and basketball games..,video,"University of Idaho (Maclean Field, Neale Stadium, Kibbie Dome); Moscow, ID;",46.727212,-117.01655,1925,1993,vandalvideo,https://digital.lib.uidaho.edu/cdm/ref/collection/vandalvideo/id/2,"UI vs. USC, 1925"
VIVO,vivo,VIVO,,,,,visible,,no,,,,,,https://vivo.nkn.uidaho.edu/vivo/,UI; UIResearch;,Application,VIVO,A research-focused discovery tool that enables collaboration,"VIVO is a research-focused discovery tool that enables collaboration among scholars across all disciplines. The system allows users to browse or search information on University people, departments, courses, grants, and publications.",,"University of Idaho (Library); Moscow, ID;",46.72724,-117.01396,2008,2017,vivo,https://www.lib.uidaho.edu/digital/vivoatui/,Vivo Visualization
Voices of Gay Rodeo,,Voices of Gay Rodeo,,,,,visible,,no,,,https://github.com/thecdil/gayrodeo_dev,,,https://www.voicesofgayrodeo.com,UIResearch; Rodeo; Oral History;,CDIL,,Oral Histories from the International Gay Rodeo Association,"Partnering with the International Gay Rodeo Association to collect and preserve people’s experiences as LGBTQ+ westerners, this project seeks to protect endangered histories and relocate LGBTQ+ people back into the American West as people continue to build resilient communities.",documents,Texas; Colorado; New Mexico; California;,,,2016,2018,gayrodeo,,
Web Archive Collections,webarchive,Web Archives,,21000,21000,webarchive,visible,,no,,,,,,https://www.lib.uidaho.edu/digital/webarchive/,UI; Campus;,Collection,Web Archive,Collection of UI newsletters and webpages harvested to preserve unique born-digital content.,,documents,University of Idaho,46.728347,-117.007264,1997,2017,webarchive,https://www.lib.uidaho.edu/digital/images/small/webarchive.jpg,
White Pine - King of Many Waters Collection,whitepine,White Pine Collection,White Pine - King of Many Waters Collection,144,144,whitepine,visible,y,,whitepine,,,2020-08,yes,https://www.lib.uidaho.edu/digital/whitepine/,Idaho; Water; Forests;,AltCollection,White Pine,Images used in the making of the book White Pine - King of Many Waters,Images used in the making of the book White Pine - King of Many Waters,images,"Coeur d'Alene, ID",47.6776,-116.7925,1884,1969,whitepine,https://digital.lib.uidaho.edu/cdm/ref/collection/whitepine/id/137,A.W. Post and Crew