colltitle,path,shorttitle,cdmtitle,items,webitems,cdmid,status,featured,cb-data,cb_cdm_branch,branch_notes,repo_location,last_cb_update,about_page,website,categories,type,alpha,shortdesc,description,mediatype,location,lat,long,datestart,dateend,image,imagelink,imagetitle
1918 Flu Pandemic Collection,1918flu,Flu,,73,73,,visible,,,,spec,https://github.com/uidaholib/collectionbuilder-sa-spec-exhibits/tree/1918flu,,yes,https://www.lib.uidaho.edu/digital/1918flu/,Idaho; Disease,Collection,1918,"Materials depicting the impact of the ""Spanish Flu"" on the University of Idaho Campus","The 1918 Flu Pandemic Collection brings together correspondence, reports, news articles, oral histories, and other materials that highlight the local response to the 1918 pandemic.",documents; images,University of Idaho,46.722532,-117.014779,1910,1975,flu,,
Adult Salmon and Steelhead Migration Studies: 1996-2014,ferl,Adult Salmon and Steelhead Migration Studies,,154,154,,visible,,,,,https://github.com/uidaholib/FERL_source,,yes,https://www.lib.uidaho.edu/digital/ferl/,Water; Northwest; UIResearch;,AltCollection,Adult Salmon,"Fish migration datasets and an extensive catalog of technical reports and peer-reviewed publications pertaining to the study of migrations, dam passage behaviors, and survival of adult salmon and steelhead in the Columbia River basin since the 1990s.","The University of Idaho's Fish Ecology Research Lab in collaboration with the U.S. Army Corps of Engineers, NOAA-Fisheries, and other research partners has used radiotelemetry to study the migrations, dam passage behaviors, and survival of adult salmon and steelhead in the Columbia River basin since the 1990s, amassing one of the world’s largest fish migration datasets along with an extensive catalog of technical reports and peer-reviewed publications.",documents; data,Columbia River Basin,46,-116,1996,2019,ferl,,
Agricultural Economics Research Series,aers,Agricultural Economics Research Series,Agriculture Economics Research Series,401,401,agecon,visible,,,aers,,,2020-08,needed,https://www.lib.uidaho.edu/digital/aers/,UIResearch; Agriculture; Environmental;,Collection,AgEcon,University of Idaho agricultural economics research,A series of documents focused on agricultural economics produced by University of Idaho researchers.,documents,"University of Idaho; Moscow, ID;",46.728347,-117.007264,1956,2006,aers,,Windmills over wheat fields
Agricultural Experiment &amp; UI Extension Publications,uiext,UI Extension,Agricultural and Extension Publications Collection,3462,2107,ui_ep,visible,,,uiext,,,2020-11,yes,https://www.lib.uidaho.edu/digital/uiext/,UIResearch; Agriculture; Environmental;,Collection,Agricultural,"Primary sources for practical, research-based information on Idaho Agriculture, Forestry, Gardening, and Family and Consumer Sciences","A collaboration between the Library and University of Idaho Extension, the University of Idaho Extension and Idaho Agricultural Experiment Station Publications collection features over 2000 publications that serve as the primary source for practical, research-based information on Idaho agriculture, forestry, gardening, and family and consumer sciences.",documents,"Idaho; Moscow, ID (Extension Offices)",46.728077,-117.020026,1892,2011,agext,https://www.lib.uidaho.edu/digital/expforest/items/expforsav228.html,"Seed beds at Boulder Nursery, Mont."
The Argonaut,argonaut,Argonaut,Argonaut,5974,5974,argonaut,visible,,no,,,https://github.com/uidaholib/argonaut_source,,yes,https://www.lib.uidaho.edu/digital/argonaut/,Idaho; Campus; UI; Sports;,CampusCollection,Argonaut,"University of Idaho&apos;s Newspaper, 1898-2010",The Argonaut is the newspaper of the University of Idaho. We hold historical copies from 1898-2010,documents; newspaper;,"University of Idaho; Moscow, ID;",46.728347,-117.007264,1898,2010,argonaut,https://uidahodigital.tumblr.com/post/139363978388/we-are-not-alone,Post from our Tumblr featuring Argonaut Ad
Argonaut Photograph Collection,argonautphotos,Argonaut Photographs,Argonaut Photographs,702,702,p17254coll3,visible,,,argonautphotos,,,2020-08,yes,https://www.lib.uidaho.edu/digital/argonautphotos/,Idaho; Campus; UI; Sports;,CampusCollection,Argonaut Photos,"Over 700 photographs from the University of Idaho newspaper, The Argonaut.","Over 700 photographs from the University of Idaho newspaper, The Argonaut.",images,"University of Idaho; Moscow, ID;",46.728347,-117.007264,1980,1988,argonautphotos,,A student looking through the library card catalog
Al Grey/Rosalie Soladar Memorial Collection,grey_al,Al Grey Collection,Al Grey-Rosalie Soladar Memorial Collection,255,255,ijcag,visible,,no,,ijc,,,,https://www.ijc.uidaho.edu/grey_al/,IJC; Jazz;,IJCCollection,IJC-Grey,Awards and photographs from the Al Grey Collection,Al Grey was a jazz trombonist and bandleader. Rosalie Soladar was his companion and personal manager. Materials in this collection span most of Grey&apos;s career after their partnership. The digital collection includes photographs and images of awards and ephemera,images,"University of Idaho (Library); Moscow, ID;",46.7274,-117.01412,1989,2000,grey_al,https://digital.lib.uidaho.edu/cdm/ref/collection/ijcag/id/273,Al Grey playing the trombone
Arbor Notes Collection,arbornotes,Arbor Notes,Arbor Notes,57,57,arbornotes,visible,,,arbornotes,,,2020-06,yes,https://www.lib.uidaho.edu/digital/arbornotes/,UI; Campus; Agriculture;,AltCollection,Arbor,A Newsletter of the (University of Idaho) Arboretum Associates,"A collection of newsletters pertaining to the University of Idaho's Arboretum and Botanical Garden, including reports, gardening tips, and other information.",documents,"University of Idaho (Arboretum); Moscow, ID;",46.722532,-117.014779,1980,2017,arbornotes,,Arboretum in Fall
Archival Idaho Photograph Collection,archivalidaho,Archival Idaho,Archival Idaho Collection,1169,1169,archivalidaho,visible,,,archivalidaho,,,2020-09,yes,https://www.lib.uidaho.edu/digital/archivalidaho/,Idaho,Collection,Archival,Rare Idaho Photographs from Archives around the Country,"Collected by Dennis Baird over several years and many trips to government archives and described by Idaho native Jordan Wrigley, the Archival Idaho Photograph Collection features some of the earliest extant photographs of Idaho, as well as countless other historical gems related to our fine state.",images,,,,1873,1999,archivalidaho,https://www.lib.uidaho.edu/digital/archivalidaho/items/archivalidaho113.html,"Playground and wading pool, Idaho Falls"
Barnard-Stockbridge Photograph Collection,barstock,Barnard-Stockbridge,Barnard-Stockbridge Photograph Collection,1208,1208,bar-stock,visible,y,,barstock,,,2020-10,yes,https://www.lib.uidaho.edu/digital/barstock/,Idaho; Mining; Fire;,Collection,Barnard,"Historical Photographs of Northern Idaho Mines, Towns, and Scenery, 1894-1964","The Barnard-Stockbridge Collection exhibits over 1000 photographs, selected from over 200,000 nitrocellulose and glass plate negatives, taken by Nellie Stockbridge and T. N. Barnard during the years 1894-1964. The photos depict various aspects of life in the Wallace/Kellogg mining area.",images,"Wallace, ID; Kellogg, ID; Burke, ID; Mullan, ID; Wardner, ID; Cataldo, ID; Silver Valley area in Idaho; Coeur'Alene, ID; Lolo Pass, MT;",47.474095,-115.927939,1886,1964,barstock,https://digital.lib.uidaho.edu/cdm/ref/collection/barstock/id/405,"Hercules Mill, Burke (Idaho), 1907"
The Big Burn Collection,bigburn,Big Burn,Big Burn Collection,65,65,bigburn,visible,,,bigburn,,,2021-03,yes,https://www.lib.uidaho.edu/digital/bigburn/,Idaho; Mining; Fire; Northwest; Forests;,Exhibit,Big,An exhibition of materials related to the 'Big Burn' fires of 1910,"The Big Burn Collection is an online exhibit of materials related to the &apos;Big Burn&apos; fires of 1910 that devastated much of Northern Idaho and Northwest Montana. The collection includes photographs, documents, first-person accounts, and oral histories pertaining to the fires and the local and national responses to them.",images; documents,"Wallace, ID; Lolo Pass, MT; Selway-Bitterroot Wilderness Region",47.487853,-115.872459,1910,1910,bigburn,https://digital.lib.uidaho.edu/cdm/ref/collection/bigburn/id/58,"Forest Fire - Wallace Idaho Aug 20, 1910 Men burned in the fire"
Bovill Historical Photograph Collection,lchsphotos,LCHS Photos,Latah County Community Heritage Collection,153,153,lchsphotos,visible,,,lchsphotos,,,2020-11,yes,https://www.lib.uidaho.edu/digital/lchsphotos/,Idaho; Latah;,AltCollection,Latah County Historical,Photographs from the collection of the Latah County Historical Society,Photographs from the collection of the Latah County Historical Society,images,"Latah County, ID",46.732824,-116.99744,1904,2000,lchsphotos,https://digital.lib.uidaho.edu/cdm/ref/collection/lchsphotos/id/72,People on Bovill&apos;s Main Street
Bunker Hill Labor Collection,bunkerhill,Bunker Hill,Bunker Hill Labor History Collection,463,463,bunkerhill,visible,,,bunkerhill,,,2020-10,yes,https://www.lib.uidaho.edu/digital/bunkerhill/,Idaho; Mining; Labor;,Collection,Bunker,463 letters of correspondence between the managers and owners of the Bunker Hill Mine and Sullivan M. &amp; C. Co.,The Bunker Hill Labor History Collection is 463 letters of correspondence between the managers and owners of the Bunker Hill Mine &amp; Sullivan M. &amp; C. Co.,documents,"Wardner, ID",47.523164,-116.13419,1899,1902,bunkerhill,https://digital.lib.uidaho.edu/cdm/ref/collection/bigburn/id/45,Forest Fire 1910 - Bunker Hill correspondence
"C. H. Shattuck, Idaho Lantern Slides, 1904-1910",shattuck,Shattuck Collection,"C. H. Shattuck, Idaho Lantern Slides, 1904-1910",212,212,spec_cs,visible,y,,shattuck,,,2020-05,yes,https://www.lib.uidaho.edu/digital/shattuck/,Idaho; UI; Wilderness;,AltCollection,Shattuck,"Early twentieth century slides depicting the University of Idaho, as well as the wilderness of Idaho and Idaho residents&apos; attempts at domesticating it","Charles Houston Shattuck was a professor in the College of Agriculture (now Natural Resources) who initiated &apos;Arboretum Hill&apos; (now known as the Charles Houston Shattuck Arboretum). These early twentieth century slides depict the University of Idaho, as well as the wilderness of Idaho and Idaho residents&apos; attempts at domesticating it.",images,"Selway-Bitterroot Wilderness Region; Bitterroot Mountain, ID; University of Idaho; Moscow, ID; Packers Meadows, ID; Kaniksu National Forest, MT; Lolo Hot Springs, MT;",46.724545,-117.015397,1904,1910,shattuck,https://digital.lib.uidaho.edu/cdm/ref/collection/spec_cs/id/10,White Sand Lake (Idaho)
Carleton Watkins Mine Interiors Collection,watkins,Watkins Collection,"Carleton Watkins Mine Interiors Collection (1890, Butte, MT)",80,80,watkins,visible,,,watkins,,,2020-11,yes,https://www.lib.uidaho.edu/digital/watkins/,Mining; Northwest;,Collection,Watkins,"Interior photos of mines in Butte, Montana, 1890, hundreds of feet below ground","Among the riches of the historical photograph collections of the University of Idaho Library is an oversize portfolio of eighty original Carleton E. Watkins photographs. Long considered lost, these photographs of the interior of the Anaconda Mines in Butte, Montana, were taken in 1890. They show early hard-rock mining techniques, equipment, and men deep underground.",images,"Butte, MT",46.036746,-112.506437,1890,1891,watkins,https://digital.lib.uidaho.edu/cdm/ref/collection/watkins/id/62,Anaconda Mines - Mt Con 400 level East sill floor
Cattle Producer's Handbook Collection,cattle,Cattle Handbook,Cattle Producer's Handbook Collection,12,12,cattle,visible,,no,cattle,,,2020-10,yes,https://www.lib.uidaho.edu/digital/cattle/,UIResearch; Agriculture; Environmental; Idaho; UI;,AltCollection,Cattle,Handbook prepared regularly by the Western Beef Resource Committee (WBRC),"The Cattle Producer's Handbook is prepared by the Western Beef Resource Committee (WBRC), which consists of beef specialists, economists, range scientists, animal nutritionists, county educators, and veterinarians from the Cooperative Extension System and cattle industry.",documents,"Twin Falls, ID",42.562404,-114.460263,2014,2018,cattle,https://commons.wikimedia.org/wiki/File:Brown_Cow_Drawing.jpg,Brown cow image from wikimedia
Chatcolab NW Leadership Lab Collection,chatcolab,Chatcolab Collection,Chatcolab NW Leadership Lab,47,47,chatcolab,visible,,,chatcolab,,,2020-10,yes,https://www.lib.uidaho.edu/digital/chatcolab/,Idaho; Northwest; UIResearch;,AltCollection,Chatcolab,A collection of packets from the Chatcolab Northwest Leadership Laboratory. Chatcolab offers a unique opportunity to build leadership by engaging in the creative planning and then sharing of a recreational experience.,The Chatcolab Northwest Leadership Laboratory has been running each summer since 1949. Chatcolab offers a unique opportunity to build leadership by engaging in the creative planning and then sharing of a recreational experience. This collection of packets was donated by Bob Carver to the University of Idaho Library and digitized by the digital initiatives unit in 2017.,documents,"Rathdrum, ID",47.877418,-116.856805,1949,1995,chatcolab,https://digital.lib.uidaho.edu/cdm/ref/collection/chatcolab/id/12,Chatcolab Packet 1968
Columbia River Basin Project: Dam Construction in the Pacific Northwest,crbp,Coulee Dam Collection,Columbia River Basin Project: Dam Construction in the Pacific Northwest,456,456,crbproj,visible,,,crbproj,,,2020-11,yes,https://www.lib.uidaho.edu/digital/crbp/,Dams; Construction; Water; Northwest;,Collection,Columbia,"Historical photographs of Grand Coulee Dam and Columbia River Basin Project construction, 1933-1965","Digitized photographs pertaining to the Columbia Basin Project. Special emphasis is placed on the construction of Grand Coulee Dam, the canal systems of Central Washington, and numerous other dams in the Inland Northwest.",images,"Grand Coulee, WA; Canal systems of Central Washington",47.959223,-118.974938,1933,1965,crbp,https://digital.lib.uidaho.edu/cdm/ref/collection/crbproj/id/1040,Man stands on siphon
CTRL+SHIFT,,CTRL-SHIFT,,,,,visible,,no,,,https://github.com/ctrlshifty/ctrlshifty.github.io,,,https://ctrl-shift.org/,Poetry; UIResearch; Oral History;,CDIL,CTRL-SHIFT,11 Contemporary Poets on writing through the advent of the personal computer and into the arrival of the digital age.,"CTRL+SHIFT is an online collection of audio recordings, transcripts, process visualizations, and data analyses broken out from interviews conducted with 11 prominent contemporary American poets from across the United States. The project examines recent changes in writing practices that occurred due to the advent of the computer and the arrival of the digital age and investigates new modes of working with and publishing data from qualitative interview studies.",documents; images; video,"Los Angeles, CA; Cambridge, MA; Irvine, CA; New York, NY; Moscow, ID; Liberty Lake, WA; Ashland, OR; Long Beach, CA; Cambridge, MA; Bellingham, WA; San Diego, CA;",,,2013,2018,ctrl-shift,,
Digital Scholarship Collection,digschol,Digital Scholarship,Digital Scholarship Collection,4,4,digschol,noshow,,no,,,,,,https://digital.lib.uidaho.edu/digital/collection/digschol/,UIResearch;,CDIL,Digital,Website records of past digital scholarship at the University of Idaho,Website records of past digital scholarship at the University of Idaho,urls,"University of Idaho; Moscow, ID;",46.728014,-117.011009,2000,2015,,na,
Dizzy Gillespie Collection,gillespie_dizzy,Dizzy Gillespie Collection,Dizzy Gillespie Collection,18,18,ijcdg,visible,,no,,ijc,,,,https://www.ijc.uidaho.edu/gillespie_dizzy/,IJC; Jazz;,IJCCollection,IJC-Gillespie,Images and memorabilia from the Dizzy Gillespie Collection.,This collection was assembled by Special Collections and Archives of the University of Idaho Library with materials donated by Mrs. Gillespie. The collection contains fifteen items that belonged to the artist.,memorabilia,"University of Idaho (Library); Moscow, ID;",46.72732,-117.01412,1987,2000,gillespie_dizzy,https://digital.lib.uidaho.edu/cdm/ref/collection/ijcdg/id/6,Plaster Mask
Donald R. Theophilus Boxing Photograph Collection,boxing,Boxing Collection,Donald R. Theophilus Boxing Photograph Collection,53,53,boxing,visible,,,boxing,,,2020-06,yes,https://www.lib.uidaho.edu/digital/boxing/,UI; Idaho; Sports; Campus;,Collection,Boxing,"Photographs of University of Idaho Boxers and Boxing Teams, 1934 - 1953",A digital collection comprised of 52 photographs of boxers and boxing teams from the University of Idaho,images,"University of Idaho; Sacramento, CA;",46.727485,-117.014185,1934,1953,boxing,https://digital.lib.uidaho.edu/cdm/ref/collection/boxing/id/5,1947-1948 University of Idaho boxing squad
Dworshak Dam Collection,dworshak,Dworshak Dam,Dworshak Dam Collection,501,501,dworshak,visible,,,dworshak,,,2020-11,yes,https://www.lib.uidaho.edu/digital/dworshak/,Dams; Construction; Water; Northwest; Idaho; Maps;,Collection,Dworshak,"Documenting the Development and Construction of the Doworshak Dam, 1952 - 1975","Digitized photographs and documents pertaining to the planning, development and construction of the Dworshak Dam, featuring documents and photographs detailing both the legislative and physical development of the dam.",documents; images,"Dworshak Dam, ID",46.515697,-116.296881,1952,1973,dworshak,https://digital.lib.uidaho.edu/cdm/ref/collection/dworshak/id/552,Aerial view of clearwater river before construction of Dworshak Dam
"Edward John Iddings Lantern Slides, 1927",iddings,Iddings Collection,"John Edward Iddings, Lantern Slides, 1927",157,157,spec_ji,visible,,,iddings,,,2020-06,yes,https://www.lib.uidaho.edu/digital/iddings/,UIResearch; Agriculture; UI; Idaho;,AltCollection,Iddings,"Slides from longtime College of Agriculture Dean, Edward John Iddings, including university-, agriculture-, and travel-related images","Edward John Iddings was the Dean of the College of Agriculture at UI from 1915 to 1946. These slides depict agricultural and university-related scenes from Idaho, as well as images from Iddings&apos; travels.",images,"University of Idaho (Admin building); Moscow, ID;",46.727874,-117.028127,1927,1927,iddings,https://digital.lib.uidaho.edu/cdm/ref/collection/spec_ji/id/426,Scottish Highland Cattle
Ernie Day Photograph Collection,ernieday,Ernie Day Photograph Collection,,11,11,,visible,,,,spec,https://github.com/uidaholib/collectionbuilder-sa-spec-exhibits/tree/ernieday,2021-04,yes,https://www.lib.uidaho.edu/digital/ernieday/,Idaho; Wilderness; Photography,Collection,Ernie,Nature photographs taken by Ernest E. Day,"Photographs taken by Ernie Day depicting just a few of the many mountains and lakes found in Idaho, particularly those found within the Sawtooth National Recreation Area.",images,Idaho,43.82756523,-114.5895217,1970,1970,ernieday,,Mt. Hyndman with Pioneer Range
Experimental Forest and Savenac Nursery Photo Archive,expforest,Exp. Forest Photos,Experimental Forests and Savenac Nursery Photo Archive,848,848,expforsav,visible,,,expforsav,,,2020-11,yes,https://www.lib.uidaho.edu/digital/expforest/,Forests; Idaho; Northwest; Fire; UIResearch;,Collection,Experimental,"Historical photographs of Experimental Forests and Savenac Nursery in Northern Idaho and Northwestern Montana, 1910 - 1989","The Experimental Forest and Savenac Nursery Photo Archive contains photographs related to or depicting the establishment of two Forest Service Experimental Forests in north Idaho, Priest River and Deception Creek, and the Savenac Nursery in Montana.",images,"Priest River, ID; Deception Creek, ID; Savenac Nursery, MT;",48.571027,-116.823399,1910,1989,expforest,https://digital.lib.uidaho.edu/cdm/ref/collection/expforsav/id/232,Interior view of thinning in 65-year western white pine.
"Family Tree Collection, a Potlatch Forests, Inc. Newsletter",familytree,Family Tree Collection,"Family Tree Collection, a Potlatch Forests, Inc. Newsletter",180,180,spec_pot,visible,,,familytree,,,2020-11,yes,https://www.lib.uidaho.edu/digital/FamilyTree/,"Idaho; Forests; Latah; Potlatch, ID;",Collection,Family,"A Potlatch Forests, Inc. Newsletter Published from 1936-1952","The Family Tree was a newsletter published by Potlatch Forests, Inc. for their employees from 1936 - 1952. The newsletter covers local (Potlatch area) and national events, with a special focus on issues pertaining to Potlatch Forests and its loggers and other employees.",documents,"Potlatch, ID",46.921354,-116.903071,1936,1952,familytree,https://digital.lib.uidaho.edu/cdm/ref/collection/spec_pot/id/1149,"The Family Tree - 1947, September"
Finding Aids (EAD),spec_fa,Finding Aids,Finding Aids,1106,425,spec_fa,noshow,,no,,,,,,https://digital.lib.uidaho.edu/cdm/landingpage/collection/spec_fa,UI; Idaho;,AltCollection,Finding,University of Idaho Library Special Collections and Archives Guides and Descriptions,Finding Aids are guides to the physical collections held by the Library&apos;s Special Collections &amp; Archives Department. All material mentioned in these guides can be read or examined by request. See here for more information about accessing these materials.,documents,"University of Idaho (Library); Moscow, ID;",46.72748,-117.01396,1889,2011,spec_fa,na,
Fugue Literary Journal Collection,fugue,Fugue Collection,Fugue Literary Journal Collection,4300,38,fugue,visible,,no,,,,,,https://digital.lib.uidaho.edu/digital/collection/fugue,UIResearch; UI,Journal,Fugue,The official literary journal of the University of Idaho&apos;s English Department,Fugue is the official literary journal of the University of Idaho&apos;s English Department.,documents; images,"University of Idaho (English Department); Moscow, ID;",46.728091,-117.012692,1990,2013,fugue,https://digital.lib.uidaho.edu/cdm/ref/collection/fugue/id/3889,"Fugue Summer-Fall, Fall 2010 (No. 39)"
Gem of the Mountains Digital Yearbook Collection,gem,Gem Collection,Gem of the Mountains Digital Yearbook Collection,102,102,gem,visible,,no,,,,,yes,https://www.lib.uidaho.edu/digital/gem/,UI; Campus;,CampusCollection,Gem,The official yearbook of the University of Idaho from 1903 to 2004,The Gem of the Mountains was the official yearbook of the University of Idaho from 1903 to 2004.,documents; images,"University of Idaho (Library); Moscow, ID;",46.727332,-117.012296,1903,2004,gem,https://www.lib.uidaho.edu/digital/gem/,Collection Home Page
Guided Reading Library,guidedreading,Guided Reading,Guided Reading Library,122,122,guidedread,visible,,,guidedreading,,,2020-04,yes,https://www.lib.uidaho.edu/digital/guidedreading/,UI; Education;,AltCollection,Guided,"A library of guided reading material from the University of Idaho College of Education, curated by Margaret Vaughn","The Guided Reading Library is a digital collection of short books created by students in the University of Idaho&apos;s College of Education. This library is directed by Margaret Vaughn, in collaboration with the Digital Inititiaves department of the University of Idaho Library.",documents; audio,"University of Idaho; Moscow, ID;",46.725896,-117.012357,2013,2016,guidedreading,https://www.lib.uidaho.edu/digital/guidedreading/library/Bread.html,Facts about Bread
Harry Webb Marsh Collection,marsh,Marsh Collection,,6,6,,visible,,,marsh,,,2021-03,yes,https://www.lib.uidaho.edu/digital/marsh/,Idaho; Mining,Collection,Harry,Historic Mining Films from Idaho's Silver Valley Mining District,"A collection of historic mining films from Idaho's Silver Valley Mining District and elsewhere, originally filmed by Harry Webb Marsh.",video,Idaho,47.53844844,-116.1187132,1926,1950,marsh,https://www.lib.uidaho.edu/digital/barstock/items/barstock256.html,"Bunker Hill, Glory Hole, Kellogg, Idaho"
Historical Japanese Ceramic Comparative Collection (HJCCC),hjccc,HJCCC,Historical Japanese Ceramic Comparative Collection (HJCCC),80,80,HJCCC,visible,,no,,,https://github.com/uidaholib/HJCCC_source,2019-11,yes,https://www.lib.uidaho.edu/digital/hjccc/,Archaeology; Northwest; UIResearch,CDIL,Historical Japanese,Japanese ceramics from archaeological sites in the American West.,"The Historical Japanese Ceramic Comparative Collection (HJCCC) provides researchers with comparative examples of Japanese ceramics that are found on North American archaeological sites. The HJCCC contains digital photographs and resources for identifying and describing Japanese ceramics manufactured during the Meiji, Taisho, and early Showa eras (roughly the mid-nineteenth and early twentieth centuries). It is intended to assist in identification of historical Japanese ceramics, to encourage the use of standardized terminology, and to promote further research.",images,Pacific Northwest,,,2018,2019,hjccc,https://www.lib.uidaho.edu/digital/hjccc/objects/aacc-bowls-4-center-crop4.jpg,Composite of various pieces from the collection
HistPhoto - Historical Photograph Database,histphoto,HistPhoto,,,,,noshow,,no,,,,,,https://www.lib.uidaho.edu/special-collections/histphoto/,Reference Materials,Application,HistPhoto,A Special Collections &amp; Archives Historical Photograph Database,A Special Collections &amp; Archives Historical Photograph Database,documents,"University of Idaho (Library); Moscow, ID;",46.72756,-117.01404,1863,1975,histphoto,na,na
Idaho Cities &amp; Towns,cities,Idaho Cities,Idaho Cities and Towns,1083,1083,cities,visible,y,,cities,,,2021-03,yes,https://www.lib.uidaho.edu/digital/cities/,Idaho;,Collection,Idaho Cities,"From Aberdeen to Yellow Dog - Historical Photos of 134 Cities and Towns, 1862 - 1998",The 1083 historical photographs in the Idaho Cities &amp; Towns collection document Idaho cities and towns from the mid 1800s to the end of the twentieth century.,images,Idaho,46.826007,-116.613768,1862,1998,cities,https://digital.lib.uidaho.edu/cdm/ref/collection/cities/id/30,"Sunday School group standing in front of church building in Avon, Idaho."
