image-src,image-alt,title,paragraph,link,link-text,link2,link2-text
/media/carousel/LibraryClockTower_car.jpg,Library tower in sun,Welcome back!,The library is open with new hours. Please check our Updates page for details.,https://www.lib.uidaho.edu/about/updates.html,Updates,,,
/media/carousel/headway-5QgIuuBxKwM-unsplash.jpg,hands gesturing in workshop by Headway on unsplash,Library Workshops,The library hosts workshops every week. Join us to learn about tools that impact your research or kick start your projects!,https://www.lib.uidaho.edu/services/workshops/,Schedule,,
/media/carousel/christin-hume-Hcfwew744z4-unsplash.jpg,laptop with person typing,Chat help is available 24/7!,"Get help from a librarian 24 hours a day, 7 days week via chat--we'll help you find articles, books, and more!",https://www.lib.uidaho.edu/help/chat.html,Ask Us!,
/media/carousel/instruction.png,intruction topics in circles,Library Instruction,"Librarians offer instruction sessions on dozens of topics. Browse expertise and request a classroom session!",https://www.lib.uidaho.edu/services/instruction/topics.html,View Topics,
/media/carousel/lisa_mylibrary5.jpg,Lisa Jones in the library,What Does Your Library Look Like?,"Explore our new <em>My Library</em> stories highlighting students and little-known library services.",https://www.lib.uidaho.edu/mylibrary/,My Library,
