image-src,image-alt,title,paragraph,link,link-text,link2,link2-text
/media/carousel/LibrarySpring.jpg,"flower in front of library",Happy Summer!,"The Library's summer hours are in effect from May 15 - August 20. Stop by, we'd love to see you!",https://www.lib.uidaho.edu/about/hours.html#summer,Summer Hours,
/media/carousel/cccidaho6.jpg,Young Men Diving into Lake during CCC Carnival,Dive in!,"Take time to explore our digital collections featuring historic content from Special Collections.",https://www.lib.uidaho.edu/digital/collections.html,Digital Collections,
/media/carousel/uiblackhistory_04.jpg,photo of exhibit in library,Celebrating Black History,"Visit our new online exhibit celebrating Black history at the U of I, created in collaboration with the <a href='https://www.uidaho.edu/ed/about/spaces/bhrl'>Black History Research Lab</a>.",https://www.lib.uidaho.edu/blackhistory/,Digital Collection,,
/media/carousel/christin-hume-Hcfwew744z4-unsplash.jpg,laptop with person typing,Chat help is available 24/7!,"Don't know where to start on that assignment? Get research help from a librarian 24 hours a day via chat!",/help/chat.html,Ask Us 24/7!,
/media/carousel/lisa_mylibrary5.jpg,Lisa Jones in the library,What Does Your Library Look Like?,"Explore our new <em>My Library</em> stories highlighting students and little-known library services.",/mylibrary/,My Library,
