finding_aid_link,title,type,group,number,digital_collection,category,subject,description
https://search.lib.uidaho.edu/UID:CP71118377670001451,"Laura Fraser. An analysis of patriarchal religious values / typescript, 1979",MG,MG 5457,5457,,,,
https://search.lib.uidaho.edu/UID:CP71118377310001451,"Janet McCloud. Travels upon mother earth / typescript, 1979",MG,MG 5458,5458,,,,
https://search.lib.uidaho.edu/UID:CP71118374360001451,"Classmates : 8th grade graduates, 1914, Wardner-Kellogg High School : typescript, [1956]",MG,MG 5459,5459,,,,
https://search.lib.uidaho.edu/UID:CP71162319910001451,"United States. Federal Bureau of Investigation. Doris D Blazek. Ezra Pound file, 1945-1958",MG,MG 5460,5460,,,,
https://search.lib.uidaho.edu/UID:CP71122534530001451,"Dorothy Pound. Letter, Brunnenburg, Tirolo, Merano, Italy, to Thomas Rogers, Aug. 5, 1962",MG,MG 5461,5461,,,,
https://search.lib.uidaho.edu/UID:CP7194444300001451,"Henrietta Josephine Tromanhauser. Jesse Everett Buchanan; William F Standeford. Latin roots in living English / typescript, [1935]",MG,MG 5462,5462,,,,
https://search.lib.uidaho.edu/UID:CP71162317650001451,"Paul A. Eke papers, 1931-1939",MG,MG 5463,5463,,,,
https://search.lib.uidaho.edu/UID:CP71162317880001451,"Louis N. Roos papers, 1897-1948",MG,MG 5464,5464,,,,
https://search.lib.uidaho.edu/UID:CP71144818800001451,John Roy Bower Jr. A study of factors affecting the formation and properties of molded gelatinized wood : Progress report submitted to Dr. Edwin C. Jahn of the Idaho School of Forestry / June 1938,MG,MG 5465,5465,,,,
https://search.lib.uidaho.edu/UID:CP71118370650001451,"J. Rosa (John Marvin). End of the hydraulic civilizations, or ""Hohokam"" without water : history of the development and conservation of water / typescript, July 1961",MG,MG 5466,5466,,,,
https://search.lib.uidaho.edu/UID:CP71122546510001451,"Autobiography of Trevor Kincaid : the adventures of an onmologist : typescript, 1962",MG,MG 5467,5467,,,,
https://search.lib.uidaho.edu/UID:CP71122545360001451,"George R. Trotter Diary, 1935-[193-?]",MG,MG 5468,5468,,,,
https://search.lib.uidaho.edu/UID:CP71102894670001451,"Robert W. Burns (Robert Whitehall). Papers relating to the Golden Age, July 7-Nov. 30, 1959",MG,MG 5469,5469,,,,
https://search.lib.uidaho.edu/UID:CP71122556920001451,"Herman C. Schupfer. The beginning and progress of electrical service in Kendrick, Troy, Juliaetta, Deary, Bovill, Elk River, and communities / typescript, 1974",MG,MG 5470,5470,,,,
https://search.lib.uidaho.edu/UID:CP71126079520001451,"J. A. Drager Letter, Feb. 3, 1903",MG,MG 5471,5471,,,,
https://search.lib.uidaho.edu/UID:CP71144799580001451,"Harlan B. Holmes. Analysis of evidence of influence of Bonneville Dam upon the magnitude of the runs of salmon in the Columbia River : typescript, 1943",MG,MG 5472,5472,,,,
https://search.lib.uidaho.edu/UID:CP71122555550001451,"Philip H. Reisman. Donald B Hyatt; NBC Television Network. The real west : the story of the American West, 1949-1900 ... / typescript, [1961?]",MG,MG 5473,5473,,,,
https://search.lib.uidaho.edu/UID:CP71163252790001451,"J. S. Shaw G. W Richard. Letter, Boise City, Idaho, to G.W. Richard, Carson, Nevada, June 5, 1897",MG,MG 5474,5474,,,,
https://search.lib.uidaho.edu/UID:CP71163257220001451,"Letter, Riddle Brothers, Riddle, Idaho, to State Bank and Trust, Carson City, Nevada, Nov. 15, 1905",MG,MG 5475,5475,,,,
https://search.lib.uidaho.edu/UID:CP71102895140001451,"W. C. Hammon Leo Brust. Correspondence, Jan. 24-July 28, 1942",MG,MG 5476,5476,,,,
https://search.lib.uidaho.edu/UID:CP71163241480001451,"Collegiate Conference Basketball League. J Blanchard. Minuits [sic] of basket ball meeting at Walla Walla, Washington : typescript, Oct. 28, 1909",MG,MG 5477,5477,,,,
https://search.lib.uidaho.edu/UID:CP71162295510001451,"Paul Mann; Auttis M Mullins; United States. President (1974-1977 : Ford); Idaho. Governor (1971-1977 : Andrus). Proclamations on the centennial of agricultural experiment stations, Oct. 27-Nov. 7, 1975",MG,MG 5478,5478,,,,
https://search.lib.uidaho.edu/UID:CP71162297090001451,"John M. Harris papers, Sept. 17, 1890-Dec. 1, 1892",MG,MG 5479,5479,,,,
https://search.lib.uidaho.edu/UID:CP71163247150001451,"George W. Tannahill letter, to F.W. Settlemeier, Woodburn, Oregon, Jan. 29, 1901",MG,MG 5480,5480,,,,
https://search.lib.uidaho.edu/UID:CP71103848340001451,"Luther Perry Wilmot. Narratives of the Nezperce war : typescript, [1922?]",MG,MG 5481,5481,,,,
https://search.lib.uidaho.edu/UID:CP71163249030001451,"Elvin Ogle. Early pioneer days and the Nez Perce War : typescript, [1931?]",MG,MG 5482,5482,,,,
https://search.lib.uidaho.edu/UID:CP71126292060001451,"Edmund Morrison. The misfortunes of Joseph : a view of the Nez Perce War / typescript, [ca. 1936]",MG,MG 5483,5483,,,,
https://search.lib.uidaho.edu/UID:CP71103895420001451,"E. G. Wagner Richard Kleesattel. Report on Black Diamond Mine, Dixie, Idaho / typescript, Sept. 7, 1932",MG,MG 5484,5484,,,,
https://search.lib.uidaho.edu/UID:CP71103893310001451,"Idaho Research Foundation. Herbert Sydney Duncombe. Idaho tomorrow game : typescripts, 1974",MG,MG 5485,5485,,,,
https://search.lib.uidaho.edu/UID:CP71103905690001451,"Paul Wilson. University of Idaho history : typescript, [after 1982]",MG,MG 5486,5486,,,,
https://search.lib.uidaho.edu/UID:CP7197506840001451,"I. A. Rodeheffer United States. Bureau of Fisheries. A survey of the waters of the Challis National Forest, Idaho / typescript, Apr. 1935",MG,MG 5487,5487,,,,
https://search.lib.uidaho.edu/UID:CP7197505270001451,"Nancy Lamb of Idaho. Which city will grow? Which will decline? / typescript, Jan. 3, 1963",MG,MG 5488,5488,,,,
https://search.lib.uidaho.edu/UID:CP71162296980001451,"S. N. Nichols papers, [after 1905]",MG,MG 5489,5489,,,,
https://search.lib.uidaho.edu/UID:CP71163818940001451,"Aldo Leopold 1886-1948. Sporting Arms and Ammunition Manufacturers' Institute. Game Restoration Committee. Reports, 1928-1929",MG,MG 5490,5490,,,,
https://search.lib.uidaho.edu/UID:CP7197501860001451,"Jack Lee Hoffman. Letter, Boise, Idaho, to Larry Merk and Mike DiNoto, Moscow, Idaho, July 5, 1989",MG,MG 5491,5491,,,,
https://search.lib.uidaho.edu/UID:CP71152993000001451,"K. Kumar Robert P Lottman; Ronald W Stark. Feasibility of straw-reinforced rigid urethane foam, fracture strength measurements : Final report : typescript, Sept. 30, 1971",MG,MG 5492,5492,,,,
https://search.lib.uidaho.edu/UID:CP71152999360001451,"Willis Sweet. Henry B Blake; Richard Zina Johnson. Letter, Willis Sweet, president, and H.B. Blake, secretary, to R.Z. Johnson, Boise City, Idaho, June 10, 1889",MG,MG 5493,5493,,,,
https://search.lib.uidaho.edu/UID:CP71152981570001451,"Verne Blalack. The geology of Lemhi County / typescript, [1969?]",MG,MG 5494,5494,,,,
https://search.lib.uidaho.edu/UID:CP71152983610001451,"Herbert Elmer Lattig (donor). History of agricultural education of less than college grade in the University of Idaho : typescript, 1940",MG,MG 5495,5495,,,,
https://search.lib.uidaho.edu/UID:CP71152984820001451,"George W. Cleveland. Dairy trends in Idaho / typescript, [ca. 1962]",MG,MG 5496,5496,,,,
https://search.lib.uidaho.edu/UID:CP71103912010001451,"Fifty years of dairying in Idaho : typescript, [after 1960]",MG,MG 5497,5497,,,,
https://search.lib.uidaho.edu/UID:CP71165625590001451,"Idaho's eighteen years of dairy development : typescript, [ca. 1928]",MG,MG 5498,5498,,,,
https://search.lib.uidaho.edu/UID:CP71165638080001451,"University of Idaho. Caldwell Dairy Research. Five year program of work for Caldwell Dairy Research : typescript, [19--]",MG,MG 5499,5499,,,,
https://search.lib.uidaho.edu/UID:CP71165622090001451,"Earl C Hall. General notes on Bonner County (the panhandle section of Idaho) : typescript, [ca. 1912]",MG,MG 5500,5500,,,,
https://search.lib.uidaho.edu/UID:CP71163800380001451,"University of Idaho. Department of Agricultural Extension Records, 1976-1977",MG,MG 5501,5501,,,,
https://search.lib.uidaho.edu/UID:CP71163800740001451,"University of Idaho. Department of Plant Pathology Budgets, 1919-1926",MG,MG 5502,5502,,,,
https://search.lib.uidaho.edu/UID:CP71177646260001451,"Idaho Auxiliary Experiment Station Records, 1907-1908",MG,MG 5503,5503,,,,
https://search.lib.uidaho.edu/UID:CP71177631100001451,"B. Butler Papers, 1978",MG,MG 5504,5504,,,,
https://search.lib.uidaho.edu/UID:CP71173914160001451,"J. W. Shepperd. Ivanhoe note book : manuscript, 1898",MG,MG 5505,5505,,,,
https://search.lib.uidaho.edu/UID:CP71161146180001451,"Raymond M. Tanner. Memorial card, 1918",MG,MG 5506,5506,,,,
https://search.lib.uidaho.edu/UID:CP71177632730001451,"Ronald V. Glens Jasper Rand; John MacEachern. Papers relating to lynching of Chinese near Pierce, Idaho, [1885]-1958",MG,MG 5507,5507,,,,
https://search.lib.uidaho.edu/UID:CP71179305330001451,"Richard G. Magnuson. Papers relating to Wyatt Earp in Idaho, 1884-1959",MG,MG 5508,5508,,,,
https://search.lib.uidaho.edu/UID:CP71165620150001451,"Edgar Henry Neal. Moscow or bust, typescript, [ca. 1989]",MG,MG 5509,5509,,,,
https://search.lib.uidaho.edu/UID:CP71145702530001451,"Harry Webb Marsh 1886-1964. Jerome J. Day Mrs.; Idaho Mining Association. Letter : to Mrs. Jerome J. Day, Tall Pines, Coeur d'Alene City, Idaho, [1956]",MG,MG 5510,5510,,,,
https://search.lib.uidaho.edu/UID:CP71104937140001451,"James Donald Forrester. An analysis of building facilities at the College of Mines, University of Idaho / typescript, Jan. 1956",MG,MG 5511,5511,,,,
https://search.lib.uidaho.edu/UID:CP71162318140001451,"Idaho Sociological Society. Scrapbook, [1908]-1909",MG,MG 5512,5512,,,,
https://search.lib.uidaho.edu/UID:CP71104930580001451,"Marvin A. Jagels. Latah County, Idaho / typescript, 1954",MG,MG 5513,5513,,,,
https://search.lib.uidaho.edu/UID:CP71104944230001451,"Grace Woodworth. Child psychology : manuscript, [189-]",MG,MG 5514,5514,,,,
https://search.lib.uidaho.edu/UID:CP71104942790001451,"Minidoka Relocation Center. Historical narrative report, Community Management Division, Education Section, Minidoka Project Schools / typescript, 1945",MG,MG 5515,5515,,,,
https://search.lib.uidaho.edu/UID:CP7197496720001451,"Minidoka Relocation Center. Curriculum report, Community Management Division, Education Section, Minidoka Project Schools / typescript, 1945",MG,MG 5516,5516,,,,
https://search.lib.uidaho.edu/UID:CP71104985740001451,"Frank Sala. Louis and Margaret Sala Family centennial reunion, 1890-1990 : typescript, 1990",MG,MG 5517,5517,,,,
https://search.lib.uidaho.edu/UID:CP71104988760001451,"Richard G. Magnuson. My Nono : typescript, [1990]",MG,MG 5518,5518,,,,
https://search.lib.uidaho.edu/UID:CP71118375650001451,"Allen Proctor Jeffries. A survey of Idaho's high school English teachers, 1962-63 / May 1963",MG,MG 5519,5519,,,,
https://search.lib.uidaho.edu/UID:CP71118378050001451,"Elwood R. Maunder interviewer. Forest History Society. Oral history volume of forest entomology in the West / typescript, May 1977",MG,MG 5520,5520,,,,
https://search.lib.uidaho.edu/UID:CP71118374630001451,"Henry S. L. Fan. Investigation of inclusion-matrix method of concrete mixture design / typescript, Jan. 22, 1969",MG,MG 5521,5521,,,,
https://search.lib.uidaho.edu/UID:CP71122530950001451,"Henry Fallenstein Gauss. University of Idaho. Department of Mechanical Engineering. Mechanical engineering : typescript, [1926]",MG,MG 5522,5522,,,,
https://search.lib.uidaho.edu/UID:CP71118370360001451,"Caroline Bowler. Our trip to the Yellowstone National Park : typescript, [ca. 1965]",MG,MG 5523,5523,,,,
https://search.lib.uidaho.edu/UID:CP71118371500001451,"Idaho. Governor (1947-1950 : Robins) C. A Robins (Charles Armington). Address by C.A. Robins, governor, typescript, June 13, 1949",MG,MG 5524,5524,,,,
https://search.lib.uidaho.edu/UID:CP71122555200001451,"A. J. Teske Idaho Mining Association. Mining in Idaho : typescript, Nov. 11-12, 1960",MG,MG 5525,5525,,,,
https://search.lib.uidaho.edu/UID:CP9947706501851,"Coeur d'Alene Water Supply Company. William Stanley Lewis; W Morgner. Certificate of debt, Apr. 8, 1885",MG,MG 5526,5526,,,,
https://search.lib.uidaho.edu/UID:CP71162318120001451,"William Charles McGowan, Jr., papers, 1937-1940",MG,MG 5527,5527,,,,
https://search.lib.uidaho.edu/UID:CP71149090280001451,"University of Idaho. Dept. of History. Fred Herbert Winkler lecture notes, [195-?]",MG,MG 5528,5528,,,,
https://search.lib.uidaho.edu/UID:CP71162295590001451,"Vachel Lindsay. Lumberjack philosophy : typescripts, [1928]",MG,MG 5529,5529,,,,
https://search.lib.uidaho.edu/UID:CP71122554400001451,"Autobiography of Ethel E. Redfield : typescript, Nov. 1951",MG,MG 5530,5530,,,,
https://search.lib.uidaho.edu/UID:CP71122553640001451,"F. D. Roberts. A history of Greenleaf Academy : Summer 1931 : typescript, 1931",MG,MG 5531,5531,,,,
https://search.lib.uidaho.edu/UID:CP71163253840001451,"F. A. Swager. Letter, Salt Lake City, Utah, to Mr. Schock, Moscow, Idaho, July 20, 1931",MG,MG 5532,5532,,,,
https://search.lib.uidaho.edu/UID:CP71163255720001451,"John A Rosholt; Allan R Ansell; Historic American Engineering Record. Historic American Engineering Record : Milner Dam and South Side Main Canal : typescript, June 1989",MG,MG 5533,5533,,,,
https://search.lib.uidaho.edu/UID:CP71163247770001451,"Historic American Engineering Record. Historic American Engineering Record : Index to photographs: Milner Dam and South Side Main Canal, Jerome and Twin Falls Counties, Idaho : typescript, [1989]",MG,MG 5534,5534,,,,
https://search.lib.uidaho.edu/UID:CP71121450100001451,"Bodil A. Bratvold. The improvement of Coeur d'Alene Indian education, 1970",MG,MG 5535,5535,,,,
https://search.lib.uidaho.edu/UID:CP71126290740001451,"Scott Anderson. Summary literature search, advanced mining methods, 1982",MG,MG 5536,5536,,,,
https://search.lib.uidaho.edu/UID:CP71163249390001451,"William H. Homer; Eugene W Whitman. History of the Moony [i.e. Mooney] and Barns murder case, 1882",MG,MG 5537,5537,,,,
https://search.lib.uidaho.edu/UID:CP71179330000001451,"Austin B. Clayton. [Silver mills of Cerro de Pasco as observed 1936 to 1939], 1984",MG,MG 5538,5538,,,,
https://search.lib.uidaho.edu/UID:CP71177633650001451,"Dedication program, newspaper clipping, copies of remarks and letters of invitation and replies, referring to the dedication of the Gooding Wing of the Wallace Residence Center, University of Idaho, on October 28, 1967",MG,MG 5539,5539,,,,
https://search.lib.uidaho.edu/UID:CP71177634460001451,"Stephen D. Shawley. Nez Perce Indian material, 1910-1939",MG,MG 5540,5540,,,,
https://search.lib.uidaho.edu/UID:CP71208006780001451,"A tribute to Hank Juve, University of Idaho Chemistry Department, 1982-1993, 1993",MG,MG 5541,5541,,,,
https://search.lib.uidaho.edu/UID:CP9953646801851,"Robert T. Parker Francis Jenkins Papers, 1951",MG,MG 5542,5542,,,,
https://search.lib.uidaho.edu/UID:CP71177631180001451,"Beta Theta Pi. Gamma Gamma Chapter (University of Idaho) Charles E McCulloch. Papers, 1919-1920",MG,MG 5543,5543,,,,
https://search.lib.uidaho.edu/UID:CP71106203310001451,"Abot Mining Company papers, 1967-1974",MG,MG 5544,5544,,,,
https://search.lib.uidaho.edu/UID:CP71103388850001451,"John F. Kennedy (John Fitzgerald), 1917-1963. Gale L Mix. Telegram, 1963",MG,MG 5545,5545,,,,
https://search.lib.uidaho.edu/UID:CP71100847840001451,"University of Idaho. Ross Alm. Radio scripts, 1950?",MG,MG 5546,5546,,,,
https://search.lib.uidaho.edu/UID:CP71100849250001451,"Alden Wilfred Klotz papers, 1963-1992",MG,MG 5547,5547,,,,
https://search.lib.uidaho.edu/UID:CP71179282180001451,"John Markham Papers, 1970",MG,MG 5548,5548,,,,
https://search.lib.uidaho.edu/UID:CP71179283110001451,"Washington Water Power Company. M. C Osborn; Lewis A Lewis. Lessons, 1916",MG,MG 5549,5549,,,,
https://search.lib.uidaho.edu/UID:CP71100823210001451,"J. J. Beeson and Virgil  Raymond Drexel Kirkham (correspondents). Letter, September 30, 1930",MG,MG 5550,5550,,,,
https://search.lib.uidaho.edu/UID:CP71100823150001451,"University of Idaho. School of Mines. Itinerary, 1925",MG,MG 5551,5551,,,,
https://search.lib.uidaho.edu/UID:CP71100811160001451,"Jeanne Carolyn Walker Anderegg Papers, ca. 1980",MG,MG 5552,5552,,,,
https://search.lib.uidaho.edu/UID:CP71100827810001451,"William J. Grigsby. Lending, borrowing, and women's social organizations in rural Mali, ca. 1990",MG,MG 5553,5553,,,,
https://search.lib.uidaho.edu/UID:CP71100825870001451,"Eldon Donald Schock Papers, 1925-1930",MG,MG 5554,5554,,,,
https://search.lib.uidaho.edu/UID:CP71152985540001451,"Frank O. Brocke. Personal reminiscence, 196-",MG,MG 5555,5555,,,,
https://search.lib.uidaho.edu/UID:CP71106245820001451,"Albert Justin Ohlson Papers, 1975-1983",MG,MG 5556,5556,,,,
https://search.lib.uidaho.edu/UID:CP71152983810001451,"Marcella E. Hawley. Letter, December 8, 1978",MG,MG 5557,5557,,,,
https://search.lib.uidaho.edu/UID:CP71106247670001451,"Business and Professional Women's Club (Wallace, Idaho) Katherine Agarla Eichwald. Treasurer's book, 1956-1983",MG,MG 5558,5558,,,,
https://search.lib.uidaho.edu/UID:CP71106214660001451,"Mrs Gault Papers, 1936-1963",MG,MG 5559,5559,,,,
https://search.lib.uidaho.edu/UID:CP71149091130001451,"W. C. Handy (William Christopher). Letter, July 31, 1957",MG,MG 5560,5560,,,,
https://search.lib.uidaho.edu/UID:CP71208006740001451,"Donald E. Payne. Class book, 1923-1924",MG,MG 5561,5561,,,,
https://search.lib.uidaho.edu/UID:CP71173932550001451,"Clifton E. Anderson. Idaho partnership : the university and the agricultural industry, 1993",MG,MG 5562,5562,,,,
https://search.lib.uidaho.edu/UID:CP71177397270001451,"George Lukens Bloomsburg; Thomas Rex Walenta Papers, 1967-1993",MG,MG 5563,5563,,,,
https://search.lib.uidaho.edu/UID:CP71165635890001451,"Williams and Associates. Basalt Waste Isolation Program (Wash.); Rockwell Hanford Operations.; U.S. Nuclear Regulatory Commission. Division of Waste Management. Statistical evaluation of additional hydrochemical data from the Saddle Mountains, Wanapum and Grande Ronde basalts, Basalt Waste Isolation Project, Hanford site, 1985",MG,MG 5564,5564,,,,
https://search.lib.uidaho.edu/UID:CP71165622040001451,"Laurence Charles Binford. Western water law as it relates to fish and wildlife resources, ca. 1959",MG,MG 5565,5565,,,,
https://search.lib.uidaho.edu/UID:CP71165636810001451,"Edward George Iddings. A progress report on water retention abilities of barley in relation to winter hardiness, 1956",MG,MG 5566,5566,,,,
https://search.lib.uidaho.edu/UID:CP71165637700001451,"Colonel George Wright. Biography, [19--?]",MG,MG 5567,5567,,,,
https://search.lib.uidaho.edu/UID:CP71103911950001451," Wray Wolcott Featherstone. Geophysical prospecting, 1934",MG,MG 5568,5568,,,,
https://search.lib.uidaho.edu/UID:CP71152986670001451,"Rita Reusch. Legal research manual : a research guide to the University of Idaho Law Library, 1974",MG,MG 5569,5569,,,,
https://search.lib.uidaho.edu/UID:CP71103348280001451,"Amphictyon Society of the University of Idaho records, 1892-1898",MG,MG 5570,5570,,,,
https://search.lib.uidaho.edu/UID:CP71103344360001451,"Idaho State Editorial Association. Henry C Dworshak (Henry Clarence). Papers, 1924-1956",MG,MG 5571,5571,,,,
https://search.lib.uidaho.edu/UID:CP71106244680001451,"Wayne D. Hudson. A proposal for an Appaloosa horse program, 1975",MG,MG 5572,5572,,,,
https://search.lib.uidaho.edu/UID:CP71113885900001451,"Austin B. Clayton. Quechua language glossaries, ca. 1940",MG,MG 5573,5573,,,,
https://search.lib.uidaho.edu/UID:CP71177371430001451,"United States. Bureau of Land Management. Boise District Office. [Lakes and reservoirs in the Boise District], 1981",MG,MG 5574,5574,,,,
https://search.lib.uidaho.edu/UID:CP71163987600001451,"Fred J. Foster. A discussion of certain phases of the Indian fishery of the Columbia River, 1945",MG,MG 5575,5575,,,,
https://search.lib.uidaho.edu/UID:CP71180148860001451,"L.A. Turley papers, 1949",MG,MG 5576,5576,,,,
https://search.lib.uidaho.edu/UID:CP71207925920001451,"Peter Paul Drus. Letter to Harold Cornelison, Moscow, Idaho, December 10, 1946",MG,MG 5577,5577,,,,
https://search.lib.uidaho.edu/UID:CP7194436230001451,"Albert Weidel Buch Kjosness. Letter, Silverton, Colorado, to the University of Idaho Alumni Association, January 2, 1966",MG,MG 5578,5578,,,,
https://search.lib.uidaho.edu/UID:CP71180130720001451,"Laurence J. Corbett. Correspondence, 1949-1950",MG,MG 5579,5579,,,,
https://search.lib.uidaho.edu/UID:CP71121661080001451,"Mary Stamper. Student papers, 1969",MG,MG 5580,5580,,,,
https://search.lib.uidaho.edu/UID:CP71141918610001451,"R. Wright. Wildlife research and management in the national parks (draft), May 1990 (published 1992)",MG,MG 5581,5581,,,,
https://search.lib.uidaho.edu/UID:CP71148750710001451,"George Clay Williams. The Latah County Defense Council, 1917-1918, 1987",MG,MG 5582,5582,,,,
https://search.lib.uidaho.edu/UID:CP71163990250001451,"Randall C. White. Idaho's far northern urban mining frontier : the Coeur d'Alene Mining District, 1889-1893, 1987",MG,MG 5583,5583,,,,
https://search.lib.uidaho.edu/UID:CP71163984400001451,"Herman W. Ronnenberg. Disciples of Gambrinus : the lives of the brewery owners and workers of the Gem State, 1987",MG,MG 5584,5584,,,,
https://search.lib.uidaho.edu/UID:CP7194467550001451,"Lyle Longhurst. The saga of the Gilmore & Pittsburgh Railway Co., 1987",MG,MG 5585,5585,,,,
https://search.lib.uidaho.edu/UID:CP71180144580001451,"Susan Ann Kopczynski Priscilla Wegars. Watson's store and the Nez Perce, 1987",MG,MG 5586,5586,,,,
https://search.lib.uidaho.edu/UID:CP71164004890001451,"Mike Carlson. Jack O'Connor and the grand slam : outdoor journalism and its effect on the pursuit of American game animals, 1987",MG,MG 5587,5587,,,,
https://search.lib.uidaho.edu/UID:CP71164019700001451,"Charles E. Simpson. Plateau, basin, and plains trade task groups, with notes on Snake trade in the Northern Great Basin culture area, 1987",MG,MG 5588,5588,,,,
https://search.lib.uidaho.edu/UID:CP7194447650001451,"Sharon C. Maughan. Ariel of the Rockies : measurement of status of Native American women, 1900-1950, 1987",MG,MG 5589,5589,,,,
https://search.lib.uidaho.edu/UID:CP71166139390001451,"Sally Greene. Lewiston State Normal School : a case study of American teacher training institutions, 1987",MG,MG 5590,5590,,,,
https://search.lib.uidaho.edu/UID:CP7194456330001451,"Penelope Reedy. Letter, July 28, 1993, to Paul [Lindholt]",MG,MG 5591,5591,,,,
https://search.lib.uidaho.edu/UID:CP71142967770001451,"Mary Moore Allen. Origin of names of Army and Air Corps posts, camps and stations in World War II in Idaho",MG,MG 5592,5592,,,,
https://search.lib.uidaho.edu/UID:CP7194434630001451,"Kootenai School District, high school options, 19--?",MG,MG 5593,5593,,,,
https://search.lib.uidaho.edu/UID:CP7194437070001451,"Robert L. Palmer Idaho Heart Association for Undergraduate Research. The effects of salt ions on the turtle heart as compared to the mammalian heart, 1959",MG,MG 5594,5594,,,,
https://search.lib.uidaho.edu/UID:CP71208082490001451,Donna Bray Wayne Steven Thompson; Lee Woods. Administration and supervision / 195-?,MG,MG 5595,5595,,,,
https://search.lib.uidaho.edu/UID:CP71124861400001451,"Columbia River Fisheries Development Program (U.S.). Fall chinook salmon hatchery contribution study. Report number 1, Data pertaining to sampling, marking, hatchery life of 1961 brood fish and mark returns in 1963.",MG,MG 5596,5596,,,,
https://search.lib.uidaho.edu/UID:CP71124861580001451,"Nancy Marie Warren. Movements, reproduction, and food habits of great blue herons in central Idaho, 1976",MG,MG 5597,5597,,,,
https://search.lib.uidaho.edu/UID:CP71161070550001451,"Betty Weisenburger. Procedures for developing the outdoor recreation environmental quality alternative plan, Middle and Lower Snake River basins--Idaho",MG,MG 5598,5598,,,,
https://search.lib.uidaho.edu/UID:CP71146965230001451,"Norman W. Brown. Outfitting and guiding : an economic solution for Idaho's national forests, [198-]",MG,MG 5599,5599,,,,
https://search.lib.uidaho.edu/UID:CP71111198690001451,United States. Forest Service. Pacific Northwest Region. Rust red stringy rot. 1983?,MG,MG 5600,5600,,,,
https://search.lib.uidaho.edu/UID:CP71139865690001451,"Albert A. Monnet. Letters received, 1987-1993",MG,MG 5601,5601,,,,
https://search.lib.uidaho.edu/UID:CP71166155480001451,"Hal Douglas Carr. The fur trade in the Oregon country : organization and employment, 1986",MG,MG 5602,5602,,,,
https://search.lib.uidaho.edu/UID:CP71166155780001451,"Paulette Foss George. Burckhardt's progress : an alnalysis of the nature of history in The civilization of the Renaissance in Italy, 1986",MG,MG 5603,5603,,,,
https://search.lib.uidaho.edu/UID:CP9953703201851,"Vincent John Hendrix. The Indian hunter and animals, [1986]",MG,MG 5604,5604,,,,
https://search.lib.uidaho.edu/UID:CP71166135790001451,"Meg C. Keenan. Of the early sagebrush pioneers in Idaho's Snake River Valley, 1986",MG,MG 5605,5605,,,,
https://search.lib.uidaho.edu/UID:CP71166121920001451,"Lyle Longhurst. The other Kit Carson, 1986",MG,MG 5606,5606,,,,
https://search.lib.uidaho.edu/UID:CP71166120070001451,"Randall C. White. Personal glimpses : the Colorado rush of 1859-60, 1986",MG,MG 5607,5607,,,,
https://search.lib.uidaho.edu/UID:CP71116442680001451,"George Clay Williams. Latah County and the Wobblies at the time of World War I, 1986",MG,MG 5608,5608,,,,
https://search.lib.uidaho.edu/UID:CP71116443680001451,"George Clay Williams. The Latah County Protective Association, 1986",MG,MG 5609,5609,,,,
https://search.lib.uidaho.edu/UID:CP71139847240001451,"William Charles McGowan Papers, 1938-1992",MG,MG 5610,5610,,,,
https://search.lib.uidaho.edu/UID:CP71101975060001451,"Helen Johnston Barber papers, 1920-1922",MG,MG 5611,5611,,,,
https://search.lib.uidaho.edu/UID:CP71150685520001451,"Priscilla Wegars. Chinese at the confluence : Lewiston's other pioneers, 1993",MG,MG 5612,5612,,,,
