accession_number,title,extent,description,date
IJC MA 2019-47,Madeleine Crouch collection,1.00 Cubic feet,"Lionel Hampton ""Mostly Blues"" CD, ""The Big Bands: Count Basie, Lionel Hampton, Duke Ellington"" VHS, ""Gene Norman presents Just Jazz: Lionel Hampton All Stars"" 45 RPM record album",1951-1989
IJC MA 2020-18,Dan Baker photograph,,JPEG file of photograph of Ray Brown and Irwin Baker playing in a highschool band.,1945
IJC MA 2020-23,Jazz Festival t-shirt,0.50 Cubic feet,"Jazz Festival shirt that says ""Music from around the world, Dream Jazz, Think Jazz, Live Jazz""",2000
IJC MA 2021-15,Ella Fitzgerald photographs,1.00 Cubic feet,"Three photographs of Ella Fitzgerald, also including Nelson Riddle and William Tishman. One is framed individually, the other two are framed together with a plaque reading ""The Entertainment Channel""",1981
MA 1984-14,Bert Russell Papers,0.50 Cubic feet,Cassettes containing oral history interviews.,undated
MA 1984-26,Wallace Photographs,0.50 Cubic feet,"Wallace, ID area miscellaneous photographs and glass negatives",undated
MA 1984-32A,Unidentified Tapes,2.00 Cubic feet,"Oral histories on open reel audio tapes. One VHS. Contains a variety of recordings, includes university speeches and dedications, interviews with Mary Borah, interviews regarding the various industries of Idaho, and more.",1957-1984
MA 1984-32B,Idaho Reminiscences Recordings,2.00 Cubic feet,Audio and video recordings.,1957-1984
MA 1984-35,University Photographs,5.00 Cubic feet,"Prints, slides, and negatives. Includes protest images of downtown Main Street Moscow in the 1960s and 1970s on Vietnam War",undated
MA 1984-39,Claude Simpson Papers,2.00 Cubic feet,Research material,1983-1984
MA 1985-01,Gritman Hospital Records,0.50 Cubic feet,,1984-1985
MA 1985-12,R. C. Dobson Papers,0.50 Cubic feet,,1945-1950
MA 1985-24,Tom Court Felton Reform Records,0.50 Cubic feet,,1969-1970
MA 1985-39,Latah County Historical Society Oral History transcripts,6.00 Cubic feet,These records are (draft) duplicates of bound oral histories,1970-
MA 1985-44,Claude Simpson Papers,0.50 Cubic feet,Research materials,undated
MA 1986-12,Claude Simpson Papers,0.50 Cubic feet,,1980
MA 1986-17,Ralph W. Dawson Photographs,2.50 Linear feet,,1914-1950
MA 1986-19,Cecil W. Hathaway Papers,4.00 Cubic feet,"Spokane County state highway maitenance reports and other reports; binders with materials relating to conferences on urban planning; and, some notes and correspondence.",1950-1979
MA 1986-23,Omer H. Brodie Engineering Drawings,3.00 Cubic feet,,1976-1984
MA 1986-25,Cecil W. Hathaway Papers,4.00 Cubic feet,"Reports, materials relating to the National Highway Institute, correspondence, and loose papers.",1966-1980
MA 1986-26,Calvin C. Warnick Papers,1.00 Cubic feet,"Engineering Experiment Station report, periodicals, and some materials regarding hydraulic turbines",1942-1978
MA 1986-31,Calvin C. Warnick Papers,3.00 Cubic feet,"Reports, materials regarding the Engineering Experiment Station at UI, materials regarding the Hells Canyon Work Assignment and the senate hearings pertaining to the Hells Canyon National Park status.",1936-1975
MA 1987-10,R. J. Beck Papers,1.00 Cubic feet,"Correspondence, meeting minutes, annual reports and audits, and materials relating to the Pacific Northwest Bibliographic Center (PNBC).",1965-1976
MA 1987-15,Sigma Xi Records,1.00 Cubic feet,"National publications, and Idaho chapter ledgers.",1915-1986
MA 1987-22,Calvin C. Warnick Papers,1.00 Cubic feet,Materials relating to the Salt Lake Pipeline and Boise groundwater pollution.,1942-1978
MA 1987-25,Donald R. Scott Papers,0.50 Cubic feet,Correspondence and memorandums from the University,1952-1986
MA 1987-28,Hazel Peterson Papers,0.50 Cubic feet,Materials pertaining to women's athletics,1970-1979
MA 1987-36,Keith Petersen Manuscript,1.00 Cubic feet,"Manuscript and galley's for ""This Crested Hill""",1986-1987
MA 1987-37,Branyan Correspondence,0.50 Cubic feet,Correspondence between Branyan and Simpson.,1985-1987
MA 1987-38,Miscellaneous Education Reports,0.50 Cubic feet,,1969-1972
MA 1988-04,Calvin C. Warnick Papers,0.50 Cubic feet,Water level measurement papers,1977
MA 1988-09,Shirley Strom Correspondence,0.50 Cubic feet,Political papers and correspondence,1981
MA 1988-10,Idaho Public Employee Association Records,1.00 Cubic feet,"Correspondence, memos, notices and financial materials.",1970-1983
MA 1988-26,Leonard Halland Interview,0.50 Cubic feet,Oral history of a former faculty member of the university.,1988
MA 1989-07,University of Idaho Retirees Association Records,1.00 Cubic feet,"Annual reports for 1979 and 1980. Other materials include a tally and analysis of responses to questionnaires, volunteer services information, project information, questionnaire materials, membership rosters, bylaws and articles of incorporation, committee meeting materials, correspondence, and ad hoc committee materials",1978-1980
MA 1989-17,Utah Power and Light Photographs,0.50 Cubic feet,A photo album,1915-1916
MA 1989-29,Herman Welker Scrapbooks,2.50 Cubic feet,,1950-1956
MA 1989-30,Idaho Library Association Records,0.50 Cubic feet,"President's records, includes reports and other general records.",1987-1989
MA 1989-34,Idaho Library Association ALA Councilor Records,0.50 Cubic feet,Materials relating to the Hansen Award.,1987
MA 1989-35,Parking Committee Records,0.50 Cubic feet,,1988-1989
MA 1989-36,Elizabeth Steinhagen Committee Reocrds,0.50 Cubic feet,"Materials relating to the Officer Education Committee, International Student Affairs, Affirmative Action, Faculty-at-Large, and staff development.",1982-1989
MA 1989-37,Malcolm M. Renfrew Papers,4.50 Cubic feet,"Correspondence, financial materials, research materials, and various other papers.",1948-1969
MA 1989-56,Idahonian Photographs,1.50 Cubic feet,,1970-1979
MA 1990-07,Idaho Library Association Records,0.50 Cubic feet,,
MA 1990-11,George Woodbury Scrapbook,1.00 Cubic feet,Scrapbook was kept by Kathryn Woodbury during their stay in Ecuador as part of a UI-Ecuador exchange program.,1954-1956
MA 1990-12,Marian S. Sweeney Papers,2.00 Cubic feet,"Research notes, newspaper clippings, and correspondence relating to her book Gold at Dixie Gulch.",1982
MA 1990-20,American Society of Agricutlural Engineering Pacific Northwest Section Records,6.00 Cubic feet,"Correspondence, programs of annual meetings, and financial records from.",1946-1987
MA 1990-21,Martin Mickey Photographs,6.00 Cubic feet,"63 boxes of slides showing his travels around the world, including documenting the building of Good Samaritin Village in Moscow (boxes 62 and 63). Slides are 2 3/4"" by 2 3/4"" color slides mounted between glass.",1954-1976
MA 1990-26,John E. Dixon Papers,4.00 Cubic feet,"Correspondence, photographs, classroom exams and handouts, annual reports, and talks and articles from a retired professor of the Department of Agricultural Engineering.",1955-1988
MA 1990-29,John E. Dixon Papers,0.50 Cubic feet,Notebooks containing class notes and exams from the College of Agricultural Engineering.,1963-1968
MA 1990-32,Gritman Memorial Hospital Records,0.50 Cubic feet,Minutes and other board mailings.,1986-1989
MA 1990-36,Richard J. Beck Papers,0.50 Cubic feet,Transcript for the book Famous Idahoans,1989
MA 1991-14,Idaho Library Association Records,0.50 Cubic feet,"Conference material, constitution, by-laws",1985-2005
MA 1991-16,Maurice Johnson Papers,0.50 Cubic feet,"Correspondence, photographs, and newspaper clippings on the alumni of the College of Agriculture",1987-1990
MA 1991-34A,Idaho Library Association Papers,0.50 Cubic feet,Committee correspondence,1982-1991
MA 1991-47,Paul Conditt Papers,0.50 Cubic feet,"American Association of University Professor (AAUP) minutes, memos, etc. collected by Unversity of Idaho Library employee Paul Conditt.",1986-1990
MA 1991-48,Kenneth Dick Papers,2.50 Cubic feet,"Pages from a scrapbook, slides and photographs, correspondence including letters received upon his retirement from U of I in 1967, National Association of College and University Business Officers (NACUBO) correspondence, Regents agendas and other university related material. Kenneth Dick retired as Financial Vice President at the Unversity of Idaho and passed away September 21, 1993. Related materials can be found in MG 213.",1951-1975
MA 1991-50,George Woodbury Photographs,2.50 Linear feet,"Photographs of the Palouse area, Nez Perce people, and South America and a scrapbook of his year spent in Bogota, Columbia (1961-1962).",1950-1975
MA 1991-54,Idaho Library Association Records,1.00 Cubic feet,,1986-1991
MA 1991-55,George Woodbury Photographs,7.00 Linear feet,"7 storage boxes of slides, 38 mounted prints, and an autobiography. Includes slides of Ecuador.",1974
MA 1991-57,Duane LeTourneau Papers,0.50 Cubic feet,"Gritman Medical Center ""The Center"" employee newsletters, agendas for board meetings",1991
MA 1991-58,Boyd Martin Papers,9.00 Cubic feet,"Newspaper clippings and office files as professor of Political Science and as Dean of Letters and Sciences, including outlines and correspondence.","1940-1950, 1958-1982"
MA 1991-59,Gritman Medical Center Records,1.00 Cubic feet,"Bylaws of the medical staff, bylaws and minutes of the Moscow Hospital Association. See also MG 99 https://archiveswest.orbiscascade.org/ark:/80444/xv31127",1945-1982
MA 1991-62,H. Walter Steffens Papers,1.00 Cubic feet,Diaries of travels and an autobiography,1939-1973
MA 1991-63,William B. Hall Papers,0.50 Cubic feet,"Papers relating to remote sensing, from the Idaho Bureau of Mines",1972-1984
MA 1992-02,Duane LeTourneau Papers,0.50 Cubic feet,Professor in the Department of Agricultural Chemistry. Materials on school visitations and Idaho Academy of Science. Also includes faculty secretary material and Biochemistry faculty meetings minutes.,"1975-1978, 1989-1991"
MA 1992-04,"American Society of Agricultureal Engineering, Pacific Norwest Section Records",0.50 Cubic feet,"Annual reports and correspondence from John Dixon, professor of the Department of Agricultural Engineering",1973-1975
MA 1992-06,Idaho Academy of Science Visiting Science Records,3.00 Cubic feet,"National Science Foundation grant materials, planning committee materials, correspondence, budget materials, reports, brochure materials, and materials relating to Dr. Cone, the chemistry department and the Visiting Scientists Program",1962-1967
MA 1992-09,"Kellogg, Idaho Junior Chamber of Commerce Scrapbook",0.50 Cubic feet,Includes newspaper clippings and photographs. In poor condition,1954
MA 1992-10,Roy Williams Papers,0.50 Cubic feet,"Reports for the Ethyl Corporation for the Wood Rat Mountain Project, two bound volumes.",1974-1975
MA 1992-14,Karen Davis Papers,0.50 Cubic feet,"Materials relating to the Campus Advisory Planning Committee, inlcuding minutes and memos.",1990-1992
MA 1992-16,Eleanor K. Heningham Papers,2.50 Cubic feet,"Professor of English. Maps, religious materials, and other materials including papers, articles and other publications, and research notes.",1931-1983
MA 1992-17,Fred Weber Papers,1.00 Cubic feet,"Materials relating to Kenya and Somolia, handwritten materials, and materials relating to natural resources, forests, and the Peace Corps.",1974-1990
MA 1992-19,Idaho Library Association Records,0.50 Cubic feet,"Photographs of the annual meeting, 1992, in Nampa, Idaho",1992
MA 1992-21,Francis (Frank) Seaman Papers,13.50 Cubic feet,"He was a member of the Moscow School District Board. Materials relating to the Moscow School District board (minutes, financial reports, campaigns, and elections).",1974-1990
MA 1992-22,Bill London Publications,1.50 Cubic feet,Newspaper and magazines articles about Idaho and the university.,1977-1990
MA 1992-23,Consortium for Internation Development Papers,1.00 Cubic feet,"Reports, brochures, and fax forms",1982-1988
MA 1992-25,Tau Kappa Epsilon Records,1.00 Cubic feet,"Brochures, membership photographs, newspaper articles.",1980-1992
MA 1992-26,Idaho Memorial Association Shoshone Papers,0.50 Cubic feet,"Records from Success Mining Company, includes correspondence and newspapers.",1924
MA 1992-28,Robert Bruce Linderman Papers,6.00 Cubic feet,"Moscow resident who was a engineering specialist in seismic design. Materials relating to Bechtal Power Corporation, materials relating to nuclear weapons and power, maps and charts, project binders, financial materials, and a film reel.",1959-1988
MA 1992-29,Bill London Papers,2.00 Cubic feet,Local journalist and writer. Draft articles and writing research.,1980-1990
MA 1992-31,Calvin Warnick Papers,2.00 Cubic feet,"Prints, slides, negatives, and lantern slides of canal seepage and other civil engineering class projects. Some items in poor condition.",1951-1966
MA 1992-32,Seventh-day Adventist Church Records,0.50 Cubic feet,"Three bound volumes with quarterly reports, handwritten entries, meeting minutes, and membership lists. Two volumes are for the Moscow church, the third is for the Seventh Day Adventist Church in Pullman, Washington.",1887-1958
MA 1992-34,Idaho Library Association Records,1.00 Cubic feet,Book awards binders,1982-1991
MA 1992-36,Omer Brodie Papers,4.00 Cubic feet,Engineer with Omer Brodie and Associates. Materials include a bridge analysies for Shoshone County and Boundary County and some materials relating to the Idaho State Department of Transportation.,1971-1984
MA 1992-37,Cecil Hathaway Papers,1.00 Cubic feet,"Professor Emeritus in Civil and Environmental Engineering. Materials relating to airports, the National Science Foundation, the PhD program, dissertation.",1966-1975
MA 1992-38,Idaho Library Association Records,1.00 Cubic feet,,1990-1992
MA 1992-39,Maynard A. Fosberg Papers,6.00 Cubic feet,"Transparencies, conservation data, water data, draft report for Payette National Forest, resource management papers, soil studies, temperature data sheets, and a ledger.",1943-1980
MA 1992-40,Idaho Library Association Papers,1.00 Cubic feet,"Pamphlets, memorabilia, and press files. Material dealing with 1% initiative.",1992
MA 1992-43,Idaho Library Association Records,2.00 Cubic feet,"Idaho Librarian Records. Photographs, contact sheets and negatives, correspondence, and various floppy disks.",1986-1992
MA 1992-44,Idaho Library Association Records,1.00 Cubic feet,Various organizational records,1976-1988
MA 1992-46,Francis Seaman Papers,28.00 Cubic feet,"Department of Philosophy class lecture notes, handouts, Moscow School Board materials, funerals preached as a lay preacher of the Unitarian Church, miscellaneous clippings",1949-1990
MA 1993-03,"Northwest District American Alliance for Health, Physical Education, Recreation and Dance Records",2.00 Cubic feet,"American Alliance for Health, Physical Education, Recreation, and Dance. Convention proceedings, transcripts, correspondence, board members reports, executive meetings, progress reports, financial reports, and committee materials",1960-1986
MA 1993-12,Calvin Warnick Papers,0.50 Cubic feet,"Water Resources planning, lecture notes, and class notes for CE524",1958-1977
MA 1993-17,Calvin Warnick Papers,0.50 Cubic feet,"Professor of Civil Engineering and Director of Idaho Water Resources Research Institute. Publications by Warnick, USFS correspondence; Department of Army Corps of Engineers correspondence; materials from the Idaho Water Resources Research Institute; and materials related to flooding, channels, and bridges.",1972-1973
MA 1993-18,Maurice and Bonnie Johnson Papers,1.00 Cubic feet,"Printed material, newspaper clippings, photographs, correspondence, reports, a history of the College of Agriculture, notes on alumni, materials relating to home-economics program and extension work, and a notebook on Coeur d'Alene indigenous dress compiled by Bonnie McKay Johnson",1902-1992
MA 1993-19,Frederick J. Watts Papers,2.00 Cubic feet,"Professor of Civil Engineering. Correspondence, engineering science notebook; notes; slides from a trip; materials relating to fish and waterways in Idaho",1964-1991
MA 1993-20,Earl E. Gray Papers,1.00 Cubic feet,Professor. Earl's 203 lab manual; materials related to electrical engineering; operational manual for the duel channel stream monitor; theses; and papers presented at regional conference in Spokane,1960-1982
MA 1993-21,Fred H. Winkler Papers,2.00 Cubic feet,The Fred H. Winkler Trust with Idaho First National Bank; photographs; diploma; a merit citation for Student Union Board UI; outstanding faculty award; service citation; a history of the league of nations and disarmament; a manuscript draft; estate papers of Loretta B. Winkler; newspaper clippings; sheet music; term papers; poetry books; and a photo album,1941-1983
MA 1993-25,American Society of Agricultural Engineers Pacific Northwest Section Records,0.50 Cubic feet,Correspondence; official invitation to the dedication as a historic engineering landmark ; dedication program; and materials relating to the awards and recognition banquet,1993
MA 1993-29,Idaho Library Association Records,1.00 Cubic feet,Material regarding the 1993 conference,1990-1993
MA 1993-30,Gritman Medical Center Records,1.00 Cubic feet,Meeting minutes,1982-1987
MA 1993-36,Maynard Fosberg Papers,0.50 Cubic feet,"Possibly a professor at University of Idaho. Materials include periodicals pertaining to agriculture, particularly plants and soils, a map of evapotransportation of the western United States, notes, and correspondence.",1950-1975
MA 1993-37,Bill London Papers,1.00 Cubic feet,"Materials contain some of London's writings, mail, as well as materials regarding the Moscow Vision 2020 project, the Palmer Mayoral campaign, and books.",1985-1993
MA 1994-01,Idaho Library Association Records,0.50 Cubic feet,"Membership committee records. Materials include an ILA handbook from 1985, a binder from the PNLA representative, 1993 spring conference materials, and other administrative records.",1991-1992
MA 1994-05,Idaho Geological Survey Records,1.00 Cubic feet,Assay and analytical lab books.,1906-1973
MA 1994-07,Sydney Duncombe Papers,1.00 Cubic feet,"A professor of political sciences at the University of Idaho. Materials include student papers, a thesis, and research relating to a police stufy.",1948-1974
MA 1994-15,Clifford Ott Photographs,1.00 Cubic feet,"Materials include a photograph of the Genesee/Moscow Farmers Union, newspaper clippings, oversized photographs of Moscow.",1907-1979
MA 1994-16,Gary L. Bennett Papers,1.00 Cubic feet,"A scientist and engineer who worked for NASA and the US Department of Energy. Materials contain VHS tapes regarding the Ulysses and Galileo space missions, astronomy periodicals, and copies of papers he authored/co-authored. Also included is a copy of his science fiction novel ""The Star Sailors.""

For more information on Bennett, here is a link to his wikipedia page: https://en.wikipedia.org/wiki/Gary_L._Bennett",1963-1998
MA 1994-21,Albert R. Menard Papers,17.00 Cubic feet,"Materials include newspapers, correspondence, building plans, cassette tapes, open reel audio tapes, and materials relating to law school.",1964-1987
MA 1994-22,US Geological Survey Topographic Maps,1.00 Linear feet,,1924-1965
MA 1994-25,Weldon Schimke Papers,0.50 Cubic feet,"University of Idaho report cards, financial materials, law flashcards, a land title, photographs, law documents and correspondence",1939-1970
MA 1994-27,Bill London Papers,1.00 Cubic feet,Local writer. Materials relating to local government and politics.,1992-1994
MA 1994-28,Weldon Schimke Papers,124.00 Cubic feet,"Prosecuting attorney for Latah County. Appointment books, WWP family gazette, war letters, student records, correspondence, diaries, case files, and more.",1927-1984
MA 1994-29,Idaho Partners of America Records,2.00 Cubic feet,"Financial materials, grant letters, sub-committee records, project proposals, and presentation materials",1988-1994
MA 1994-30,Paul C. Conditt Papers,0.50 Cubic feet,Poems written by George Kellogg and Kellogg's obituary,1960-1969
MA 1994-31,Rob McIntyre Papers,1.00 Cubic feet,Photocopies and copy negatives relating to Idaho city,1994
MA 1994-33,PNLA Bibliography Committee Correspondence,0.50 Cubic feet,Correspondence of the Pacific Northwest Library Association's Bibliography Committee,1959-1962
MA 1995-03,Roy Williams Papers,5.00 Cubic feet,"Materials pertaining to geology, geo-engineering, hydrogeology, and geo-chemistry. Includes, materials on Yucca Mountain Project.",1989-1991
MA 1995-06,Maurice Johnson Papers,1.00 Cubic feet,Papers regarding Farm House fraternity.,1988-1992
MA 1995-08,Paul C. Conditt Papers,0.50 Cubic feet,"Materials related to non-degree programs, the Moscow Rotary, and groundwater modeling",1986-1995
MA 1995-09,Al Day Papers,2.00 Cubic feet,Music scores,1870-1922
MA 1995-12,Maurice Johnson Papers,3.00 Cubic feet,"Arts and Antiques magazines, surveys on homemaking, research on clothing and traditional cultural costumes, photographs, slides, research on Native american clothes, beadwork, and traditional tanning processes.",1967-1976
MA 1995-13,Hanford Health Information Network Recordings,0.50 Cubic feet,Audio/Video tapes related to the effects of radiation released from the Hanford Nuclear Plant since 1944.,1994
MA 1995-14,Dwight Hoffman Papers,0.50 Cubic feet,"Newspaper clippings, land assessment maps, financial documents, and correspondence",1918-1932
MA 1995-19,Kathleen Warnick Papers,0.50 Cubic feet,Article reprints related to agriculture and animal husbandry.,1932-1992
MA 1995-22,Idaho Partners of America Records,1.00 Cubic feet,"Rechartering information, small grant materials, and correspondence",1990-1994
MA 1995-23,Arboretum Associates Records,0.50 Cubic feet,Annual meeting notes,1995
MA 1995-24,Idaho Library Association Records,0.50 Cubic feet,"Executive board meeting minutes, includes Handbook draft",1990-1994
MA 1995-25,Weldon Schimke Papers,2.50 Cubic feet,"Materials relating to military service in World War II, letters from time in military, and other personal papers.",1944-1945
MA 1995-27,Dwight Hoffman Papers,4.00 Cubic feet,"Information about a seminar conducted by Lou B. Sterns, Idaho chemical processing plant operations manuals, a tribute to Hank and UI Chem department, newspaper clippings, class and lecture notes, miscellaneous correspondence and general work papers",1930-1993
MA 1995-28,Bill London Papers,1.00 Cubic feet,Local writer. Research and writing files on various subjects.,1986-1993
MA 1995-29,Moscow Renaissance Fair Records,1.00 Cubic feet,,1988-1995
MA 1995-32,Idaho Republican Party Records,2.00 Cubic feet,"Idaho state republcan convention transcripts and proceedings, financial statements, resolutions, telephone surveys  of voters, Idaho republican state assembly materials, and McClure for US Senate Committee July 1983-December 1983",1970-1992
MA 1995-34,Idaho Library Association Records,1.00 Cubic feet,"Primarily materials relating to the 1992 and 1993 conference, as well as the 1995 Joint Conference",1988-1995
MA 1995-40,Idaho Library Assoc. PNLA Representative Records,0.50 Cubic feet,Convention proceedings,1991-1995
MA 1995-43,Malcolm Renfrew Papers,0.50 Cubic feet,Student quizzes and exams,1966
MA 1995-45,Western Cooperation Spray Project Records,1.50 Cubic feet,"Membership list from a disease management conference; correspondence; materials relating pests and disease, materials from a  disease management conference; western cooperative spray project annual meetings; vouchers; and a memorandum of understanding",1926-1975
MA 1995-48,Louise Shadduck Papers,2.50 Cubic feet,Idaho journalist. Includes a letter to Louise; materials pertaining to USA Medical Corps; newspaper clippings; a volunteer handbook; materials relating to WAMI; materials relating to womens auxiliary to the Idaho State Medical Association form,1963-1993
MA 1995-49,U.S. Forest Service Aerial Photographs,0.50 Cubic feet,,1933-1934
MA 1996-01,Harold McIlvaine Papers,0.50 Cubic feet,Four spiral bound notebooks of original typed notes on Plant Anatomy,undated
MA 1996-02,U.S. Forest Service Aerial Photographs,0.50 Cubic feet,Aerial Photographs taken by the 116th photo section of the Washington National Guard,1936
MA 1996-03,Idaho Library Association Records,0.50 Cubic feet,Material concerning the 1992 Annual Conference,1995
MA 1996-04,Gary L. Bennett Papers,0.50 Cubic feet,Articles and papers written by Gary Bennett.,1995
MA 1996-06,Idaho Library Association President's Records,1.00 Cubic feet,"Minutes and correspondence. Simmons records as 1st vice president, 1991-1993 and 2nd vice president, 1991-1992, also included is a video tape of Samantha Wright's interview with Rand Simmons and Adrien Taylor on ICA initiative, and procedure manual.",1991-1994
MA 1996-13,Knights of Columbus Proceedings,1.00 Cubic feet,,
MA 1996-15,Dwight Hoffman Papers,1.00 Cubic feet,"Financial records and correspondence of Jesse Hoffman, 1908-1921. Miscellaneous papers of Dwight Hoffman, 1971-1983",1908-1983
MA 1996-16,John E. Dixon Papers,1.00 Cubic feet,Material relating to the Harvest and Postharvest Technologies for Fresh Fruits and Vegetables conference held in Mexico in Feb. 1995,1993-1995
MA 1996-18,Dorothy S. Hole Papers,1.00 Cubic feet,"Newspaper clippings about the U of I, obituaries, and publications and other materials concerning 4-H",1959-1992
MA 1996-19,Harry Caldwell Photographs,0.50 Cubic feet,"Photographs possibly taken as part of his dissertation research ""Tourism in Idaho""",1950
MA 1996-20,Mildred M. Haberly Papers,1.00 Cubic feet,"Three scrapbooks of newspaper clippings, photographs, correspondence, etc. documenting her career in the Cooperative Extension Program",1941-1973
