accession_number,title,extent,description,date
UA 2000-10,Faculty Appeals Hearing Board Records,0.50 Cubic feet,,1983-1986
UA 2000-11,President's Office Records,17.00 Cubic feet,,1976-1999
UA 2000-12,Athletic Department Collection,31.00 Cubic feet,Football films and videos,1972-1997
UA 2000-13,Idaho Geological Survey Records,7.00 Cubic feet,Newspaper clippings relating to mining activities in Idaho and other papers.,1980-1992
UA 2000-14,Sabbatical Leave Committee Records,0.50 Cubic feet,,1987-1992
UA 2000-15,University Communications Photographs,3.50 Cubic feet,Photographs and slides from the University of Idaho Alumni Association.,1975-1994
UA 2000-16,Agricultural Ethics Collection,1.00 Cubic feet,Videos of classes recorded for Jim Nelson,1992
UA 2001-01,Printing and Design Photographs,2.00 Cubic feet,,1972-1998
UA 2001-02,Library Administration Records,1.00 Cubic feet,"Papers from Associate Dean (Steiger). Correspondence and memos, includes some relating to previous position in Technical Services",1958-1996
UA 2001-03,Mechanical Engineering Photographs,1.00 Cubic feet,,1950-1986
UA 2001-04,Borah Symposium Records,1.00 Cubic feet,"Videos of speakers Fuentes, Fukuyama, Bodley and panel discussion. Also Tapes circa 2002. Also included are some from Martin Institute Symposium",2001-2002
UA 2001-05,President's Office Records,4.00 Cubic feet,"FY2001 files, correspondence, memos, and more",2000-2001
UA 2001-07,President's Office Records,2.00 Cubic feet,,1999-2001
UA 2001-08,Idaho State Climate Laboratory Observation Records,14.00 Cubic feet,Meteorological observations and other records,1978-1992
UA 2001-09,Center for Business Development Data Tapes,1.00 Cubic feet,Moscow Citizens Survey data and Moscow Economic Development data,1989
UA 2001-10,Library Staff Association Scrapbooks,1.00 Cubic feet,Scrapbooks and history compiled by Barbara Johnson,1982-2002
UA 2001-11,Mechanical Engineering Silha Memorabilia,0.50 Cubic feet,"Papers, clippings, pictures, and speeches of Henry Silha, a Mechanical Engineering professor",1940-1999
UA 2001-12,Dean of Students Records,1.00 Cubic feet,Videotapes,1982-1984
UA 2002-01,Student Home Economics Association Records,0.75 Cubic feet,"Correspondence, memos, notes, miscellaneous papers, als included are the records of IHEA and other organizations.",1948-1987
UA 2002-02,Registrar Records,0.50 Cubic feet,"Includes the UI Fact book, memos, publications, and other papers. Records also include material relating to computing.",1972-1986
UA 2002-024,Home Economics Records,0.50 Cubic feet,"Secretarial assignments, Home Managemetn oral histories, and an AHEA Handbook",1988-2000
UA 2002-03,University Research Office Records,2.00 Cubic feet,"Seed grant proposal applications, reports, and more.",1994-1996
UA 2002-04,Sabbatical Leave Evaluation Committee Records,2.00 Cubic feet,Applications and reports.,1996-2002
UA 2002-05,University Research Office Records,2.00 Cubic feet,Office files and correspondence.,1988-1998
UA 2002-06,Library Adminstration Records,4.00 Cubic feet,"Records related to the reference Department McBeth, website ProjectGrant application, project notes, and copies of source material",1997-1999
UA 2002-07,Library Special Collections Records,1.00 Cubic feet,"Photographs, orders, invoices, permissions, and more.",1998-2001
UA 2002-08,Dean of Students Records,0.50 Cubic feet,"Photographs of Greek students, at unidentified funtions.",2000
UA 2002-09,Library Gifts and Exchanges Records,1.00 Cubic feet,"Sales lists, correspondence, and other papers.",1989-2000
UA 2002-10,Agricultural Extension Service Records,0.50 Cubic feet,Miscellaneous correspondence and Operation Hayride and Jefferson County Agent Reports,1935-1982
UA 2002-11,Recreation Management Leisure Experiences Papers,0.50 Cubic feet,Class projects: student interview transcriptions,1975-1978
UA 2002-12,Provost's Office Records,12.00 Cubic feet,Office files,1986-1989
UA 2002-13,President's Office Records,9.00 Cubic feet,Office files,1993-2000
UA 2002-14,University of Idaho Museum Exhibit Records,0.50 Cubic feet,"Documentation such as photographs, captions, research notes",1965-1975
UA 2002-15,College of Natural Resources Records,0.50 Cubic feet,Records from the Dean's Office.,1979-1991
UA 2002-16,College of Graduate Studies Records,1.00 Cubic feet,"Office files. Subjects include WAMI, Graduate Faculty, NDEA Program",1966-1975
UA 2002-17,Richard C. Davis Papers,2.00 Cubic feet,"Manuscript Archives Librarian records, includes correspondence, memos, reports, emails, and other papers",1992-2000
UA 2002-18,Library Public Services Records,1.00 Cubic feet,"Reference Department Bird-Truax Project, includes correspondence, photocopies, and other papers.",1997-2000
UA 2002-19,President's Office Records,9.00 Cubic feet,"Materials relating to athletics, the Board of Regents, and legislatures.",1989-2000
UA 2002-20,Provost's Office Records,10.50 Cubic feet,,1988-1999
UA 2002-21,Richard C. Davis Papers,6.00 Cubic feet,"Manuscript Archives Librarian records, includes correspondence, memos, reports, email, materials relating to ""Mining Project Records,"" and other papers",1988-1991
UA 2002-22,President's Office Records,14.00 Cubic feet,"Correspondence, memos, minutes, and other records.",1989-2002
UA 2002-23,ITS Video Center Records,3.00 Cubic feet,"42 master video tapes of Carlos Schwantes lectures from ""History 423: Idaho and the Pacific Northwest""",undated
UA 2002-25,Development Office Records,5.00 Cubic feet,"Records from the centennial campaign, includes correspondence, memos, donor lists, and more.",1984-1989
UA 2002-26,"University Research Office, Clarkia/Wilderness Research Center Records",1.00 Cubic feet,"Correspondence, memos, proposals and more.",1981-1999
UA 2002-27,Dean of Students Records,2.00 Cubic feet,Correspondence and office files,1974-1997
UA 2003-01,University Research Office Records,3.00 Cubic feet,"Materials relating to aquaculture, IMAP, IWRRI, and other miscellaneous office files.",1987-1999
UA 2003-03,University Research Office Papers,2.00 Cubic feet,"Applications, memos, and reports for seed grants.",1996-2000
UA 2003-04,University Research Office Papers,1.00 Cubic feet,"Reports, memos, and other materials",1991-1999
UA 2003-05,Library Administration Records,0.50 Cubic feet,"Records from the Dean, including memos, correspondence, and reports",1963-1997
UA 2003-06,President's Office Records,8.00 Cubic feet,"Correspondence, memos, and other materials.",1990-2002
UA 2003-07,University Research Office Records,3.00 Cubic feet,"Travel grant applications, reviews, reports,",1994-2000
UA 2003-08,Upham Residence Hall Records,1.00 Cubic feet,"Minutes, correspondence, financial records, clippings, and photos.",1960-1994
UA 2003-09,Library Administration Records,0.50 Cubic feet,"Dean's correspondence, memos, minutes, and other materials.",1968-1995
UA 2003-10,Laboratory of Anthropology Records,3.00 Cubic feet,"Slides, audio tapes, motion pictures, negatives, and other materials.",1920-1993
UA 2003-11,President's Office Records,15.00 Cubic feet,"Memos, minutes, correspondence, and other materials.",1991-2000
UA 2003-13,Dean of Students Records,4.00 Cubic feet,"Files regarding Greek life, including correspondence, memos, photos, scrapbooks, and publications.",1964-2001
UA 2003-14,Mechanical Engineering Records,3.00 Cubic feet,Office files.,1982-1997
UA 2003-15,Printing and Design Services Photographs,1.00 Cubic feet,"Student activities and other photos, mostly unidentified.",1990-1991
UA 2003-17,University of Idaho Media Center Records,7.00 Cubic feet,"UI motion pictures of campus scenes, activities,  including some football and basketball",1932-1979
UA 2003-18,School of Journalism and Mass Media Records,3.00 Cubic feet,"Records on broadcasting including correspondence, applications, licenses, reports, programs, schedules, and specifications. Materials relating to KUID-FM, KUID-TV, and Educational Television.",1951-2003
UA 2004-01,University Communication and Marketing Records,2.00 Cubic feet,"VHS and UCA, audio cassettes, including promotional videos, news broadcasts, centennial commencement, and more.",1987-2002
UA 2004-02,University Research Office Records and Videos,1.00 Cubic feet,,1986-1999
UA 2004-03,Library Special Collections Records,1.00 Cubic feet,Payment records and miscellaneous processing files.,1998-2004
UA 2004-04,Campus Recordings,1.00 Cubic feet,"VHS tapes containing video of the Lionel Hampton Jazz Festival, Campaign for Idaho, Idaho Repertory Theoter, and the Malcolm Renfrew Tribute.",1997-2002
UA 2004-05,President's Office Records,9.00 Cubic feet,"Office files, correspondence, and memos.",1994-2002
UA 2004-06,UI Law Library Records,2.00 Cubic feet,"Manuals, assignments, newsletters, minutes, reports, memos, and policies.",1974-1995
UA 2004-07,ASUI Office Records,6.00 Cubic feet,"Records of Senate meetings, bill books, and agendas.",1980-1999
UA 2004-08,Library Administration Records,1.00 Cubic feet,"Records of gifts and exchanges. Sales, monogram, geology, and special sales lists.",1999-2002
UA 2004-09,Dean of Students Records,1.00 Cubic feet,"Mortar Board Club minutes, handbook, and notes.",1986-1987
UA 2004-10,UI Environmental Science Program Records,1.50 Cubic feet,Lectures on VHS tapes,1997-2001
UA 2004-11,Dean of Library Records,1.00 Cubic feet,Library addition materials,1984-1994
UA 2004-12,Dean of Library Records,2.00 Cubic feet,"Materials relating to faculty award, leadership retreat packets, Foundation Inc. reports, budgets, agendas/minutes, and a library survey",1993-2002
UA 2004-13,University of Idaho Institutional Accreditation Records,12.00 Cubic feet,"Reports, correspondence, and surveys from the 2004 institutional accreditation.",2001-2004
UA 2004-14,College of Education Records,1.00 Cubic feet,Accreditation reports,1982-1993
UA 2005-001,University Communications and Marketing Records,11.00 Cubic feet,"Photographs, slides, negatives, proof sheets, and centennial materials",1970-2000
UA 2005-02,University Research Office Records,2.00 Cubic feet,"Materials relating to SBOE, INRA, Stillinger projects, as well as correspondence",1986-2002
UA 2005-03,Library Administration Records,1.00 Cubic feet,Records from the Dean's office on the CARL automation bid.,1990
UA 2005-04,ITS Video Center Records,0.50 Cubic feet,DVDs of Commencement ceremonies,2004-2005
UA 2005-05,Department of Journalism and Mass Media Records,2.00 Cubic feet,Poster and photographic exhibit materials from Humanities Fellowship Program and UI Research Office.,1998-2003
UA 2005-06,President's Office Records,19.00 Cubic feet,"Materials relating to commencement, honorary degrees, athletics, Foundation, correspondence, conferences, and miscellaneous files",1971-2004
UA 2005-07,Dean of Students Records,1.00 Cubic feet,"Student records, Child Care Task Force, Retention Task Force, annual reports, and Student Affairs strategic plans.",1950-2002
UA 2005-09,Library Special Collections Records,1.00 Cubic feet,,2002
UA 2005-10,Dean of Students records,3.00 Cubic feet,"Greek life records including photograph displays, brochures, pledge lists, CDs, alcohol policies, newsletters, Panhellenic Council information, and conferences.",1988-2004
UA 2006-01,President's Office Records,6.00 Cubic feet,"Faculty Council minutes, departmental reports, correspondence, contracts, and materials relating to the Jazz Festival.",1993-2006
UA 2006-02,Library Administration Records,1.00 Cubic feet,"Gifts and exchanges records such as sales lists, acknowledgements, auction, monographs, and serials lists.",2001-2004
UA 2006-03,Management Information Services Records,12.00 Cubic feet,"Hegis reports, pre-Banner records, surveys, conference literature, and technical records",1975-1990
UA 2006-04,Library Social Committee Records,0.50 Cubic feet,"Minutes, membership lists, activities, and correspondence.",1987-2005
UA 2006-06,College of Natural Resources Dean's Records,1.00 Cubic feet,"Class reunions, field trips, commencement, lectures, receptions, UI family weekends, and dean's search.",1990-1996
UA 2007-01,President's Office Records,1.00 Cubic feet,Retiree Insurance Task Force report,2006
UA 2007-02,Vision and Resource Task Force Collection,1.00 Cubic feet,UI marketing material and Pappas report,2004
UA 2007-03,University Research Office Records,3.00 Cubic feet,"Materials relating to Idaho Place, Murdock Charitable, and the sale of UI property. Also included are news releases and conference information.",1985-2005
UA 2007-05,Alumni Association Office Records,3.00 Cubic feet,"Statistics, policies, gifts, events, and correspondence.",1989-2004
UA 2007-06,Library Administration Records,0.50 Cubic feet,"Papers on Government Documents centennial including reports, news clippings, poster, timeline, and centennial talks",2006-2007
UA 2007-07,Arthur R. Gittins Papers,0.50 Cubic feet,Blank exams with accompanying keys,1951-1975
UA 2007-08,ASUI Senate Records,2.00 Cubic feet,Minutes and videotape recordings,1999-2002
UA 2007-10,"Plant, Soil, and Entomological Sciences Records",11.00 Cubic feet,"Photographs, negatives, and reports.",1928-1970
UA 2007-11,U.S. Department of Agriculture Forest Service Aerial Maps,9.00 Cubic feet,Photographs. Aerial maps of counties in Idaho.,1936-1968
UA 2007-13,University of Idaho Architectural and Engineering Services Library Blueprints,5.00 Cubic feet,"Blueprints, artistic sketches, and working copies of remodeling plans",1993-1995
UA 2007-14,Library Administration Records,1.00 Cubic feet,"Correspondence, reports, manuals, notes, publications. Records from the UI Vision and Resources Task Force, NASC Committee, Library furniture budget, ISL Network Advisory Committee, Library and Information Resources for the Northwest, and Ron Force consulting materials.",1985-2004
UA 2007-16,University Residences Records,1.00 Cubic feet,Photographs and printed materials.,1939-2003
UA 2007-17,Chemical Engineering Department Records,7.00 Cubic feet,"Vice-Provost George Simmons files from the Chemical Engineering Department including correspondence, printed materials, teaching schedule, research materials, city files, and other materials",1972-1984
UA 2007-18,Board of Regents of the University of Idaho Records,9.00 Cubic feet,Agendas and minutes,1966-1996
UA 2007-19,University Residences Roger Oettli Files,9.00 Cubic feet,"Correspondence, pinted materials, and photographs. R. Oettli was Director of the University Residences.",1991-1997
UA 2007-20,ASUI Records,1.00 Cubic feet,Audit reports,1951-1969
UA 2007-21,General Faculty Minutes,1.00 Cubic feet,,1968
UA 2007-22,Juntura Committee Minutes,1.00 Cubic feet,,1971-1998
UA 2007-23,Sabbatical Leave Committee Minutes,1.00 Cubic feet,,1972-2002
UA 2007-24,Water Resources Newspaper Clippings,2.00 Cubic feet,Newspaper clippings,1963-1978
UA 2007-25,University of Idaho Press Records,6.00 Cubic feet,Correspondence and printed materials,2001-2003
UA 2007-26,UI Administrative Affairs Records,4.00 Cubic feet,"Budget presentations, FA staff meetings, faculty morale, property values, and wood-fired boiler including correspondence and printed materials.",1992-2000
UA 2008-01,University Residences Records,0.30 Cubic feet,"Includes Sandra J. Stannard's Survey of Student Dwellings Types, UI long range plan (4/16/1984 and 8/22/1984), list of housing units lost since the end of WWII, and UI Housing and Food Service.",1970-1994
UA 2008-02,University Research Office Records,1.00 Cubic feet,"Include UI Research Park, INL Bid Background, Pres. Doc. Research Fellowship, NOI & Full Proposals, Extension/Agricultural Extension Service, Larry Branen, Cda (NICHE) Loc, correspondence, and printed materials.",2000-2005
UA 2008-03,Student Union Contracts and Construction Agreements,1.00 Cubic feet,Correspondence and contracts.,1955-1965
UA 2008-04,College of Agricultural and Life Sciences Records,1.00 Cubic feet,"Memoranda of Understanding/Agreement, correspondence, and typed and printed materials",1914-2002
UA 2008-05,"City of Moscow, Idaho UI Lionel Hampton International Jazz Festival Proclamation",1.00 Folder,"City of Moscow, Idaho UI Lionel Hampton International Jazz Festival Proclamation. One is signed by Nancy Chaney, Mayor of the City of Moscow and the other by C. L. ""Butcher"" Otter, Governor of Idaho. Also a photocopy of a letter from John Conyers, Jr. Member of Congress to the IJF.",2008
UA 2008-06,First Annual Jazz History Conference,1.00 Cubic feet,"Printed materials such as IJF Programs, brochures from the UI, Palouse Mall, North Central Idaho Visitor Guide, Moscow, ID and Pullman, WA Visitor's Guide",2008
UA 2008-08,University of Idaho Library Records,0.30 Cubic feet,"Correspondence, reports, surveys of the Building Planning Committee Idaho Telefax Network (1988-1989), and of other projects. Also included is the basement remodel (1987), Library Building Program (1990), and Library Facility Study (1986).",1986-1990
UA 2008-09,UI Records Center Records,3.00 Cubic feet,Budget books and documents.,1927-1993
UA 2008-10,President's Office Records,0.50 Cubic feet,13 pictures of previous UI Presidents and exemplars of Idaho Press Tribune about 9-11 (v. 22 n. 74).,2001-2008
UA 2008-11,National Medal of Arts to the Lionel Hampton Jazz Festival,1.00 Cubic feet,Medal and certificate awarded to the Lionel Hampton Jazz Festival are on permanent display at the UI President's office,2007
UA 2008-12,President's Office Records,1.00 Folder,DVD of Tim and Karen White Farewell Reception,2008
UA 2008-13,"Walter L. Moden, Jr. Photographs",1.00 Cubic feet,Slides,1958-1984
UA 2008-16,Charles L. Peterson Papers,33.00 Cubic feet,"Charles L. Peterson was a Profesor Emeritus and Interim College of Engineering Dean. Agricultural Engineering slides, photographs, printed materials, research materials, Agricultural Experiment Station annual reports, course work, correspondence, and publications.",1959-2005
UA 2008-17,Library Administration Records,3.00 Cubic feet,Gifts and exchanges records.,2000-2008
UA 2008-18,Registrar's Office Records,2.00 Cubic feet,Faculty teaching loads,1936-1966
UA 2008-19,UI Postage Stamp Perforator,1.00 Folder,"Cummins Perforator Company UI Postage Stamp Perforator. Correspondence, certification of registration, and instructions for cleaning.",1931
UA 2008-20,Management Information Services/Institutional Research office Records,1.00 Cubic feet,Materials relating to the ongoing battle for resources between UI and Boise State University,1975-2000
UA 2009-01,Steven B. Daley-Laursen Speech,1.00 Folder,Commencement Address at the University of Idaho,2007
UA 2009-02,University Communications and Marketing Records,1.00 Cubic feet,Videotapes,undated
UA 2009-03,College of Education Records,0.50 Cubic feet,Faculty meeting minutes,1932-1968
UA 2009-04,Dean of Students Records,2.00 Cubic feet,New student orientation and Greek bidding information,1952-2005
UA 2009-05,Arboretum Associates Records,0.50 Cubic feet,E-mails printout and news clippings,2005-2007
UA 2009-06,Records Center Records,17.00 Cubic feet,"Materials relating to the McConnell Hall Reconstruction, Bursar, Board Minutes, and other materials.",1973-1998
UA 2009-07,UI Graduate Council Photographs,1.00 Folder,,1950-1965
UA 2009-08,College Agriculture and Life Sciences Nez Perce County Extension Office Records,1.50 Cubic feet,"Instructional materials on beef cattle, sheep, horse including slides, published materials, multimidia, cassette tapes, and record. Includes 4-H history.",1971-1984
UA 2009-09,School of Forestry Maps,Oversized,"Original Notes and Surveys - Coeur d'Alene Region, Northern Idaho",1886-1910
UA 2009-10,Budget Office Records,6.00 Cubic feet,,1933-1987
UA 2009-11,Administrative Affairs Records,11.00 Cubic feet,,1999-2004
UA 2009-12,Charles L. Peterson Papers,1.00 Cubic feet,"Agricultural engineering files such as course syllabus, slides, handout materials, and lab reports",1987-2002
UA 2009-13,College of Natural Resources Dean's Office Records,5.00 Cubic feet,"Materials relating to the Budget and Finance, Guidance Council; Idaho Land Exchange Act of 1993; and,  a VHS.",1975-2007
UA 2009-14,College of Natural Resources Dean's Office Records,3.00 Cubic feet,"Materials include the bylaws, information regarding the Wilderness Research Center, Hornocker Wildlife Institute, and other materials.",1990-2003
UA 2009-15,UI Engineering Records,1.00 Cubic feet,"Outreach DVD Course. CS 504-I ST: Intrusion Detection Systems, Professor Deborah Frincke. Set of 14 DVDs.",undated
UA 2009-16,Living/Learning Center Records,1.00 Cubic feet,"An alumni video consisting of two video cassettes. One entitled: ""Some Things Change, Some Things Stay the Same.""",1993-1995
UA 2009-17,College of Education Records,0.50 Cubic feet,"J. Frederick Weltzin Files including articles, news clippings, reports written or compiled by J. Frederick Weltzin.",1944-1963
UA 2009-18,Joseph Thompson Papers,8.00 Cubic feet,Reference Files on Tractors and Agricultural Machines,undated
UA 2009-19,International Jazz Festival Records,4.00 Cubic feet,"Video cassettes, photographs, clippings, and some records regarding the Lionel Hampton Jazz Center",2003-2004
UA 2009-20,Deptartment of Conservervation Social Sciences Records,3.00 Cubic feet,"Includes a department file on Michael Frome, 1984-1988",1973-2009
UA 2010-01,College of Natural Resources Dean's Office Records,1.00 Cubic feet,,
UA 2010-03,Information Technology Services Records,1.00 Cubic feet,Director's files.,1983-2008
UA 2010-04,College of Natural Resources Dean's Office Records,6.00 Cubic feet,Materials relating to MOSS and Experimental Forest and Taylor Wilderness Research Center.,1948-2009
UA 2010-05,College of Natural Resources Dean's Office Records,6.00 Cubic feet,Events and Nursery files,1932-2009
UA 2010-06,Facilities Architectural and Engineering Services Records,,"Photograph negatives and prints, floppy disks, artwork, slides, and blueprints.",1949-2002
UA 2010-07,Institutional Research and Assessment Records,17.00 Cubic feet,"IPEDS records (1995-2003); Planning, Budget, Statistics; Unit Action Plan (1999-2000); EPRs, Prince Report; Research in Higher Education, New Direction for Higher Education, Teaching and Learning Institutional Research; and Publications",1995-2003
UA 2010-08,College of Natural Resources Dean's Office Records,3.00 Cubic feet,,1969-2009
UA 2010-09,College of Natural Resources Dean's Office Records,4.00 Cubic feet,Maps,1916-1981
UA 2010-10,Sheldon A. Vincenti Papers,17.00 Cubic feet,,1973-2000
UA 2010-13,Library Administration Records,1.00 Cubic feet,Historic Air Photo Scanning Project Records,1997-2002
UA 2010-14,John Warren Papers,2.00 Cubic feet,,1978-1988
UA 2011-01,Alumni Relations Retirees Association Records,1.00 Cubic feet,"Meetings agenda, minutes, reports, mailings, and a CD of pictures",1996-2009
UA 2011-03,Gary Williams Papers,3.00 Cubic feet,Sound and visual recordings used in various lower-level humanities courses.,1960-1970
UA 2011-04,Reserve Officers' Training Corps (ROTC) Records,1.00 Folder,"Photographs found in a drawer of Center for Ethics/Naval Science Department. Eight photos of women, by Harsch, in a UI photo album. A family photo by Anton-West Indies. A photo of Neale Stadium.",1915
UA 2011-06,Office of Institutional Research and Assessment Records,0.50 Cubic feet,,1990-2010
UA 2011-07,Facilities Records,1.00 Cubic feet,"Architectural and Engineering Services Assay Lab, Clark-McNary Nursery, Lindley Hall Addition plans and specifications.",1905-1963
UA 2011-08,College of Education Records,5.00 Cubic feet,"Materials relating to Pre-College Trio Programs, as well as photographs, slides, and more.",1970-2009
UA 2011-09,University Communications and Marketing Records,19.00 Cubic feet,Video tapes of University events,1980-2010
UA 2011-11,College of Law Records,0.50 Cubic feet,"History papers including photographs, newsletters, and a scrapbook",1946-1974
UA 2011-12,Records Center Records,20.00 Cubic feet,,1980-1999
UA 2011-13,Florence Schnoke scrapbook,1.00 Cubic feet,"Scrapbook with photographs, newspaper clippings, and other momentos",1926-1927
UA 2011-14,Office of Development Records,0.25 Cubic feet,CD-ROM transcriptions of speeches of Malcolm Renfrew 100th birthday party and building rededication,2010
UA 2011-16,Kendall Johnson Collection,,Rangeland Ecology Maps and aerial photos,1911-1977
UA 2011-17,J. Gary Williams Papers,1.00 Cubic feet,"Correspondence, assessment activities, readings and other materials regarding UI Core Curriculum",1998-2007
UA 2011-18,University of Idaho Photo Center slides of basement flood (University of Idaho Library?),1.00 Cubic feet,Slides,1986
UA 2011-19,Budget Office Records,24.00 cubic feet,Financial documents including University of Idaho operating budgets and budget books.,1921
UA 2011-23,Honors Program Committee Records,,Meeting agendas and minutes.,1983
UA 2011-26,University of Idaho Library Adminstration Records,0.25 Cubic feet,Library photos and documents.,1971-1993
UA 2011-27,President's Office Records,1.00 Cubic feet,"Zinser and Hoover inauguration documents. Records relating to the logistics of the inaugurations, such as invitation lists, hotel accommodations, luncheon arrangements, regalia, and parking passes.",1989-1997
UA 2011-32,UI Facilities Management,5.00 Cubic feet,Photographic prints and negatives of Architectural and Engineering Services University of Idaho buildings and campus photographs from Moscow.,1892-2000
UA 2011-34,Martin Institute Records,,,1900-1970
UA 2012-01,Olle Pellmyr Laboratory Records,4.00 Cubic feet,Notebooks with experiment results and interpretation,1987-2011
UA 2012-02,Irving Rauw Collection,0.25 Cubic feet,Irving Rauw's Phi Delta Theta dance booklets and newspaper clippings,1936-1939
UA 2012-05,Moscow UI Faculty Portrait,3.00 Linear feet,,1919
