accession_number,title,extent,description,date
MA 2016-39,Gary Williams Papers,15.00 Cubic feet,"Gary Williams was an English professor and former chair of the department. Papers include correspondence, syllabi, subject files, class preparation files, notes, and class notes.",1969-2015
MA 2016-40,Palouse Empire Science Fiction Association Collection (PEFSA),8.00 Cubic feet,"Organizational records and ephemera including conventions and fandom in Northwest like MosCon; photographs, program books, organizational records, memorabilia, signed materials of value.",1979-2000
MA 2016-41,Earl Bennett Papers,1.00 Folder,Thumbdrive (USB) of scans of Genessee Newspapers and Transcript of tapes recorded by Stanley Easton.,1888-1985
MA 2016-42,Carolyn McCoy Papers,1.00 Folder,Book and papers related to her parent's time in South America,1927-2015
MA 2016-43,Michael Frome papers,21.00 Cubic feet,"Papers, media, books, photos, and laptop.",undated
MA 2016-44,Michael Frome Papers,3.00 Cubic feet,"Framed photographs, briefcase, some papers, and plaques.",undated
MA 2016-45,Barbara Featherstone Collection,1.00 Folder,Postcard with letter from Wilbur and Roberta Betts about James Willard Schultz Legacy,1970-1980
MA 2016-46,Michael Frome Papers,5.00 Cubic feet,"Publications, daily calendars, books written by Frone and from personal library.",undated
MA 2016-47,Michael Frome Papers,1.00 Cubic feet,Books from personal library,undated
MA 2016-49,Gail Eckwright Papers,1.00 Cubic feet,"Library related materials including papers, CDs, slides, booklets",1984-2010
MA 2016-51,Camp Cameron (CCC) tent pole,1.00 Cubic feet,,1934
MA 2016-52,Virginia Wicks Papers,4.00 Cubic feet,"Papers, CDs, and photographs",1990-2005
MA 2016-53,Joel King Collection,1.00 Folder,Color slides of Burlington Northern trains on Camas Prairie Railroad line south of Moscow,1980-1985
MA 2016-56,Mary DuPree Collection,5.00 Cubic feet,"Genessee Idaho music collection including sheet music, suitcase with sheet music; claimed to be music from early band master in Genessee",undated
MA 2016-57,Palouse Empire Science Fiction Association (PEFSA) Collection,1.00 Folder,Ballots for postcard election with famous signatures.,1987
MA 2016-58,John and Rachael Osborn papers,59.00 Cubic feet,,1980-2010
MA 2016-59,John and Rachael Osborn Collection,216.00 Cubic feet,,1980-2010
MA 2016-60,John and Rachael Osborn Collection,11.00 Cubic feet,"Oversized documents, framed materials, and maps.",1980-2010
MA 2016-61,Malcolm and Carol Renfrew Papers,6.00 Cubic feet,"Papers, photos, diaries of trips, newspaper clippings, greeting cards and other items collected throughout the years by Malcolm M.and Carol Campbell Renfrew. Additionally there are keepsake items such as two trophies, a bronze box in the shape of the Capitol building in Washington D.C. and an engraved silver dish.",1933-2005
MA 2017-01,Idaho Geological Survey Records,0.50 Cubic feet,"Pamphlets, book, and blue prints. Pamphlets are on Idaho; some published by the US forest service, a book ""Memoirs of the National Academy of Science,"" and a blue print of a bridge in Pocatello.",1903-1978
MA 2017-03,Paul Kliger Collection,6.00 Cubic feet,"Antique drum kit and percussion items, personal papers, and photographs",1942-1995
MA 2017-04,Michael Frome Papers,1.00 Cubic feet,Political cartoon and artwork,1970-2010
MA 2017-05,Jim Fazio Papers on Michael Frome,1.00 Folder,Materials from Michael Frome memorial service in 2016 including documents and a DVD,2016
MA 2017-06,Larry Craig Papers,6.00 Cubic feet,"Papers, scrapbooks, election materials, and framed photographs",1968-2005
MA 2017-07,Mark Benson Papers,3.00 Cubic feet,"16 mm film and papers from Potlatch Corporation and ""Last of the Log Drive"" Motion Picture films",1968-1981
MA 2017-09,John Osborn Papers,22.00 Cubic feet,"Copies of Transitions newsletter, some records, some oversize maps, one rolled oversize map, and one wooden table top.",1985-2002
MA 2017-10,Larry Craig Papers,1.00 Linear feet,"Route of the Hiawatha materials including documents, maps, and framed photograph.",1996-1999
MA 2017-11,Idaho Library Association (ILA) Records,0.50 Cubic feet,"Documents, programs, ISLA section (ID State Library Association) college library section; legislation, development, annual reports, and minutes.",1954-1977
MA 2017-12,4-H Club Records,3.00 Cubic feet,"4-H ribbons, project binders, and photocopied photographs",1948-1977
MA 2017-14,Randy Stapilus Papers,4.00 Cubic feet,"Idaho Political papers, newspaper clippings, and transcripts of interviews relating to the state of Idaho's political history.",1933-2012
MA 2017-15,Idaho Library Association (ILA) Records,1.00 Cubic feet,Region 2 conference papers.,2003-2010
MA 2017-16,Charles Red McCollister papers,2.00 Cubic feet,"Articles and information about Clearwater River Log Drives, including documents from the Foreman's perspective, created or collected by Red McCollister who served as forman for 17 years, starting in 1950. McCollister also ran logging camps for Potlatch Lumber Company. The collections also include personal items such as boots Red McCollister wore when working the log drives.",1920-2000
MA 2017-18,Robert Sarles Collection,1.00 Cubic feet,UI scrapbook and hat,undated
MA 2017-19,Charles Red McCollister Collection,1.50 Cubic feet,"Articles and information about Clearwater River Log Drives, including documents from the Foreman's perspective, created or collected by Red McCollister who served as forman for 17 years, starting in 1950. McCollister also ran logging camps for Potlatch Lumber Company. The collections also include personal items such as boots Red McCollister wore when working the log drives.",1930-1980
MA 2017-21,Rachael Paschal Osborn Papers,42.00 Cubic feet,"Papers and related materials pertaining to Racahel Paschal Osborn's career as a water rights attorney and work as an environmental activist, formats include papers, CD's, computer disks, newspaper clippings.",1942-2010
MA 2017-22,Tom Karsky Papers,5.00 Cubic feet,"Tom Karsky was an Agricultural Engineering and extension professor in the agricultural engineering deptartment. Records include photographs, extenstion publication, university publications, and notes from that department.VHS, photographs, negatives, and UI extension publications",1920-1990
MA 2017-24,Jerome County Historical Farm Museum Postcards,1.00 Cubic feet,,1970
MA 2017-26,Campus Christian Center Records,2.00 Cubic feet,"Annual report and minutes of Idaho Institute of Christian Education, financial papers, materials related to Ki Alpha Pi, drawings, and art prints",1930-2005
MA 2017-31,Marcus J. Ware Book Collection,1.00 Cubic feet,Historical publications and letters regarding Marcus J. Ware and his involvment with the Nez Perce.,1877-1980
MA 2017-33,Chatcolab Northwest Leadership Laboratory Records,2.00 Cubic feet,"The Chatcolab Northwest Leadership Laboratory is a non-profit organization that teaches leadership skills in a recreation setting. Camps have been running each summer since 1949. This collection contains the camp packet from each lab between 1949-2000. Packets contain program planning, activities, stories, menus, and recipes for each lab. See also https://www.lib.uidaho.edu/digital/chatcolab/",1996-2009
MA 2017-34,"Leonard ""Lenn"" Loring and Fred Schmidt Recording",0.50 Cubic feet,"Sound reels, audio cassettes, and correspondence pertaining to Idaho unions and AFL-CIO unions.",1964
MA 2017-35,Victoria E. Mitchell and Jon Gustafson Collection on Science Fiction,312.00 Cubic feet,"Papers, books, media, periodicals, photographs and more",1940-2015
MA 2017-36,Victoria E. Mitchell and Jon Gustafson Collection on Science Fiction,25.00 Cubic feet,"Books, periodicals, artwork, and media",1940-2015
MA 2017-37,Science Fiction Pulp Covers,1.00 Folder,,1950-1965
MA 2017-38,USGS Topographical Maps of Idaho,Oversized,Oversize maps,1893-1909
MA 2018-01,Idaho Conservation League Records,2.00 Cubic feet,News articles and records,1972-2005
MA 2018-02,First National Bank of Wallace Ruler,1.00 Folder,A plastic ruler,1948
MA 2018-03,Cedar and a Cedar Mill at Kamiah Photographs,1.00 Folder,Slides,1999
MA 2018-04,Jeanne Holder Collection,1.00 Folder,"Three photos, a booklet, and a football schedule",1952-1958
MA 2018-05,Library Government Documents Idaho Maps,Oversized,National forest and meteorological maps of Idaho,1949-1968
MA 2018-06,Victoria E. Mitchell and Jon Gustafson Collection on Science Fiction,1.00 Cubic feet,"Science fiction artwork including posters, and oversize pieces.",undated
MA 2018-07,Student Life Slides,1.00 Folder,"Slides depicting student life on campus around. They depict dorm rooms, campus buildings, and sports games. The subject in several pictures is African American.",1970-1989
MA 2018-08,Victoria E. Mitchell and Jon Gustafson Collection on Science Fiction,2.00 Cubic feet,"Papers, correspondence, and book manuscripts.",1980-2000
MA 2018-09,Panhandle Health District Bunker Hill Superfund Collection,18.70 Gigabytes,"Clean-up photos, videos, documents and digitized slides and photographs",1970-2000
MA 2018-10,Dennis Baird Papers,0.25 Cubic feet,Materials relating to Hudson's Bay Company and Lewis and Clark and others,undated
MA 2018-12,Julia Ames Papers on Leo Ames Artwork,1.00 Folder,"Materials created by Julia that are about her father, Leo Ames', artwork and legacy. Includes books and postcard publicity.",2005-2017
MA 2018-13,Keith Peterson Collection,6.00 Cubic feet,"Idaho and regional personal collection of publications and postcards,",1900-2015
MA 2018-14,Mining Industry of Idaho Reports and other books,1.00 Cubic feet,Books and reports,1894-1964
MA 2018-15,Linda Molden Aerial Photograph,,Aerial photograph of campus,circa 1960s
MA 2018-16,Ariana Burns Photographs,74.40 Megabytes,Digitized photographs taken by Ariana Burns during performances at Hartung Theater.,1988-1994
MA 2018-17,Ben Davis Papers,3.00 Folders,Correspondence and photographs,1970-1979
MA 2018-18,Dennis Baird Papers,2.00 Cubic feet,Photocopies from NARA and other sources; Documents Relating to the History of the Nez Perce People and the Wallowa Valley,1863-1877
MA 2018-19,Charles Red McCollister Papers,1.00 Folder,"Articles and information about Clearwater River Log Drives, including documents from the Foreman's perspective, created or collected by Red McCollister who served as forman for 17 years, starting in 1950. McCollister also ran logging camps for Potlatch Lumber Company. The collections also include personal items such as boots Red McCollister wore when working the log drives.",1929-2002
MA 2018-20,Miles Jamison Willard Collection,5.00 Cubic feet,"Miles J. Willard, Jr. was a prominent engineer and scientist in Idaho notable for being involved with the invention of potato flakes. Willard was born in Philadelphia and attended Drexel University. He was in the army during World War II, and spent time in Oak Ridge, TN and New Mexico. After WW II he moved to Idaho Falls where he worked as an engineer in food science. Materials in the collection include family photographs, photographs from food science work including of potato flakes, scrapbooks, professional notes, and correspondence. The correspondence primarily involves Willard's time in the military during World War II where he was involved in the Manhattan Project. He received many awards from the state of Idaho and from the University of Idaho which are also reflected in the collection. Other materials document Willard's interest in genealogy, photography, and music.",1930-2000
MA 2018-21,Lynn Baird papers,4 Cubic feet,"Papers acquired by and pertaining to retiring University of Idaho Library Dean Lynn Baird's career as a librarian, department head, and dean at the UI Library (1974-2018). The papers document her involvement in the UI campus community in areas such as the university foundation, leadership academy, Lionel Hampton Jazz Festival and digital infrastructure.",1974-2018
MA 2018-22,Bessie Olmstead Storms Papers,4.00 Cubic feet,"Personal papers and keepsakes gathered throughout the life of Bessie Olmstead Storms. Storms graduated from high school in Plummer, Idaho, attended the University of Idaho and returned to Plummer to teach.Items in this collection include photos of Bessie Storms, a collection of genealogical information and historical family photos for the Olmstead family, Plummer High School Yearbooks, report cards, fair ribbons, professional papers relating to her career as a teacher,some materials pertaining to her involvement with 4-H and the local Grange, correspondence from her son Jim and diaries kept by Bessie from 1985 to 2002. There are letters and cards from family or former students in the collections as well as personal items including her will, death certificate and the guest book from her husband's funeral service.There are also cards sent to her son Jim or his family and papers from the planning of reunion for his 1957 graduating class from Plummer High School.",1912-2006
MA 2018-24,U.S. Bureau of Entomology and Plant Quarantine Field Station Reports,1.00 Linear feet,"Reports from the U.S. Department of Agriculture Bureau of Entomology and Plant Quarantine Division of Truck Crop and Garden Insect Investigations. The reports are either annual reports or progress of work reports from the years 1931-1947 for the Moscow, Idaho Field Station.",1931-1947
MA 2018-25,Moscow Pullman Daily News Nearby History Publications,1.00 Cubic feet,"Newspaper pages taken from the Moscow Pullman Daily News which feature the Nearby History column. The content of these columns features items of historic interest and accompanying pictures contributed by various entities including University of Idaho Library Special Collections and Archives, Latah County Historical Society, Whitman County Historical Society and Washington State University Manuscripts, Archives and Special Collections. Also included is a letter from a reader to contributor Joann Jones remarking on one of her columns.",2014-2016
MA 2018-28,Joseph C. James Recordings of Feather On Jazz,1.00 Cubic feet,This collection consists of 15 reel-to-reel canisters of film of the series Feather on Jazz which is a documentary about jazz music. Each canister contains one episode of the series.,undated
MA 2018-29,T.N. Barnard Photograph of Wallace,0.50 Linear feet,"One sepia toned panoramic photo of the town of Wallace, Idaho taken by T.N. Barnard",undated
MA 2018-30,Hall Macklin Sheet Music,0.50 Linear feet,Ten musical compositions for organ composed by former University of Idaho Music Department chair Hall Macklin.,1965-1984
MA 2018-31,American Society of Agricultural and Biological Engineers Pacific Northwest Chapter Papers,0.50 Cubic feet,Historical papers of the Pacific Northwest Chapter of the American Society of Agricultural and Biological Engineers (ASABE). Papers represented the 1971 convention and activities and programs from the Summer 1993 meeting,1971-1993
MA 2018-32,Lorin W. and Florence Greathouse Roberts Collection,5.00 Cubic feet,"Books and periodicals with a focus on James Joyce owned by Lorin W. Roberts, U of I Faculty, Biological Sciences, and books and periodicals with a focus on poetry owned by Florence Greathouse Roberts, U of I faculty, English. It also includes some media and ephemeral material.",undated
MA 2018-33,Dick A. Wilson Papers,0.50 Linear feet,Materials include a history papers including a paper on the Survival of Turn of the Century Architecture in Wallace Idaho for History 423 (including pages of slides for illustrations) written by Dick A Wilson and materials relating to Alice McCabe.,1956-1989
MA 2018-34,"George H. Belt, Jr. Papers",7.00 Cubic feet,"Personal and professional papers of University of Idaho Forest Resources professor George H. Belt, Jr who was a member of the Forestry faculty from 1965 until his retirement in 1998 when he was named professor emeritus. The collection includes papers from his undergraduate and graduate studies, instructional materials for classes taught at the UI including Weather and Climate, forestry papers, and student theses for which he was an adviser. Additional papers document Dr. Belt's work overseas on behalf of USAID, awards, diplomas and certificates he received as well as slides of countries he visited and some used for classroom instruction. There is also a box containing research he conducted outside of the university.",1960-1998
MA 2018-35,William (Bill) McLaughlin Papers,3.00 Cubic feet,"Materials and research in the form of brochures, maps, books, and tapes of interviews concerning the French Regional Nature Park system assembled by William(Bill) McLaughlin of the University of Idaho College of Natural Resources. French Nature Parks were an area of research for Dr. McLaughlin. A regional nature park or regional natural park (French: parc naturel rgional or PNR) is a public establishment in France between local authorities and the French national government covering an inhabited rural area of outstanding beauty, in order to protect the scenery and heritage as well as setting up sustainable economic development in the area. A PNR sets goals and guidelines for managed human habitation, sustainable economic development, and protection of the natural environment based on each park's unique landscape and heritage. The parks also foster ecological research programs and public education in the natural sciences. (Wikipedia). There are 49 Regional Nature Parks in France. This collection contains general information about the park system as well as information specific to 18 of the currently existing 49 parks collected by Dr. McLaughlin.",circa 1980s
MA 2018-36,Ed Hudson Papers,0.50 Linear feet,"Fourteen black and white photos of a University of Idaho Homecoming parade and a 1955 commencement program which belonged to Ed Hudson, an alumni of the class of 1955.",1955
MA 2018-37,Erma Scholtz Papers,0.50 Linear feet,An 1928 University of Idaho diploma of alumni Erma Scholtz and a matted picture of her.,1928
MA 2018-38,Inez Flisher Photographs and Posters on Vandal Athletics,2.00 Folder,Photographs and posters of various University of Idaho athletic teams donated by former UI athletic department employee Inez Flisher.,1980-1989
MA 2018-39,University of Idaho Athena Records,0.50 Linear feet,"Various minutes, emails and other correspondence from 2000-2007 of the University of idaho's women's leadership group Athena as well as program information from the 2007 UI Women's Leadership Conference ""Exploring Your World, Charting Your Future""",2000-2007
MA 2018-40,A Real Man Among Men How Republicans Helped Democrat Mike O'Callaghan win the 1970 Nevada Governor's Race by William Clayson,0.50 Linear feet,An article written for the Nevada Historical Society about the 1970 Nevada governor's race which was won by University of Idaho Alumnus Mike O'Callaghan('56),2014
MA 2018-41,Antique Book Collection,1.00 Cubic feet,"Books ranging in age from 1858 to 1940 on a variety of topics and subjects. The books include Ivanhoe by Sir Walter Scott, volumes on reptiles, a book on plants, Dicken's Pickwick Papers, and a Beacon First Reader,",1858-1940
MA 2018-42,James A. McClure Papers,3.00 Cubic feet,"Papers, memos, newspaper clippings and correspondence from James A. McClure, United States Congressman and Senator from Idaho from 1968-1990. The papers in the collection include both those from his time as senator and others generated from his work after leaving the senate.",1968-2000
MA 2018-43,Greg Gollberg Papers,1.00 Cubic feet,"Papers and CD's from Greg Gollberg, who worked for the University of Idaho as a forest researcher and data manager. The papers include materials relating to the Citizens Working Group of the Frank Church River of No Return Wilderness, papers on a conference on the topic of National Park and Wilderness Fire Management, Idaho Wolf Recovery and fish stocking data. CD's in this collection cover topics involving fire management and related statistics and a state of Idaho Hazard Mitigation Plan.",1989-2007
MA 2018-44,Brian R. Stickney Collection on the Panama Canal,1.00 Linear feet,Photographs of the construction of the Panama Canal taken between 1907-1910 and a typewritten set of plans for the defenses of the Panama Canal drafted by Captain George Percy Dawes of the U.S. Army's Coastal Artillery Crops in 1915 with contributions from other staff officers assigned to the Isthmus at that time.,1907-1915
MA 2018-45,Clarence Favre Scrapbook,1.00 Linear feet,Photos and newspaper clippings dealing with both his years as a student at Idaho and his employment as a forester. There is also an 8 x 10 studio portrait of Mr. Favre in a separate folder,1910-1953
MA 2018-46,Forestry Photographs,1.00 Folder,Photoraphs from varying entities all dealing with some form of forestry or forestry management.,1933-1969
MA 2018-47,Kenneth Noren Papers,1.00 Cubic feet,"Papers and materials from Kenneth Noren, a University of Idaho professor of electrical and computer engineering. Papers in this collection consist of teaching and research notes as well notes and papers from professional conference Dr. Noren attended. There are also seven floppy disks containing lab data. File folders and spiral bound notebooks containing teaching, research and conference materials as well as 7 floppy disks with lab data.",1990-2012
MA 2018-48,Dennis Baird Papers,1.00 Folder,"Photocopies of papers from the Library of Congress Gifford Pinchot papers. The materials include a letter to Mr. Pinchot written in 1939 by Wm. W. Morris, a forester in the state of Wisconsin to preface an article he included with the letter about his time as en employee in the national forests of Northern Idaho. Mr. Morris discusses the great fire of 1910 in the report.Pages of the report include copies of photographs to illustrate its content. There is a letter from Mr. Pinchot to Mr. Morris acknowledging the article written in 1940.",1939-1940
MA 2018-49,European Pine Shoot Moth Papers,1.00 Linear feet,"Papers which discuss the European pine shoot moth, an introduced defoliator.",1959-1974
MA 2018-50,"Mark B. Calnon, Jr. Collection",1.00 Cubic feet,"Papers, correspondence,and memorabilia from Mark Brooks Calnon, Jr, The papers cover his times as a student and graduate student at the University of Idaho where he was member of the Kappa Sigma fraternity. University papers include a copy of master's thesis and his master's diploma. Cards and correspondence included in the collection are from his year's at the University of Idaho as well as after.",1976-2005
MA 2018-51,Forest Insect Reports,1.00 Folder,A CD of an article entitled The Douglas Fir Beetle in Western Forests: A Historical Perspective by University of Idaho entomology professor Malcolm Furniss. The article was submitted to American Entomologist in 2013,2013
MA 2018-53,Russell Chrysler Papers,1.00 Folder,"Correspondence and papers of Russell Chrysler, a marketing professor in the University of Idaho College of Business from 1959-1974. Some of the correspondence is from his time as an instructor at Los Angeles City College as well as the University of Idaho. There is also a draft and several copies of his C.V. Topics of the correspondence include his application for a sabbatical leave, notification of salary and change of teaching rank and his work as co-chair of the Northwestern University Business Administration Conference (NUBAC).",1956-1973
MA 2018-54,Michael Frome Papers,0.50 Cubic feet,"Papers and a DVD containing material written my Michael Frome as well as a letter by Dr. Frome to Garth Reese, head of Special Collections and Archives, in 2013.",1959-2013
MA 2018-55,Pole Blight Conference Photograph,1.00 Folder,"A group photograph of attendees at the pole blight conference at the Deception Creek Experimental Forest, Coeur d'Alene National Forest June 1 and 2, 1948. A paper which identifies those in the photo is also included.",1948
MA 2018-56,Bruce Pitman Papers,0.50 Cubic feet,"Papers from the office of Bruce Pitman who was involved with student services and student affairs on the University of Idaho campus for four decades, retiring as dean of students in the fall of 2014. These papers, from the late 1960's and early 1970's, deal with alcohol policies, student code conduct and judicial matters concerning students.",1968-1973
MA 2018-57,Bunker Hill and Sullivan Mining Company Papers,0.50 Cubic feet,"Papers related to the Bunker Hill and Sullivan Mining Company. There are papers, memos and correspondence related to University of Idaho Library Special Collections and Archives acquiring the Bunker Hill papers in 1991 and another folder of articles written about the operation of the Bunker Hill-Sullivan operation written in the 1930's, 1940's, 1950's and 1960's along with a map of the Coeur d'Alene mining district.",1930-1991
MA 2018-58,Sunshine Mining Company Papers,0.50 Cubic feet,Business papers of the Sunshine Mining Company from the years 1972 to 1990. The papers include a proposal to reopen the Sunshine Mine 1872 and papers for business conducted for a number of mines and claims throughout Idaho. There are two cassette tapes included in folder 5 on the Buckskin Mine.,1972-1990
MA 2018-59,Unknown Photograph,1.00 Folder,"This photograph is of a light haired man or boy standing in an office in front of a picture of 3 views of the world, an American flag and a desk or credenza with lawn enforcement items on it.",undated
MA 2018-60,Alpha Chapter of Phi Beta Kappa Records,1.00 Cubic feet,"Correspondence, membership information, tax returns and financial ledgers of the Alpha Chapter at the University of Idaho of the national honor society Phi Beta Kappa.",1921-1980
