accession_number,title,extent
UA 2018-15,"""The History of the Northwest Wind Quintet"" Master's Paper",0.25 Cubic Feet
UA 2016-01,2015 Commencement speech by John Weincek,0.25 Cubic_feet
MA 2017-12,4-H Club Records,3.00 Cubic_feet
MA 2013-07,A Great Day In Harlem Collection,1.00 Cubic_feet
MA 2018-40,A Real Man Among Men How Republicans Helped Democrat Mike O'Callaghan win the 1970 Nevada Governor's Race by William Clayson,0.50 Linear_feet
MA 2011-02,A. Fred Watts Photographs,1.00 Cubic_feet
MA 2000-34,Aaron Harp Papers,1.00 Cubic_feet
MA 2003-03,AARP Latah County Chapter Records,1.00 Cubic_feet
UA 1989-24,Academic Affairs Records,0.50 Cubic_feet
UA 1980-024,Academic Council Minutes,8.00 Volumes
UA 1999-20,Academic Council Minutes,3.50 Linear feet
MA 2010-25,Adam Aulbach Photographs,1.00 Cubic_feet
UA 2009-11,Administrative Affairs Records,11.00 Cubic_feet
UA 1999-22,Administrative Council Minutes,2.00 Linear feet
MA 2019-53,Aerial Photo Quadrangle Map collection,1.00 folder
UA 1990-30,Affirmative Action Records,0.50 Cubic_feet
MA 2019-40,Agnes Crawford Schuldt papers,1.00 Folder
MA 2001-02,Agricultural Communications Collections,6.00 Cubic_feet
UA 1980-054,Agricultural Consulting Council Records,10.00 Volumes
UA 1989-33,Agricultural Cooperative Extension Records,1.00 Cubic_feet
UA 1997-06,Agricultural Economics/Rural Sociology Records,1.00 Cubic_feet
UA 2000-16,Agricultural Ethics Collection,1.00 Cubic_feet
UA 1991-019,Agricultural Experiment Station Records,1.00 Cubic_feet
UA 1987-26,Agricultural Extension Records,1.00 Cubic_feet
UA 1988-09,Agricultural Extension Records,1.00 Cubic_feet
UA 1995-02,Agricultural Extension Records,2.00 Cubic_feet
UA 2002-10,Agricultural Extension Service Records,0.50 Cubic_feet
UA 1992-24,Agriculture Communications Center Video 1% initiative,0.50 Cubic_feet
MA 1995-09,Al Day Papers,2.00 Cubic_feet
MA 1994-21,Albert R. Menard Papers,17.00 Cubic_feet
UA 2017-36,Aldrich Entomology Club Newsletters,74.10 Megabytes
UA 2010-11,Aldrich Entomology Club Records,1.00 Cubic_feet
MA 2018-60,Alpha Chapter of Phi Beta Kappa Records,1.00 Cubic_feet
MA 2012-25,ALSC Architects Records of University of Idaho Sandpoint Campus,0.25 Cubic_feet
UA 2016-30,Alumni Association Association Collection,1.50 Cubic_feet
UA 2007-05,Alumni Association Office Records,3.00 Cubic_feet
UA 2016-14,Alumni Association Records,15.00 Cubic_feet
UA 1989-47,Alumni Office Records,0.50 Cubic_feet
UA 2018-08,Alumni Office Records,2.00 Cubic_feet
UA 2017-32,Alumni Relations Campus Photographs,1.00 Cubic_feet
UA 2011-01,Alumni Relations Retirees Association Records,1.00 Cubic_feet
MA 2018-31,American Society of Agricultural and Biological Engineers Pacific Northwest Chapter Papers,0.50 Cubic_feet
MA 1993-25,American Society of Agricultural Engineers Pacific Northwest Section Records,0.50 Cubic_feet
MA 2008-29,"American Society of Agricultural Engineers, PNW Section Records",0.25 Linear feet
MA 1992-04,"American Society of Agricultureal Engineering, Pacific Norwest Section Records",0.50 Cubic_feet
MA 1990-20,American Society of Agricutlural Engineering Pacific Northwest Section Records,6.00 Cubic_feet
MA 1999-11,American Society of Microbiology Northwest Branch Records,3.50 Cubic_feet
UA 1980-025,American Studies Committee Records,1.00 Volumes
MA 1999-16,Amos Yoder Papers,1.00 Cubic_feet
MA 2000-31,Amos Yoder Papers,1.00 Cubic_feet
UA 1997-15,Animal and Veterinary Science Records,0.50 Cubic_feet
MA 1999-05,"Ankenbrand, Frank Pound Family papers",0.50 Cubic_feet
MA 2012-27,Ann Driscoll Turner Paintings,9.00 Cubic_feet
MA 2016-34,Ann Taylor Collection,0.50 Linear feet
MA 2018-66,Ann Taylor Collection,1.00 Folder
MA 2007-09,Anne Anderson Papers,0.50 Cubic_feet
MA 2018-41,Antique Book Collection,1.00 Cubic_feet
MA 1995-23,Arboretum Associates Records,0.50 Cubic_feet
UA 2009-05,Arboretum Associates Records,0.50 Cubic_feet
UA 2014-01,Architectural and Engineering Services Records,0.00 null
UA 2014-05,Architectural and Engineering Services Records,0.00 null
UA 2015-17,Architectural and Engineering Services Records,1.00 Folder
UA 2015-37,Ari Burns Photographs,0.50 Linear feet
MA 2019-05,Ariana Burns collection,1.00 Folder
MA 2018-16,Ariana Burns Photographs,74.40 Megabytes
UA 1990-47,Art and Architecture Records,2.00 Cubic_feet
UA 2018-29,Art and Architecture South Building Survey Blueprints,10.00 Sheets
MA 1999-19,Art Wyatt Earp Randal Collection,1.00 Cubic_feet
MA 2002-08,Arthur B. Johnson Papers,1.50 Cubic_feet
UA 2007-07,Arthur R. Gittins Papers,0.50 Cubic_feet
MA 2000-01,Artylee Hollada Scrapbook,0.50 Cubic_feet
MA 2008-14,Associated Students of the Southern Branch University of Idaho (ASSBUI) Coupon Book,1.00 Folder
UA 2018-20,ASUI Executive Board Papers,0.50 Linear Feet
UA 2004-07,ASUI Office Records,6.00 Cubic_feet
UA 1980-049,ASUI Records,7.00 Volumes
UA 1980-050,ASUI Records,15.00 Volumes
UA 1992-11,ASUI Records,1.00 Cubic_feet
UA 1993-01,ASUI Records,0.50 Cubic_feet
UA 1993-14,ASUI Records,7.00 Cubic_feet
UA 2007-20,ASUI Records,1.00 Cubic_feet
UA 1991-039,ASUI Senate Records,16.50 Cubic_feet
UA 2007-08,ASUI Senate Records,2.00 Cubic_feet
UA 2017-16,ASUI Student Government Office Records,3.00 Cubic_feet
UA 2017-26,ASUI Student Government Office Records,3.00 Cubic_feet
UA 2000-12,Athletic Department Collection,31.00 Cubic_feet
UA 1999-26,Athletic Department Football & Basketball Films,39.00 Cubic_feet
UA 1997-21,Athletic Department Football films,7.00 Cubic_feet
UA 1984-04,Athletic Department Records,94.00 Reels
UA 1980-021B ,Athletic Department Scrapbooks,9.00 Cubic_feet
UA 1980-135,Athletics Department Scrapbooks,39.00 Volumes
UA 2016-22,Auditorium Chamber Music Series Records,0.50 Linear feet
MA 2016-45,Barbara Featherstone Collection,1.00 Folder
MA 1998-20,Barbara Greever Committee Papers,0.50 Cubic_feet
MA 2012-08,Barbara Greever Papers,10.00 Cubic_feet
MA 1998-15,Barbara Meldrum Papers,2.00 Cubic_feet
MA 2012-13,Barbara Meldrum Papers,9.00 Cubic_feet
MA 2012-44,Barbara Ware Featherstone Papers,1.00 Folder
MA 2015-26,Barnard-Stockbridge Copy Prints and Negatives,2.00 Cubic_feet
MA 1999-21,Barnard-Stockbridge Glass Plate Negatives,4.00 Cubic_feet
MA 2016-10,Beacon for Mountain and Plain autographed/inscribed copy,1.00 Volumes
MA 2015-30,Bear Top Mining Company records,1.00 Folder
MA 2018-17,Ben Davis Papers,3.00 Folders
MA 2010-28,Benny Goodman Quartet Reunion,1.00 cassette
MA 2016-36,Bert Lapkin Amazon-Manhattan Minining Company check,1.00 Folder
MA 1984-14,Bert Russell Papers,0.50 Cubic_feet
UA 2016-23,Bertrand and Florence Heath Memorabilia from the University of Idaho,0.50 Cubic_feet
MA 2007-15,Bessie Olmstead Papers,0.25 Cubic_feet
MA 2018-21,Bessie Olmstead Storms Papers,4.00 Cubic Feet
MA 2015-24,Beta Theta Pi Collection,1.00 Cubic_feet
MA 2012-35,Beta Theta Pi Memorabilia,0.50 Cubic_feet
MA 2015-27,Beta Theta Pi Records,1.00 Folder
MA 2015-31,Beta Theta Pi Records,1.00 Folder
MA 2020-14,Betty Crampton collection,1.00 Folder
MA 2010-18,Beverly Lingle Papers,0.20 Cubic_feet
MA 1992-29,Bill London Papers,2.00 Cubic_feet
MA 1993-37,Bill London Papers,1.00 Cubic_feet
MA 1994-27,Bill London Papers,1.00 Cubic_feet
MA 1995-28,Bill London Papers,1.00 Cubic_feet
MA 1996-24,Bill London Papers,1.00 Cubic_feet
MA 1997-05,Bill London Papers,1.00 Cubic_feet
MA 1998-10,Bill London Papers,1.00 Cubic_feet
MA 1999-06,Bill London Papers,0.50 Cubic_feet
MA 2001-01,Bill London Papers,1.00 Cubic_feet
MA 2002-02,Bill London Papers,1.00 Cubic_feet
MA 2003-01,Bill London Papers,1.00 Cubic_feet
MA 2004-04,Bill London Papers,1.00 Cubic_feet
MA 2006-01,Bill London Papers,1.00 Cubic_feet
MA 2007-02,Bill London Papers,1.00 Cubic_feet
MA 2008-01,Bill London Papers,0.30 Cubic_feet
MA 2009-08,Bill London Papers,0.50 Cubic_feet
MA 2011-14,Bill London Papers,0.75 Cubic_feet
MA 2012-01,Bill London Papers,1.00 Cubic_feet
MA 2005-01,Bill London Photographs,1.00 Cubic_feet
MA 1992-22,Bill London Publications,1.50 Cubic_feet
MA 2001-19,Bill Swagerty Papers,0.50 Cubic_feet
MA 2015-22,Biological and Agricultural Engineering Department Records,2.00 Cubic_feet
UA 2000-02,Biological and Agricultural Engineering Records,5.00 Cubic_feet
UA 1990-01,Blue Ribbon Panel Report,0.50 Cubic_feet
UA 2007-18,Board of Regents of the University of Idaho Records,9.00 Cubic_feet
UA 1980-023,Board of Regents Records,19.50 Cubic_feet
UA 2017-21,Bob Fahringer Collection,2.00 Cubic_feet
MA 2016-11,Bob Holder Collection,0.25 Linear feet
MA 2019-46,Bonnie J. Hultstrand papers,3.00 Cubic Feet
MA 2020-04,Booth Family collection,1.00 Folder
UA 1988-08,Borah Foundation Cassettes,1.00 Cubic_feet
UA 1991-030,Borah Foundation Committe Records,1.50 Cubic_feet
UA 1989-11,Borah Foundation Committee Records,0.50 Cubic_feet
UA 1990-09,Borah Foundation Records,0.50 Cubic_feet
UA 1990-18B,Borah Foundation Records,0.50 Cubic_feet
UA 1991-004,Borah Foundation Records,0.50 Cubic_feet
UA 1992-07,Borah Foundation Records,0.50 Cubic_feet
UA 1995-10,Borah Foundation Records,0.50 Cubic_feet
UA 1995-19,Borah Foundation Records,0.50 Cubic_feet
UA 1980-026,Borah Symposium Minutes,3.00 Volumes
UA 2001-04,Borah Symposium Records,1.00 Cubic_feet
UA 2012-07,Bower Anthropology Laboratory Records,1.00 Cubic_feet
UA 1990-44,Boyd A. Martin Papers,6.00 Cubic_feet
UA 1991-008,Boyd A. Martin Papers,11.00 Cubic_feet
MA 1998-07,Boyd Archer Martin Correspondence,1.00 Cubic_feet
MA 1991-58,Boyd Martin Papers,9.00 Cubic_feet
MA 1998-12,Boyd Martin Papers,33.00 Cubic_feet
MA 1987-37,Branyan Correspondence,0.50 Cubic feet
MA 2019-48,Brashears Family collection,1.00 Cubic_feet
MA 2018-44,Brian R. Stickney Collection on the Panama Canal,1.00 Linear_feet
UA 2015-03,Brink Hall Photograph,1.00 Cubic_feet
MA 2012-21,Bruce E. Perkins Photographs of,0.25 Cubic_feet
MA 2018-56,Bruce Pitman Papers,0.50 Cubic_feet
UA 2009-10,Budget Office Records,6.00 Cubic_feet
UA 2011-19,Budget Office Records,24.00 cubic feet
MA 2018-57,Bunker Hill and Sullivan Mining Company Papers,0.50 Cubic_feet
MA 2008-35,Bunker Hill and Sullivan Mining Company Records,0.30 Cubic_feet
MA 2007-30,Bunker Hill Company Records,1.00 Volumes
MA 2000-33,Bunker Hill Mining Company Records,11.50 Cubic_feet
UA 1989-12,Bureau of Public Affairs Records,1.00 Cubic_feet
MA 2005-08,"Bureau of Reclamation, Department of the Interior Records",1.00 Cubic_feet
MA 2016-15,Burton French Ellis Collection,2.00 Cubic_feet
UA 2011-02,Business Incubator Photographs,1.00 Folder
MA 2019-24,C.C.C. Review Newspaper collection,1.00 Cubic_feet
MA 1986-26,Calvin C. Warnick Papers,1.00 Cubic_feet
MA 1986-31,Calvin C. Warnick Papers,3.00 Cubic_feet
MA 1987-22,Calvin C. Warnick Papers,1.00 Cubic_feet
MA 1988-04,Calvin C. Warnick Papers,0.50 Cubic_feet
MA 1997-11,Calvin C. Warnick Papers,3.00 Cubic_feet
MA 1997-25,Calvin C. Warnick Papers,0.50 Cubic_feet
MA 1997-33,Calvin C. Warnick Papers,0.50 Cubic_feet
MA 1992-31,Calvin Warnick Papers,2.00 Cubic_feet
MA 1993-12,Calvin Warnick Papers,0.50 Cubic_feet
MA 1993-17,Calvin Warnick Papers,0.50 Cubic_feet
MA 2016-51,Camp Cameron (CCC) tent pole,1.00 Cubic_feet
UA 1980-027,Campus Affairs Committee Minutes,1.00 Volumes
MA 2016-30,Campus Christian Center Records,11.00 Cubic_feet
MA 2017-26,Campus Christian Center Records,2.00 Cubic_feet
UA 2019-56,Campus Photograph Collection,3.00 Cubic_feet
UA 1980-034,Campus Planning Committee Minutes,2.00 Volumes
UA 1988-10,Campus Planning Committee Records,0.50 Cubic_feet
UA 2018-13,Campus Planning Committee Records,0.50 Cubic_feet
UA 1980-035,Campus Planning Office Records,0.50 Cubic_feet
UA 2015-04,Campus Postcard Collection,1.00 cubic feet
UA 2004-04,Campus Recordings,1.00 Cubic_feet
UA 1980-029,Canada Day Records,1.00 Volumes
MA 2013-12,CANUSA-West Records,1.00 Cubic_feet
MA 2008-32,Carla Emery Papers,2.00 Cubic_feet
MA 2014-54,Carol Brink books purchase notes,1.00 Cubic_feet
MA 2006-03,Caroline Behre Photographs,0.25 Cubic_feet
MA 2015-09,Carolyn McCoy Collection,1.00 Cubic_feet
MA 2016-42,Carolyn McCoy Papers,1.00 Folder
MA 2007-06,"Catherine Knowles, K. Johnson, and Colin Postcards",0.50 Cubic_feet
UA 2019-07,Cecelia Luschnig papers,1.00 Cubic_feet
MA 1992-37,Cecil Hathaway Papers,1.00 Cubic_feet
MA 1986-19,Cecil W. Hathaway Papers,4.00 Cubic_feet
MA 1986-25,Cecil W. Hathaway Papers,4.00 Cubic_feet
MA 2018-03,Cedar and a Cedar Mill at Kamiah Photographs,1.00 Folder
UA 1999-17,Centennial Office Files,3.00 Cubic_feet
UA 1996-14,Centennial Office Records,0.50 Cubic_feet
UA 2001-09,Center for Business Development Data Tapes,1.00 Cubic_feet
UA 2017-17,Center for Volunteerism and Social Action Records,0.50 Cubic_feet
UA 2017-19,Center for Volunteerism and Social Action Records,1.00 Cubic_feet
MA 2001-14,Charles A. Wellner Papers,1.50 Cubic_feet
MA 2003-26,Charles E. Powell Papers,4.00 Cubic_feet
MA 2004-02,Charles E. Powell Papers,3.00 Cubic_feet
MA 2014-60,Charles James McCollister Collection,8.00 Cubic_feet
MA 2000-13,Charles L. Peterson Papers,12.00 Cubic_feet
MA 2001-21,Charles L. Peterson Papers,29.00 Cubic_feet
MA 2002-04,Charles L. Peterson Papers,19.00 Cubic_feet
UA 2008-16,Charles L. Peterson Papers,33.00 Cubic_feet
UA 2009-12,Charles L. Peterson Papers,1.00 Cubic_feet
MA 2017-19,Charles Red McCollister Charles Red McColister Collection,1.50 Cubic_feet
MA 2017-16,Charles Red McCollister papers,2.00 Cubic_feet
MA 2018-19,Charles Red McCollister Papers,1.00 Folder
MA 2001-16,Charles Wellner Papers,8.00 Cubic_feet
MA 2004-18,Charlie E. Powell Papers,4.00 Cubic_feet
MA 2015-23,Chatcolab Northwest Leadership Laboratory Records,5.00 Cubic_feet
MA 2017-33,Chatcolab Northwest Leadership Laboratory Records,2.00 Cubic_feet
MA 2019-43,Chatcolab Northwest Leadership Laboratory records,1.00 Cubic_feet
MA 2016-38,Check to Henry M Saad signed by Frank Leland,1.00 Folder
UA 2007-17,Chemical Engineering Department Records,7.00 Cubic_feet
UA 1989-15,Chemistry Department Requisitions,0.50 Cubic_feet
UA 1992-23,Chemistry Department Student Papers,1.50 Cubic_feet
MA 2019-58,Chris Baugher collection,1.00 Folder
UA 2000-03,Chris Schnept Photographs,1.00 Cubic_feet
MA 2011-26,Ciro and Elizabeth Molina Collection,254.00 Volumes
MA 2011-25,"City of Lewiston Collection,",14.00 Cubic_feet
UA 2008-05,"City of Moscow, Idaho UI Lionel Hampton International Jazz Festival Proclamation",1.00 Folder
UA 1989-19,Civil Engineering Records,0.50 Cubic_feet
MA 2011-44,"Civilian Conservation Corps (CCC) Camp Peone at Worley, Idaho Photograph",1.00 Folder
MA 2015-33,Civilian Conservation Corps Records,1.00 Folder
UA 2017-39,Clara Bleak Scrapbooks,0.50 Linear feet
MA 2018-45,Clarence Favre Scrapbook,1.00 Linear_feet
MA 1997-14,Clarence Seely Papers,4.00 Cubic_feet
MA 2015-36,CLASS Development Office Records,0.50 Cubic_feet
UA 2018-11,CLASS Development Office Records,1.00 Cubic_feet
MA 1984-39,Claude Simpson Papers,2.00 Cubic_feet
MA 1985-44,Claude Simpson Papers,0.50 Cubic_feet
MA 1986-12,Claude Simpson Papers,0.50 Cubic_feet
MA 1999-23,Clay Verne Spear Papers,23.00 Cubic_feet
UA 2009-08,College Agriculture and Life Sciences Nez Perce County Extension Office Records,1.50 Cubic_feet
UA 2017-38,College of Agricultural and Life Sciences (CALS) and Extension Publications,3.00 Cubic_feet
UA 2008-04,College of Agricultural and Life Sciences Records,1.00 Cubic_feet
UA 2017-28,College of Agriculture and Life Sciences Records,158.00 Gigabytes
UA 2018-18,College of Agriculture and Life Sciences Records,4.00 Cubic Feet
UA 1989-57,College of Agriculture Photographs,0.50 Cubic_feet
MA 2004-08,College of Education Foxfire Project,1.00 Cubic_feet
UA 2016-31,College of Education Photographs,1.00 Folder
UA 2004-14,College of Education Records,1.00 Cubic_feet
UA 2009-03,College of Education Records,0.50 Cubic_feet
UA 2009-17,College of Education Records,0.50 Cubic_feet
UA 2011-08,College of Education Records,5.00 Cubic_feet
UA 2015-10,College of Education Records,2.00 Cubic_feet
UA 2015-11,College of Education Records,3.00 Cubic_feet
UA 2016-13,College of Education Renovation Materials,1.00 Folder
UA 2018-32,College of Engineering Advisory Board Papers,1.00 Folder
UA 1990-49,College of Engineering Records,0.50 Cubic_feet
UA 1997-20,College of Engineering Records,0.50 Cubic_feet
UA 2016-27,College of Engineering Records,1.00 Folder
UA 1989-51,"College of Engineering,",0.50 Cubic_feet
UA 1994-02,College of Forestry Experimental Forest maps,2.00 Linear feet
UA 1992-12,College of Forestry Honorary Degrees,0.50 Cubic_feet
UA 1996-03,College of Forestry Papers,1.50 Cubic_feet
UA 1997-19,College of Forestry Photographs,0.50 Cubic_feet
UA 1985-13,College of Forestry Records,0.50 Cubic_feet
UA 1988-05,College of Forestry Records,0.50 Cubic_feet
UA 1988-07,College of Forestry Records,4.00 Cubic_feet
UA 1988-13,College of Forestry Records,1.00 Cubic_feet
UA 1989-02,College of Forestry Records,6.50 Cubic_feet
UA 1989-29,College of Forestry Records,1.00 Cubic_feet
UA 1990-33,College of Forestry Records,1.00 Cubic_feet
UA 1990-38,College of Forestry Records,1.00 Cubic_feet
UA 1991-005,College of Forestry Records,0.50 Cubic_feet
UA 1995-07,College of Forestry Records,5.00 Cubic_feet
UA 1995-08,College of Forestry Records,4.00 Cubic_feet
UA 1995-24,College of Forestry Records,7.00 Cubic_feet
UA 1995-27,College of Forestry Records,1.00 Cubic_feet
UA 1996-015,College of Forestry Records,0.50 Cubic_feet
UA 1999-18,College of Forestry Records,1.00 Cubic_feet
UA 1996-06,College of Foresty Papers,1.00 Cubic_feet
UA 1996-01,College of Graduate Studies Records,1.00 Cubic_feet
UA 2002-16,College of Graduate Studies Records,1.00 Cubic_feet
UA 2011-11,College of Law Records,0.50 Cubic_feet
UA 1995-14,College of Mine Records,4.00 Cubic_feet
UA 2016-19,College of Mines and Earth Resources and College of Science Records,2.50 Cubic_feet
UA 1998-07,College of Mines and Earth Resources Photographs,0.50 Cubic_feet
UA 1997-16,College of Mines Records,9.00 Cubic_feet
UA 2017-31,College of Natural Resources College of Natural Resources Papers,6.00 Cubic_feet
UA 2009-13,College of Natural Resources Dean's Office Records,5.00 Cubic_feet
UA 2009-14,College of Natural Resources Dean's Office Records,3.00 Cubic_feet
UA 2010-01,College of Natural Resources Dean's Office Records,1.00 Cubic_feet
UA 2010-04,College of Natural Resources Dean's Office Records,6.00 Cubic_feet
UA 2010-05,College of Natural Resources Dean's Office Records,6.00 Cubic_feet
UA 2010-08,College of Natural Resources Dean's Office Records,3.00 Cubic_feet
UA 2010-09,College of Natural Resources Dean's Office Records,4.00 Cubic_feet
UA 2006-06,College of Natural Resources Dean's Records,1.00 Cubic_feet
MA 2016-27,College of Natural Resources Records,42.00 Cubic_feet
UA 2002-15,College of Natural Resources Records,0.50 Cubic_feet
UA 2015-02,College of Natural Resources Records,10.00 Cubic_feet
UA 2017-18,College of Natural Resources Records,1.00 Volumes
UA 2019-20,College of Natural Resources stereoscope equipment,4.00 Cubic_feet
UA 2016-15,College of Science Dean's Office Records,3.00 Cubic_feet
UA 1987-06,Commencement Committee Records,0.50 Cubic_feet
UA 1990-04,Commencement Committee Records,1.00 Cubic_feet
UA 2018-04,Committee on Committee Records,8.30 Megabytes
UA 1989-48,Committee on Committees Records,0.50 Cubic_feet
UA 1991-016,Committee on Committees Records,1.00 Cubic_feet
MA 2001-03,"Compton I. White, Sr. Collection",0.50 Cubic_feet
MA 2005-15,Conservation Photographs,0.50 Cubic_feet
MA 1992-23,Consortium for Internation Development Papers,1.00 Cubic_feet
UA 1980-053,Controller Inventory,88.00 Volumes
UA 1987-13,Controllers Office Records,0.50 Cubic_feet
UA 1997-10,Cooperative Extension Service Annual Reports,0.50 Cubic_feet
UA 1996-07,Cooperative Extension Service Records,0.50 Cubic_feet
UA 1995-25,Cooperative Extension System Annual Reports,0.50 Cubic_feet
UA 2000-09,Cooperative Wildlife Research Unit Photographs,0.50 Cubic_feet
UA 1985-04,Core Curriculum Committee Records,0.50 Cubic_feet
MA 2012-02,Counterculture Periodicals,4.00 Cubic_feet
MA 2013-18,Counterfeiters of Shingle Creek Papers,1.00 Folder
MA 2019-09,Craig Mountain Railway Company Conductor's Cash Fare Slip Booklet,1.00 Folder
UA 2015-09,Creative Services Records,0.10 Cubic_feet
MA 1997-06,Daily News Photographs,0.50 Cubic_feet
UA 1989-61,Dairy Science Photographs,1.00 Cubic_feet
MA 2019-01,Dale Gentry papers,0.50 Cubic_feet
MA 2016-24,Dan Bukvich Collection of Vibraphone Mallets owned by Lionel Hampton,1.00 Cubic_feet
UA 1999-13,Dan Gager Papers,0.50 Cubic_feet
MA 2011-27,David Engerbretson Papers,7.00 Cubic_feet
MA 2011-43,David J. Lau Vardis Fisher Books,15.00 Volumes
MA 2010-12,David Schrader Papers,1.00 Folder
UA 2004-11,Dean of Library Records,1.00 Cubic_feet
UA 2004-12,Dean of Library Records,2.00 Cubic_feet
UA 2015-39,Dean of Students Office Records,0.25 Linear feet
UA 2001-12,Dean of Students Records,1.00 Cubic_feet
UA 2002-08,Dean of Students Records,0.50 Cubic_feet
UA 2002-27,Dean of Students Records,2.00 Cubic_feet
UA 2003-13,Dean of Students Records,4.00 Cubic_feet
UA 2004-09,Dean of Students Records,1.00 Cubic_feet
UA 2005-07,Dean of Students Records,1.00 Cubic_feet
UA 2009-04,Dean of Students Records,2.00 Cubic_feet
MA 2006-14,Dennis Baird Papers,1.00 Cubic_feet
MA 2009-34,Dennis Baird Papers,0.50 Cubic_feet
MA 2011-23,Dennis Baird Papers,Oversized
MA 2011-24,Dennis Baird Papers,Oversized
MA 2011-45,Dennis Baird Papers,0.25 Cubic_feet
MA 2012-12,Dennis Baird Papers,0.25 Cubic_feet
MA 2012-23,Dennis Baird Papers,3.00 Cubic_feet
MA 2014-16,Dennis Baird Papers,0.50 Cubic_feet
MA 2014-25,Dennis Baird Papers,Oversized
MA 2014-43,Dennis Baird Papers,2.00 Cubic_feet
MA 2014-44,Dennis Baird Papers,1.00 Cubic_feet
MA 2014-45,Dennis Baird Papers,4.00 Cubic_feet
MA 2015-10,Dennis Baird Papers,0.30 Cubic_feet
MA 2015-20,Dennis Baird Papers,3.00 Cubic_feet
MA 2015-25,Dennis Baird Papers,1.00 Folder
MA 2016-14,Dennis Baird Papers,0.50 Cubic_feet
MA 2018-10,Dennis Baird Papers,0.25 Cubic_feet
MA 2018-18,Dennis Baird Papers,2.00 Cubic_feet
MA 2018-48,Dennis Baird Papers,1.00 Folder
MA 2004-06,Dennis Baird Salmon Recovery File,1.00 Cubic_feet
UA 1997-22,Department of Entomology Records,1.50 Cubic_feet
UA 2014-03,Department of Fish and Wildlife Sciences Records,4.00 Cubic_feet
UA 2005-05,Department of Journalism and Mass Media Records,2.00 Cubic_feet
UA 2018-03,Department of Plant Science Records,4.00 Cubic_feet
UA 2013-09,Department of Sociology and Anthropology Records,0.25 Cubic_feet
UA 2009-20,Deptartment of Conservervation Social Sciences Records,3.00 Cubic_feet
UA 1999-19,Deptartment of Industrial Technology Education Phi-Chi-Theta scrapbooks,0.50 Cubic_feet
UA 1990-26,Development Office Records,1.00 Cubic_feet
UA 2002-25,Development Office Records,5.00 Cubic_feet
MA 2018-33,Dick A. Wilson Papers,0.50 Linear_feet
MA 2006-02,Dick Pugh Photographs,0.25 Cubic_feet
MA 2015-41,Dirk Kempthorne Papers,31.00 Cubic_feet
MA 1998-22,Dirk Kempthorne Senatorial Records,220.00 Cubic_feet
UA 1994-16,Disabled Student Services Records,1.00 Cubic_feet
UA 2019-59,Division of Student Affairs & Enrollment Management Photograph,1.00 Photographic Print
MA 2000-42,Dixie Ehrenreich Papers,20.00 Cubic_feet
MA 1991-53,Donald B. Robertson Photograph Collection,0.50 Cubic_feet
MA 1987-25,Donald R. Scott Papers,0.50 Cubic_feet
MA 2013-15,Donald R. Theophilus Papers,3.00 Cubic_feet
MA 2008-28,Donna Hanson Idaho Library Association,2.00 Folder
MA 1996-35,Donna Hanson Papers,2.00 Cubic_feet
MA 2002-01,Donna Hanson Papers,8.00 Cubic_feet
MA 2005-03,Donna Hanson Papers,1.00 Cubic_feet
MA 2009-06,Donna M. Hanson Papers,1.00 Folder
UA 2015-06,Donor Relations Records,1.00 Cubic_feet
UA 2020-01,Dora Mih Retirement Party photos,1.00 Folder
MA 1996-18,Dorothy S. Hole Papers,1.00 Cubic_feet
MA 2002-26,Dorothy S. Ross Papers,3.00 Cubic_feet
MA 2005-11,Duane D. Cap Davis Films,1.00 Cubic_feet
MA 1991-57,Duane LeTourneau Papers,0.50 Cubic_feet
MA 1992-02,Duane LeTourneau Papers,0.50 Cubic_feet
MA 2012-14,Duke Parkening Collection,140.00 Volumes
MA 1995-14,Dwight Hoffman Papers,0.50 Cubic_feet
MA 1995-27,Dwight Hoffman Papers,4.00 Cubic_feet
MA 1996-15,Dwight Hoffman Papers,1.00 Cubic_feet
MA 1998-21,Dwight Smithson Jeffers Papers,1.00 Cubic_feet
MA 2011-16,Dworshak Dam Core,0.25 Cubic_feet
MA 2016-41,Earl Bennett Papers,1.00 Folder
MA 1993-20,Earl E. Gray Papers,1.00 Cubic_feet
MA 2009-31,Earl H. Bennett Papers,1.00 Cubic_feet
MA 2015-06,Earl J. Larrison Retirement Scrapbook,0.50 Cubic_feet
MA 2018-36,Ed Hudson Papers,0.50 Linear_feet
MA 2010-24,Ed Mielke Photographs,1.00 Folder
UA 2016-07,Ed Rauw Argonaut Newspapers,0.25 Linear feet
UA 2016-36,Ed Rauw Collection,1.00 Cubic_feet
UA 1987-04,Edith Betts Papers,0.50 Cubic_feet
MA 2008-37,Edna Mildred Peterson Papers,0.30 Cubic_feet
MA 2007-22,Edson R. Peck Papers,7.00 Cubic_feet
MA 1997-21,Edwin Fulwider Papers,0.50 Cubic_feet
MA 1992-16,Eleanor K. Heningham Papers,2.50 Cubic_feet
MA 1999-20,Elisabeth Lapeyre Collection,1.00 Cubic_feet
MA 1989-36,Elizabeth Steinhagen Committee Reocrds,0.50 Cubic_feet
UA 2015-07,Elizabeth Zinser Wedding Fan,0.00 null
UA 2017-03,Ella Walby Collection,0.50 Cubic_feet
MA 2003-18,Elmer Paul Oral Histories,0.50 Cubic_feet
MA 2008-43,"Elmore County, Idaho Tax Receipts",1.00 Cubic_feet
UA 1993-10,English Department Computer Writing Lab papers,1.00 Cubic_feet
UA 1999-06,English Department Records,0.50 Cubic_feet
UA 1986-002,Entomology Deptartment Scrapbooks,1.00 Cubic_feet
MA 2018-37,Erma Scholtz Papers,0.50 Linear_feet
MA 2015-03,Ernest Hemingway Photograph,1.00 Folder
MA 2012-24,Ernie Jorgenson Collection,6.00 Cubic_feet
MA 2018-63,Esther Harrison Beale Diary,1.00 Folder
